식당이름,카테고리,연락처,구,상세주소,해시태그,별점,별점수,리뷰내용
성창식당,한식,,중랑구,면목로 421 (우)02146,#노포#데이트코스,3.0,4,맛나요@@카드 결제 불가@@다른 리뷰중 청결도에 대한 얘기가있었는데 심각수준...?가실분 행주랑 나무젓가락챙겨염@@@@
빈스로드 본사,카페,070-7593-7005,중랑구,봉화산로 111 (우)02048,#감성카페#데이트코스#로스팅전문#분위기좋은,5.0,5,"생딸기라떼 강추!!!!! 커피도 맛있어요@@맛,분위기,친절함 무엇도 부족함없는 곳.. 계절마다 시즌메뉴 먹으러 가는 재미가 쏠쏠^^@@커피종류가 맛있어서 자주 사먹는 곳입니다! 공간도 편하게 있다가기 좋고 다른 음료들도 다 맛있었어요. 그리고 사장님도 너무 친절하셔서 너무 좋아요!!!@@맛도 공간도 더할나위없이 좋다.@@사장님도 너무 친절하고 뷰도 좋아요! 음료도 베이커리도 다 맛있어요@@"
어느날오늘,디저트카페,,중랑구,봉화산로30길 98 삼성팰리스 1층 102호 (우)02096,#디저트카페#제로페이,4.7,10,"크림이 너무 달지도 않고 진짜 맛있어요@@케익 크림은 달지않아요. 안 단 케익 좋아하시는 분들은 좋아하실듯..  전 단걸 좋아해서 그닥 ㅜ ㅜ  레몬케이크랑 에그타르트 달달하니 맛있네요 ^^@@맛은 있는데 판매하시는 남자분 마스크를 반만 쓰셔서 안사고 돌아선 적이 몇번이나 있어요. @@여기서 처음으로 케이크 주문해먹었는데 진짜 너무 맛있어요 엉엉 상봉에 이런 케이크 맛집이있다니.. 진짜 크림이 하나도 안느끼해요 가족들이 다 깜짝놀랐답니다 여기서 에그타르트, 피칸파이 도 먹어봤는데 다 맛있어요@@완전좋아해요 @@크리스마스, 생일, 기념일 등등 케이크가 있어야겠다 싶은 날은 무조건 미리 예약해서 홀케이크로 먹습니다 ~ 진짜진짜 맛있어요. 적게일하고 돈 많이 버세요 사장님!!!! 최고최고@@케익 미쳤음. 고르기 힘들 정도로 넘 좋음ㅠ@@정말로 좋아하고 애정하는 디저트 맛집입니다.  치즈케이크는 정말 최고입니다.@@조각케익 홀케익 여러번 샀는데 항상 만족스러운 곳입니다 선물하면 반응 최고에요... @@에그타르트 속이 몽글몽글 입에서 살살 녹는게 존맛이에여@@"
먹골골목냉면,냉면,02-977-8186,중랑구,공릉로 56-8 (우)02031,#카카오페이#제로페이,3.5,12,"@@양 많고 맛있었어용 사장님도 친절하세요! 아래 사진은 회냉면 곱빼기인데 다음에는 일반 양으로 재방문 하고 싶네요!@@깔끔하고 맛있어요~@@동네에 분식점이 별로 없어서 가긴 하는데 존맛까진 아니구 보통은 하는 집..@@동네 맛집이에요 청결하고 항상 음식도 깔끔하고 너무너무 맛있어요 임산부인데 믿고 먹는 곳이에요 냉면이랑 돈까스랑 다다 너무맛있습니다 강추에요 사장님 인심도 너무 좋으세요♡@@멀리서 오신다면 굳이 멀리서 올만한 맛은 아니지만 근처에서 가볍게 한끼 때운다면 괜찮은 식당@@냉면 정말 맛있어요@@무난한 가격대에 무난한 메뉴, 무난한 맛 덕분인지 어느순간부터 점심시간이되면 문전성시를 이루는 곳. 오랜만에 바쁜 점심시간을 지나 갔더니 새까맣게 탄 감자를 내주네요. 동행인이 시킨 명태회냉면은 일반냉면보다 2천원 비쌌는데 회가 딱 세덩이. 문의를 하자 바로 새 그릇에 회냉면 몇점을 담아 대처해주긴 했지만... 처음 생겼을때 사장님이 아주 친절하시고 노력하...@@냉면은 집에서 해먹어도 될만한 맛! 근데 만두 3000원에 4개가 뭐지..먹다가 기름 튀어서 댈뻔했다..맛도 없고 ..@@인생냉면보단 그냥 냉면  맛없다는 소리는x 맛은있는데 필자는 냉면좋아해서 기대치가 안참  다른메뉴도 맛있어요~~@@멀리서 일부러 찾아올 필요는 없으나 주변이라면 아니 갈 이유가 없습니다.@@가성비로 나쁘진 않습니다. 면, 육수, 살얼음정도, 야채와 열무의 양 등등 평균이상은 해줍니다. 다만 열무 특유의 쿰쿰한 향이 조금 강했고, 소스가 제 기준보다는 좀 더 매콤한 맛이 강했습니다. 굳이 찾아가서 먹지는 않겠지만, 그 근처에서 냉면 생각이 나면 갈 수도 있을 것 같습니다.@@"
개인취향,디저트카페,010-5813-5908,중랑구,면목로55길 52 1층 (우)02217,#제로페이,4.5,4,사장님 친절하고 커피 완전 맛있네요 개인 카페에서 이태리 대기업 맛이 나네요  단골 되려고요 ㅎ @@커피맛은 보장합니다 ㄹㅇ@@커피맛남 @@@@
싱싱활어회수산시장,회,02-6398-8989,중랑구,공릉로 18 (우)02034,#제로페이,4.8,5,가성비 최고 횟집@@가성비 좋게 술 취할 수 있어 좋아요 @@@@저렴한 가격에 싱싱한 회 포장해서 먹을 수 있어서 좋네요 와서 먹을 경우 테이블비용2000원에 매운탕은 제공이 안되서 컵라면이나 오뎅이 반입가능해요 참고하세요~@@서비스 가성비 퀄리티@@
KFC 망우동점,패스트푸드,02-433-9625,중랑구,망우로 410 (우)02164,#카카오페이#제로페이,2.5,8,"11시 넘으면 치킨이 떨어졌다는게 몇번인지. 직원들 먹을꺼 챙겨가나, 한 두번도 아니고.@@이름빨에 간다@@KFC중 평타는 칩니다. 밑에 후기는 뭔  수제버거급을 바라는듯ㅋㅋ KFC는 패스트푸드점입니다..@@몇년만에 먹어보는데 개노맛. 다른 브랜드에 뒤쳐지는 이유를 알겠음. 발전을 하나도 안한 느낌. 치킨이며 버거며 다 최악이었음.  이걸 돈주고 사먹다니..ㅂㄷㅂㄷ 0점을 줄수없다는게 분할정도의 맛임 다시는 안갈듯. @@치킨이 복불복임 겁나 맛있을 때도 있고 쓰레기 같을 때도 있음@@@@다 좋은데, 치킨 좀 기름에 안쩔게 좀 해다오...바쁜건 일겠지만...햄버거에 소스 좀 듬뿍... 2018.06.13 요새 기름에 덜 쩌는거 같아 별 하나 올렸다(별 3) 2018.12.22 어떻게 된게 이놈의 KFC 알바는 고딩인지 대딩인지 모르겠는데, 방학시즌만 되면 제품을 이렇게 조져놓지??? 치킨 기름에 튀기는 시간 조절 미스로 개쩔어서 딱딱하고 쩐...@@@@"
태능가든,갈비,02-3422-2800,중랑구,신내로14길 13 (우)02067,#친목모임#회식장소#카카오페이#제로페이,2.6,8,"@@최고입니다 @@돼지왕갈비 16,000원 뼈 붙인 미국산 목전지 모양.. 국내산 맞는지..??  보통 뼈붙인 목전지는 10,000-12,000 맛은 그냥 흔한 붙인 갈비맛.   한우육회 20,000원 마늘과 잣 등으로 데코.  먹을만함. 단점은 한우육회 특징인 다른 한우메뉴 손질하고 나오는 짜투리 고기로 보통 만드는데 손질을 깨끗이 못?안? 해서 근막이 종종 씹힘. 이가 ...@@갈비는 먹을만 함 그러나 전체적으로 비싸고  밑반찬은 가지수만 많고 맛없음@@갈비맛은 좋네여@@정말 리뷰대로 직원분들이 친절하지 않습니다. 맛은 그래도 있는 편이지만 일인분 16,000원이라 생각하면 이정도 맛은 보통이지 않나라는 생각입니다. 냉면 또한 어느집에서나 맛 볼 그저그런 맛입니다.@@언제 가던 불친절하고 항상 인상쓰고 계셔서 주문하기도 싫어집니다 설거지도 제대로 안해서 식기나 그릇에 뭐가 묻어있는 경우가 다반사였고, 손 닦는 수건에도 상추나 고춧가루 같은 이물질이 대놓고 보이는데도 그냥 주시는 경우가 많았습니다 맛은 있는데 그거 빼곤 다 별로네요@@맛은 둘째치고 손님도 없를때가도 불친절한 곳.. 특히 일하시는 분이... 다들 알바인가. 인상 좀 펴시죠..불편함@@"
라화쿵부 사가정점,중화요리,010-7165-6665,중랑구,사가정로 395 2층 (우)02214,#제로페이,2.4,9,"좀불친절해여...근데 마라탕자체는 2.5단계 먹으니 존마탱이네여.....다시올듯...ㅋㅋㅋㅋㅋ@@맛있어요 마라탕을 좋아해서 사가정갈때마다 들려요ㅜ@@캐셔 하시는 분이 턱스크를 하고 계신데 너무 불안하네요 ㅠㅠ 자주갔었는데 이제 못갈거 같아요@@옥수수 면이 떡지고 불어서 나와여@@4단계인데 너무 밍밍해요@@마라 특유의 화한맛 하나도 안나고 맹해요.마스크 안끼고 있어서 좀 그렇네요,,,@@옆동네 지점보다 맛은 괜찮아서 종종 갔었는데 ㅌ최근 방문했을때 이시국에 마스크도 안끼고 조리하는걸 보고 1차 정떨 결국은 이물질이 나와서..(비닐조각) 2차 정떨 다신 재방문 안할예정 @@매운맛도 안매운느낌 그냥 무난하다@@마라탕존맛! 역바로앞에있어서 찾기도쉬움.@@"
남선반점,중화요리,02-949-4433,중랑구,중랑역로 145 (우)02012,#점심식사#친목모임#혼밥#제로페이,2.3,3,"체험단 예약 미리했고 근처에 친구가 살아서 방잡고 배달시키려는데 배민도, 가게전화도 안받네욬ㅋ심지어 휴일도 아닌뎈ㅋㅋㅋㅋㅋㅋㅋㅋㅋㅋㅋㅋㅋㅋㅋㅋㅋㅋㅋㅋㅋㅋㅋㅋㅋㅋㅋㅋㅋㅋㅋㅋㅋㅋㅋㅋㅋㅋㅋㅋㅋㅋㅋㅋㅋㅋㅋㅋㅋㅋㅋㅋㅋㅋㅋㅋㅋㅋㅋㅋㅋㅋㅋㅋㅋㅋㅋㅋㅋㅋㅋㅋㅋㅋㅋㅋㅋㅋㅋㅋㅋㅋㅋㅋㅋㅋㅋㅋㅋㅋㅋㅋㅋㅋㅋㅋㅋㅋㅋㅋㅋㅋㅋㅋ 와ㅋㅋ덕분에 방값에 다른가게에서 음식 시켜먹었습니다. 좋은...@@홀에서 먹었는데 탕수육 맛있습니다.@@요리는 잘하는데 재료가 별로에요@@"
만두향,분식,02-439-0220,중랑구,면목로74길 6-4 (우)02161,#제로페이,3.0,2,@@담배피는 손으로 만두를 빚는 집@@
늘솜,"호프,요리주점",,중랑구,봉화산로54길 36 C동 1층 (우)02067,#카카오페이#제로페이,4.8,6,요리가 다 맛있음. 가격도 음식 퀄리티에 비하면 양호함.@@맛도좋고 친절해요.@@신내동에서 제일 괜찮은 술집인 듯 합니다.  음식도 깔끔하고 맛 있어요!!! 단점은 가격이 조금 비싸네요. 가성비는 조금 떨어져요@@마싯슴@@오늘부터 신내동은 늘솜 입니다.@@안주 존맛탱@@
버거킹 망우점,패스트푸드,070-7438-6513,중랑구,망우로 400 (우)02163,,3.1,14,"매장 이용했는데 서비스 좋고 버거 개따뜻@@딜리버리 주문 오전10시반쯤 주문 90분 걸림   받자마자 기분이 .. 아침부터  분노를 배달해주셔서 고맙네요 @@와... 지금 딜리버리 막도착했는데... 청포도음료가 캐리어 비닐에 3분에1은 담아오셨네  음료 입구 왜 안막고 온건지?@@최악입니다. 밤 10시쯤 갔는데 버거를 이렇게 만드는건 좀 아닌거같네요..@@알바생인지 싸가지없음@@저는 콰트로 치즈 와퍼만 먹는 콰돌이에요. 분명 콰트로치즈와퍼를 시켰는데 그냥 치즈와퍼가 나왔네요. 이 메뉴만 먹어온지 1년이 다되어가는데 이런경우는 처음이에요! 제가 잘못주문했나 싶어서 영수증을 다시 확인해봐도 콰트로치즈.. 다른메뉴도 먹어보라고 추천해주신것같아서 따듯한 마음에 별 하나 더 드립니다.@@@@친절하고 좋아여@@개맛있어요 밑에 후기들 이해안가네요 매장 신설이라서 깔끔하고  직원도 많은지 음식도 빨리나오고 신선합니다. 야채는 자기가 추가할수있는데 뭘적다고하는지ㅋㅋ@@@@아놔 배민으로 주문 시키고 나서 배달이 왔길래 먹을려고 보니 사이다 라지로 두개 시킨 게 아예 안왔더라고요 그래서 매장에 전화해서 말했더니 안 온 사이다만 다시 배달 해주셨어요 그래서 하 드디어 먹는구나 하고 버거를 한입 두입 먹었는데 머쉬룸이라면서 버섯이 전혀 없는거예요 혹시 몰라서 버거 속을 해부하듯이 다 꺼내서 살펴봤는데 역시나 없었어요 한마디로 기네...@@걍 노말한 버거킹임@@@@중랑점 없어지고 새로 생겨서 갔더니 진짜 별로임 여태 다녔던 매장중 맛,서비스 제일 떨어짐 귀찮아도 신설점이나 다른 매장에서 포장해올 예정. 급한 사람들은 어쩔수 없지만 다른 지점 다니시던 분들은 모험 노노임 올엑스트라 시켰는데 야채는 기본급으로 적으니 급해도 올엑은 하시지 말길^^^^^@@"
홈메이드,"돈까스,우동",,중랑구,면목로 421 1층 (우)02146,#혼밥#혼술#제로페이,4.8,14,"등심카츠 …! 진짜 맛있어요. 고기 완전 제대로.  이 가격에 이퀄리티면 정말 좋은거같아요! 밥도 흑미밥이랑 미역국줘서 좋아요 ㅠㅠ  라멘도 국물찐하고 맛있었어요! @@안심먹었는데 촉촉하고 부드러웟어요 새우젓과 소금도 잘어울리고 맛있어요@@두배 내고 먹어도 안아까울것같아요^^ 등심 돈까스 진짜 맛있게 잘먹었어요~~@@고기가 두꺼운데 살살 녹아요@@이것저것 다 진짜진짜 맛있어요 ♡♡ 사장님 친절하시고♡♡♡ 정성가득음식♡♡  (근데 딱!!하나.. 돈코츠라멘..은 많이 별로예요...  개선보다는 그냥 메뉴삭제하는게 나을듯 ㅠㅠ)@@맛있게 잘먹었습니다~~@@@@맛은 진짜 정갈하고 깔끔하니 좋은데 양이 무슨 유아용...@@친절하시고 맛있음. 저녁에 방문에서 치즈돈까스가 다 나가서 아쉬움ㅜㅜ.  2번째 방문 치즈돈가스먹음 크기가 좀 작아서 아쉬웠지만 맛있뜸~@@토마토해장라면  살짝 매콤하지만 존맛탱입니다  돈까스는  모둠으로 시키시면  좋아요  여러가지  맛볼수  있어서  가끔  혼술하러  가는곳입니다  좋아요@@돈까스와 라멘이 둘다 느끼해보여도 조합이 은근 괜찮습니다 이근방에 돈까스 제대로 하는집이 없어서 여기가 젤낫네요 치즈돈까스는 4조각 나오는데 갯수로만 보면 적어보여도 4개가딱 적당한게 먹다보면 그이상은 느끼해서 먹기 어렵습니다@@깔끔하게 잘 나와요  찾아가서 먹을 정도는 아님 @@@@포방터 연돈은 못가봤지만, 비슷하거나 그 이상이 있다면 여기라고 확실히 말할수있습니다. 등심가스 진짜 맛있고 소금찍어먹길 부르는 맛인데 진짜 소금.새우젓도 찍어먹 습니다. 진짜 맛있고..  연달아 치즈가스도 추가로 시켜서 먹었근데 포방터처럼 생기고 쭉쭉늘어납니다. 치즈 절대 안끊어짐 ㅋㅋ 전통시장 옆이라 포방터처럼 맛있는건가 ㅋ  밥도 굉장히 좋은 쌀 쓴게...@@"
스타벅스 묵동점,커피전문점,1522-3232,중랑구,동일로 952 로프트원오피스텔 1층 (우)02033,,3.5,8,가본 스타벅스 지점들 중에서도 손꼽힐 만큼 친절하시고 혼자 방문했을 때 이용할 수 있는 좌석 종류가 많아요 :) 라떼 류는 연하게 타주시는 편인 것 같긴 합니다!@@넓고 자리가 많지만 책상이 다 작음. 노트북 하나면 차는 원형탁자들.   커피맛이 다른 곳보다 연함  직원들 잘생기고 친절함  @@친절하심다^^@@이른 시간에 와도 음료 늦게 나옴 ㅜㅜㅜㅜ@@여기 커피가 너무 연해서 조리퐁과자 우유에 타고 우려낸 우유같았습니다....@@3651별 @@쿨라임 피지오를 주문하니 ‘피지오 안돼요’ 왜 안되느냐 물으니 ‘저희 매장은 원래 안돼요’  ...  얼마 전 인터넷에서 어떤 기계 수급 문제 때문에 일부 매장에서는 피지오 메뉴를 제공하지 않는다는 뉴스기사를 본 게 얼핏 기억이 나서 다른 걸 주문하긴 했지만 직원의 응대가 매우 아쉬웠습니다.   이러이러한 문제 때문에 해당 메뉴는 주문이 불가하다고 안내하는...@@@@
가고파설렁탕,설렁탕,02-434-5677,중랑구,봉우재로 200 (우)02174,#노포#제로페이,4.0,1,@@
설빙 상봉점,디저트카페,02-6380-0707,중랑구,망우로 204 2층 (우)02120,#제로페이,3.3,6,@@@@양은 신기하게 포장하면 많아요 넉넉히 많이 주시는거같은? 홀에서 먹을땐 부족한거 같은데  그래서  매번 가면 포장합니다 홀 넓고 시원해요 @@포장 주문했는데 뒤에 온 사람들부터 주더니 20분 뒤에서야 주문했던 거 다 떨어졌다고 더 비싼 메뉴로 바꿔 주문하라는 횡포 시전.. 다른 지점으로 가기를 추천합니다@@@@요 메론빙수를 평가하자면... 그냥 그랬어요! 괜히 비싸기만 하고 차라리 다른 빙수를 먹는게 더 좋을 듯!@@
커피빈 상봉역점,커피전문점,02-493-8902,중랑구,망우로 291 1층 (우)02098,#공부하기좋은#카카오페이,4.3,3,"카페 넓음 화장실이 좀 불편,@@@@화장실은 안가봤는데 음료가 맛이 이상해서 보니 자주 안먹던 음료라 원래 이런가 하고 다시 먹어보고 검색해보고.. 결국 가져가서 물어보니까 금방다시만들어주셨고 파우더를 잊으셨다고 하셨어요. 다시만든건 맛있었어요@@"
세컨드고메,이탈리안,02-975-8645,중랑구,동일로 927 2층 (우)02005,#데이트코스#제로페이,3.1,7,"이동네서 리조또 만오천원은 좀.. 맛이라도 있으면 모르겠는데 다 남김.. 걍 하루한끼보고 내가 해먹는게 더 마싯을듯..@@나오는 음식이 맛이나 양에 비해 엄청 비쌉니다. 다른 데서 이 가격에 피자 주문하면 상당히 큰 피자 나오는데 여긴 절대 크지 않습니다. 꽃게 파스타 주문했는데 꽃게는 오래보관 했던 탓인지 속이 까맣고 파스타 양은 거의 장식 수준입니다. 맛은 좋지도, 나쁘지도 않고 평범합니다. 테이블 상태 흔들리고 좋지 않습니다. 무엇보다 종업원이 매우 불친절합니다. @@음식도 괜찮고 분위기도 좋고 깔끔했는데 서비스 마인드가 없는 직원.. 추가주문하고 피클요청하는데 알아들었으니 대답을 안하고 그냥 갖다주는건지.. 표정은 짜증가득.. 어찌나 안좋은지 먹으면서 눈치보긴 또 처음이네요.. 마지막에 사장님이 서비스 드리라고 했다면서 디저트 주는데.. 기본 서비스가 안된 직원때문에 찜찜하게 나왔네요 서빙직원이 서비스 마인드만 갖춘다...@@@@좋아용@@@@동네 퀄리티가 아닙니다.  맛도 보장되고 북적거리지않아 좋습니다.  식전빵이 특히 맛있습니다.@@"
이모네곱창,"곱창,막창",02-979-0570,중랑구,동일로 778 1층 (우)02088,#제로페이,,,
신마루매운갈비찜,갈비,02-495-7897,중랑구,사가정로42길 19 (우)02237,#노포#점심식사#제로페이,5.0,5,맛 다르게 시키니까 1인용으로 주셨는데 맛있어요 고기도 잘빠짐!@@와 진짜 맛있어요 깔끔하게 매운맛  고기 질도 정말 좋고 저렴하고 단골할거에요@@@@매운갈비찜 오랜만에 생각나서 간만에 갔는데 여전히 맛있내요 맵기도 적절하고 간도 적절해서 맛있게먹었습니다.  사장님도 친절하셔서 좋았습니다^^ 마스크 안 벗고 대해주셔서 더 좋았습니다.@@맛있습니다. 진짜 맛있어요. 반찬 깔끔하고 갈비찜 고기 냄새도 안나고 동네 숨은 맛집이네요. 먹을 수록 진한 맛이 올라옵니다. 강추입니다@@
바다를 삼킨 활어,회,02-494-0220,중랑구,봉우재로 114 (우)02143,#제로페이,4.0,8,"힘내세요 ㅠㅠ 좋은날 오실껍니다. 반드시@@친정어머님 생신으로 5남매 가족이 다 모여 식사를 했는데, 다들 만족해 했어요~ 일단 스탭분들도 친절하시고 가족수가 25명 되었는데 잔주문이 많았음에도 불구하고  매번 웃어주시더라구요. 감사. 음식맛이야 말할것도 없지만,  친절과 상냥함은 오래기억이 남을것 같네요.@@눈에 확 띄는 간판에.. 무심코 들어가 오랫만에 푸짐하게 잘 먹은 최고의 횟집이네요. 회가 부드럽게 살살 녹아서 깜놀... 진짜 말 없이 먹느라 정신없었네요. 조만간 또 갈듯.@@친구들과 다녀와 가격이며 회상태며 서비스가 좋아 가족들과 두번째 방문했는데 부모님께서도 매우 만족해하셔서 조만간 재방문예정이예요.  회신선도가 좋아 십히는 식감이 좋아요. 그리고 무엇보다 기본이라는 스끼가 식사한끼는 될정도로 꼭 먹을것만 나와 스끼먹는맛도 즐길 수있었어요. 깔끔한 인테리어와 친절한 서비스덕에 기분좋은 장소로  집과 가까운곳에 있어 종종 찾아...@@회 별로 안좋아 하지만 나름 스끼 깔끔하고 정갈해서 만족했네요 초고추장맛으로 회맛을 결정(?) 하지만 ^^;; 광어는 쫀득하니 식감이 저도 알 정도로 좋았구요~ 저보다도 같이간 친구들이 재방문 요청할 정도로 가성비 굿이었습니다 사장님 새우튀김 서비스 감사합니다 ㅎㅎ@@나름 회에 쫄깃함도 있고 매운탕은 감칠맛 나내요~~~~ 이동네 이만한 횟집도 없을듯~~~~@@개 맛없음 스끼다시부터 맛없어서 회는 맛있겠지했는데 회상태도 안좋음 매운탕으로 입가심할랬더니 매운탕도........@@최악입니다... 알밥은 술냄세가 나고 연어초밥은 탄력이 하나도 없고 언니들은 눈에서 레이저 쏘고... 알밥에 말만...많고... 이런 음식 처음입니다...@@"
금화왕돈까스 용마산역점,"돈까스,우동",02-433-7333,중랑구,"용마산로 248 1층 101, 102호 (우)02257",#경양식요리#제로페이,3.4,8,"ㅠ 고기 너무 얇어요ㅠ 크기가 작아지더라도  좀 고기 씹는맛이 있었음 좋겠어요 스프는 맛있었어요 눈꽃 치즈를 듬뿍 올려줘서 괜찮았고 매운소스도 괜찮았어요 모닝빵은 기대보다 안어울렸어요 먹다보면 목메여서 장국이 생각나요 스프말고도 장국도 있으면 좋을거 같아요@@@@방문한지 좀 됐는데 일요일 오픈시간에 20대 초반으로 보이던 남자알바생이 너무 불친절했습니다. 손님 있는데 소리지르면서 시끄럽게 떠들고, 주문도 제대로 받지 않았구요. 맛은 그럭저럭 괜찮았는데 기분이 너무 나빠서 다시 가고 싶은 마음이 안 들었어요@@양이 진짜 많네요! 맛은 특별하지는 않지만 전형적인 돈까스 맛이라서 전 맛있게 먹었습니다. 재방문의사 있어요@@함박이랑 카레돈가스 먹엇는데 함박은 초딩때 머것던 급식 햄버거 저질패티 맛 돈가스는 완존 옛날 얇은 고기가 안보이는 딱딱한 돈가스.. 튀김인지 돈가스인지.ㄷㄷ 9천원이나 내고 먹을 퀄이 아니네요 크기만 크고 노맛.. 여태 먹엇던 돈가스중에 최악이에요@@접근성이 좋아서 오픈했을 때부터 자주 다니는 곳  소스가 맛있어서 한 번씩 생각남  예전에 쫄면 줄 때도 좋았는데.. 등산 다녀와서 먹기 좋음 방문 명단 작성 제대로 안하는건 좀 염려스러운 부분..@@엄청맛있고 친절해요.양도 푸짐 가성비 최고!@@맛있는데.. 양이 진짜 많아요ㅎ@@"
두루두루베이비카페,키즈카페,070-4225-2626,중랑구,동일로154길 17 1층 (우)02039,#점심식사#카카오페이#제로페이,5.0,2,음식맛.커피.음료 다~ 맛있구.아담하고 깨끗하고 딱! 좋은곳이네요. 이벤트도 많구~ 강추 합니다^^♡♡@@@@
제주은희네해장국,해장국,070-7677-8331,중랑구,망우로 431 (우)02072,#제로페이,3.7,6,"진짜 푸짐하고 맛있습니다-! 가격이 싸지지는 않지만, 내용물은 정말 알차서 돈 아깝지 않습니다! 국물도 끝내주고, 특히 다진마늘을 넣어 먹으면 개운합니다-!@@속이 확 풀립니다@@해장국은 최고예요. 돔베고기는 오픈할 때보다 맛이...@@그냥 괜찮아요@@별로예요@@해장하러 왔는데 소주를 부르는 맛! 해장국 9천원은 적당한 가격!! 속이 확 풀리네요~@@"
디저트39 묵동자이점,디저트카페,02-976-1090,중랑구,동일로 932 묵동자이아파트 201동 101호 (우)02033,#디저트카페#제로페이,4.0,2,@@아메리카노는 저렴한 편이라(1500) 부담없이 얘기하기 좋은곳. 케익류는 상태가 일정하지 않은듯. @@
원박사소곱창,"곱창,막창",,중랑구,봉우재로33길 31 (우)02154,#제로페이,5.0,2,"제대하고 군대친구 따라서 곱창이란것을 처음 먹어봤고, 나에게 새로운 세계가 열렸다.@@@@"
이종구낙지세상 신내점,"해물,생선",02-493-3908,중랑구,봉화산로52길 59 (우)02069,#제로페이,4.5,6,@@그냥 갈곳없어 가는 곳  @@@@내 인생 맛집ㅜㅜㅜ 명태 살도 많고 양념도 진짜 맛있어요. 나물이랑 김에 싸 먹으면 그냥 존맛탱입니다. 어제 갔는데 오늘도 가고싶어요..주륵 다 먹고나서 처음부터 다시 시작하고 싶은 맛ㅜ 모든 메뉴가 맛있으니 다 시키세여@@지금까지 이런 맛은 없었다! 이것은 명태인가 낙지인가 존.맛.탱!!@@정말 맛도 좋고 가게 분위기도 좋고 청결한 점이 가장 좋았아요! 사장님도 짱짱 +_+!! 자주 갈게요~~ 또 갈게요!!@@
