식당이름,카테고리,연락처,구,상세주소,해시태그,별점,별점수,리뷰내용
대성정육식당,"육류,고기",02-412-2292,송파구,석촌호수로12길 1-6 (우)05564,#정육식당#제로페이,3.4,14,"정육식당치고 좀비싸긴한데 고기맛 아주 괜찮고 찬 깔끔하게 잘 나옵니다 이모님들 친절하시고 비냉이 아주 맛있어요@@꽤 맛있음..@@가성비 대비 별로네요. @@가격대비 고기의 질이 좋지 않았음. 투플이라고 하는데 마장동에서 먹은 투플과는 너무 비교됨... 그리고 식당 내부 환기가 아예 안 돼서 한번 다녀오면 모든 옷에 고기냄새가 매우 심하게 베어있음... 두번은 안 갈것 같음@@'대도식당' 스타일의 정육식당. 한우의 육질이 뛰어나고 가성비도 훌륭하다 ~ 살치살, 등심, 안심@@소고기는 맛있는데 위생이 문제인곳@@@@@@@@@@1++한우를 괜춘한 가격에 맛볼수 있는 곳! 이집 고기 맛나네~ㅎㅎㅎㅎ 간만에 소고기 맛별로 골고루 즐겨서  넘넘 좋다 히히^^@@고기 질이 좋아요. 사장님 서비스도 좋고. @@@@@@"
스시미노루,"초밥,롤",02-418-7711,송파구,백제고분로 508 (우)05627,#데이트코스#회전초밥,2.6,23,"회전초밥인데 점심에는 회전초밥도 아니고... 주문하는건 수기로 적어서 직원 주고 받아야하고... 가격도 싼 것도 아니고..이럴거면 왜 여기서 먹지? 동값에 초밥집 가면 더 퀄리티가 좋은데?@@이정도면 훌륭하쥬. 배우 우희진님도 보고 좋았어요~~@@@@주문지도 제대로 없고 주문 한 스시의 절반 밖에 주문이 안들어감. 구두로 주문을 기본 2-3번은 말해야합니다. 정말 밥먹으러 같다가 고구마 10개 얹혀서 돌아온 기분이네요. 재방문의사가 전혀 생기질 않는 곳.@@스시가 신선하고 맛있어서 항상 방문하고 있어요 직원분들도 친절하셔서 가족끼리 가기 좋습니다!@@자주 가는곳. 맛있음@@근처 초밥집이  거의 문닫고해서  갔던곳 일단 초밥이 크고 두툼한건좋으나  상태는거의익혀야하고 그리고 가격이  몇접시 안먹었는데  ㅎㄷㄷ  프리미엄도 아니고 그냥 회전초밥집인데 가격이  비싸요@@점심정식 회 말랐음.  초밥의 밥도 푸석. 튀김은 해놓은거 데워줌. 미지근했음.@@초밥 종류 이 정도 다양하게 나오는 집 흔지 않은 거 같습니다. 재료의 신선도와 맛도 괜찮고요. 다만 접시마다 가격이 달라서 의식하지 않으려해도 자꾸만 접시 컬러에 신경쓰게 되네요~^^@@@@맛과 종류 대비 가격이 과함@@처음 가봤는데 이정도 맛 치고는 가격이 넘 비싼듯...@@솔직히 별로임. 그리고 가끔 사장인지 종업원이지 밖에 나가서 소리를 고래 고래 질러서 체할뻔함.@@오랜만에 찾았는데 전에 비해 가성비가 좀 별로네요.@@여기 회덮밥은 혜자라서 두개남김.  근데 오늘 냉소바 나오는거 보구 깜놀 아무리 작은거(7,700원)라도  이건 좀 너무 심하지 않나;;; 매우 실망스럽 ㅜㅜ  7,000원짜리 뷔페가도 이것보단 잘나옴 ... 맛잇는 것도 아니고  아예 팔지 않았으면 합니다   @@적어도 내가 알기엔 회전초밥집의 묘미는 눈앞에서 여러 종류의 초밥이 지나갈때 이런저런 고민하면서 골라먹는 재미 아닌가. 3시 브레이크 타임이라고 2시에 입장한 고객앞에 빈레일만 돌리고 고객이 주문하는 것만 대응하는건 무슨 의도인지 뻔하지않은가. 단골까진 아니어도 5년이상 여길 다녔는데 사장이 바뀌었는지 변했다. 비추.@@런치 세트 가성비 굿. 맛은 무난하게 괜찮은 편임@@점심에 갔는데 사람이 적어서 금방금방 나오니까 좋았음  회를 두껍고 크게 해줘서 맛있었음  아쉬운점은 우동이 면에 국물이 덜 스며들어서 따로먹는 느낌이고  면에서 비리누맛이 남@@주말저녁에 손님이 꽉 찼는데 레일이 텅텅 비어있음 물론 바로바로 만들어주는게 더 좋지만 신선한 것도 아님....종류도 적음@@032619 화요일 오후 7시에 도착! 생각보다 회전 레일이 길어서 속으로는 (하아.. 왠지 앞사람들이 접시 다 빼면 먹을께 없겠구나 새로 만들어서 주면 좋지만 그래도 회전초밥은 먹고 싶은 접시 집어서 먹는 맛인데...) 생각을 잠시 했었습니다. 가격은 좀 쎕니다. 1650원부터 사진에는 11000원! 추가적으로 더 비싼것도 있습니다.  맛은 횟감을 바로 ...@@나가사키 짬뽕이 최고였어요. 스시도 맛있었는데 짬뽕이 생각나네요. 둘이먹고 7만원넘게 나왔습니다.@@햐~좋죠 자리도 넓고 신선하고 마트 싸구려 초밥과는 완전 다르죠 가격은 비쌉니다 @@@@"
파오파오 새마을시장본점,분식,02-412-9198,송파구,석촌호수로12길 22 (우)05559,#제로페이,3.8,44,"새우만두 존맛탱@@지금도 맛있는데 옛날만큼 못하다니 그맛이궁굼..ㅠ@@예전에는 새우가 탱글하고 정말 맛있었는데 그냥 평범하고 그저그런 만두맛이네요.. 새우만두라기엔 고기만두에 가깝고 새우가 없는 것도 있었어요;;@@예전에는 맛있었는데 말이죠@@가성비 나쁘지 않아요~@@짱맛..............!!@@@@맛있는 편입니다. 감동까지는 아니었습니다. 하지만 맛있는 건 맞습니다.@@택배로 받았어요. 모든 만두의 식감이 좋은데 고기만두 식감은 한번 더 생각 할 만큼 좋아요. 김치만두는 칼칼한 편이에요. 새우 만두는 약간 식었을 때 더 맛있었어요~ @@그냥@@엉엉 장사 계속 해주세요!! 김치만두 유목민 여기 정착합니다!!@@맛있네요 2명이서 3종류 2세트씩 시켯다가 배부른데 하나씩 더 사서 먹었어요@@저는 첨먹어봤는데 맛있네요 맛이 변했다그래서 걱정했는데 이게 변한거면 예전엔 얼마나 더 맛있었던건지?ㅎ 새우완전 탱글탱글 맛있고 보통은 고기랑 김치면 고기가 좋은데 여긴 김치가 더 좋네요ㅎㅎ 고기는 약간 심심했어요@@잘 못먹겠음.@@맛 완전 변함.. 옛날이 진짜 맛있었던 듯. 이제 안갈래요ㅠㅠ 고기만두 김치만두는 아에 비추@@저는 그냥 그랬어요 요즘 맛있는 만두가 워낙 많아서.. 집에 포장해오니 식어서 엄청 맛있는지는 모르겠더라고요@@위에분께서 몇년만에 다시 드셨더니 예전만 못하다고 그러셨는데 저도 공감합니다. 생활의달인 처음 나왔을때보다 맛이 좀 못하지만 그래도 다른곳 새우만두보다는 먹을만 한곳@@만두는 여기가 최고...@@이 동네 살아서 가끔 가는데, 처음에 한 십년 전에 저 새우 만두 먹었을 때는 진짜 세상에 이렇게 맛있는 만두가 있나 싶었는데 몇년 외국 나갔다가 들어와서 다시 먹으니 예전만 같지 않네요. 맛이 변한건지 제 입맛이 변한건지 모르겠지만요..김치만두나 고기만두는 다른 데보다 더 나은건 잘 모르겠고, 뭐 그래도 새우만두는 왠만한 다른 집들 만두보다는 훨씬 맛있습...@@제로페이 상품권 가능해요@@가야는이유 : 야구장이 아니더라도 먹을만한 만두 안가는이유 : 가장 빨리 먹는게 관건  만원팩 : 만두피가 두꺼운건지 찰진건지 속이 없는편이 아닌데 피 맛이 많이남, 그럼에도 가격 생각하면 꽤 괜찮은 맛과 양@@만두 진짜... 멀리서 찾아갈 만 하다@@먹을만~~ 먹는 장소가 제공되지 않아 단점@@@@내가 먹어본 만두 중 제일 맛있다!@@@@속이 알참 ㅇㅇㅇ 4000원인데 만두 9개면 개당500원도 안됨. 새우 아직 안먹어봤는데 새우 먹으면 또 후기 남길게요. -19.07.21@@@@통새우가 통째로들어있고 맛은 괜찮음 다만 매장식사불가,포장만가능^^@@새우만두는 괜찮은데 아즘마 성깔땜에 안감.@@"
미성양꼬치,양꼬치,02-422-3358,송파구,올림픽로32길 19-6 (우)05547,#회식장소,2.7,13,"@@맛이 겁나 있으면 2점 줬다. 그냥 실수로 주문 누락됐으면 인정하지 핑계대고 거짓말하고 그러다 걸리니까 손님인 내 잘못인거마냥 에휴...@@@@원래단골집, 오늘첨으로 먹엇는데 향라대하 존맛임.....@@음식에서 비닐 나옴.@@양꼬치는 그냥 보통이고 요리도 맛없었음 여름인데 가게 안이 찜통@@꿔바로우 나오는 데 엄청 오래 걸립니다. 저희 뿐만 아니라 다른 테이블에서도 항의 엄청함. 그리고 물컵 달라고했더니 인원수에서 하나 빼고 주고 반찬 리필해 달라는데 알겠다 하고 가서 안해주고 꿔바로우 언제 나오냐했더니 '금방 나와요'라고 기분나쁜 표정으로 대답하는 직원의 태도. 서비스가 마음에 들지 않네요. 가격이 싼 것도 특별히 맛이 좋은 것도 아닌데 서...@@꿔보로우 / 모듬꼬치 / 칭따오 / 하얼빈@@양꼬치는 보통인데 마라탕이 맛있다@@양꼬치 양갈비는 잘먹었어요. 온면은 별로.@@서빙 하시는 분이 중국인 같은데, 서비스가 안좋습니다. 음식이 안나오고, 물어보면 그 순간 동의없이 주문이 들어가네요..@@특별하지도 않지만 그렇다고 딱히 모자름도 없는 양꼬치집@@양꼬치가 처음일때는 그냥 소금구이 권합니다 만두도 수제라서 기가 막히죠 캬~@@"
오붓식당,이탈리안,02-6339-6232,송파구,위례광장로 120 상가동 203호 (우)05852,#경양식요리#카카오페이#제로페이,4.0,22,"@@매운크림 쉬림프 파스타 국물 자작하니 맛있었어요! 함박스테이크도 수제라 기대했던 것보다 크고 맛있었어요 전체적으로 양도 많고 좋았습니다 그런데 매장이 조금 춥고 뷰가 없는 게 아쉽네요!@@함박스테이크 고기도 진짜 부드럽고 양념도 너무 강하지않아서 좋았어요! 특히 찍어먹으라고 주신 감자? 그거진짜맛있어서 양 좀만 더주시면좋을것같아요..!!! :) 스파게티도 면 탱글하니 아주 만족스러웠습니다 잘먹고가요~!@@@@분위기내서 먹을만한곳은 아닌듯 함박스테이크 별로 명란 파스타 보통 @@@@@@위례신도시에서 햄버그스테이크로 유명한 #오붓식당. 시그니처메뉴인 #오붓함박 과 #갈릭소고기덮밥 을 먹었는데 함박의 경우 고기의 어떤부위와 배합비율을 썼는지 몰라도 일반 함박과 비교해서 고기의 향과 고소함이 매우 우수. 덮밥은 우리가 예상하는 불고기 덮밥과 유사함. 한번 가볼만한 곳!@@맛있어서 자주 이용합니다~@@맛있어용 ㅋㅋ@@짬뽕파스따 꼭 드시요@@@@주인이 바뀌었나요? 최애 맛집이였는데 요즘엔 영 별로네요.. @@@@@@완전 맛있어요. 4개 시켰는데 뭐하나 부족한 것 없이 다 맛있네요. 배부르게 먹었는데도 기름지거나 더부룩한 느낌 없이 깔끔했어요. 밥이랑 소스는 무료 추가 가능한데 밥 조금 더 달라고 해서 먹었어요 ㅋㅋㅋ 저는 실내에서 먹었는데 테라스 있어서 밖에서 먹어도 요즘날씨 시원하고 좋을 것 같아요. 사장님 번창하세요!@@갈릭 소고기 덮밥 맛있음!@@오므라이스는 별로고 짬뽕 파스타는 특이해서 괜찮네요@@함박도 파스타도 넘 맛있네요 ~~ 칼큼하고 진한 맛..  분위기는 휀시하지는 않지만 조용하고 이름대로 오붓, 그리고 많이 친절하시네요@@@@@@@@"
램플러스 신천점,양꼬치,02-6014-0097,송파구,백제고분로9길 36 1층 (우)05563,#친목모임#제로페이,3.4,13,"쏘쏘.@@양갈비 냄새도 안 나고 육즙을 머금고 있음 반찬, 온면 괜찮음 온면 좋아하는 분들은 알겠지만 가게마다 맛이 다르고 특색이 있음 가게마다 된장찌개 맛이 다 다르듯.. 여긴 전형적인 대기업의 맛임 맛있긴 함 일하는 분들 중 몇명은 턱스크 쓰고 있어서 좀 그랬고 친절하진 않음 다른 양갈비 가게보다 가격대는 있는 편 이거저거 신경 안 쓰고 맛있는 양갈비 먹고싶은 ...@@@@@@선한영향력가게@@감사합니다^^@@알바분이 출근하기 귀찮으시데요@@@@알바생 심히 불친절 댓글 달아본적없는데 굳이 로그인까지해서 댓글담@@개업하고 1년 이상 지났지만 꾸준히 친절한 가게 분위기가 매력적인 가게입니다. 맛도 말할 나위없이 좋고 위생적인 가게 상태 또한 매번 방문할 때마다 만족스럽습니다!@@냄새나고 너무 맛없어서 양고기 환불 받고 나왔어요 ㅠㅠ @@양꼬치 한메뉴는 괜찮았다. 양갈비꼬치 냄새 많이 남. 꿔바로우 옥슈수 온면 평균 이하. 과장된 손님 인사도 부담스럽고 열정에 비해 메뉴 미스가 있었고 그닥 비추@@잠실새내에서 양갈비드시려면 여기!! 퀄리티와 서비스 굿!!@@"
시그니엘서울 비채나,한정식,02-3213-1260,송파구,올림픽로 300 81층 (우)05551,#가족모임#돌잔치#상견례#점심식사#정갈한느낌#코스요리,4.2,31,"@@제가 갔던날은 날이 흐려서 뷰는 잘 안보였지만.. 그래도 분위기가 매우 좋았고, 룸이 아니더라도 좌석간에 거리가 꽤 있어서 제법 프라이빗하게 식사할 수 있어요. 음식은 나쁘지 않았습니다! 구성도 괜찮고요. 그리고 다른 무엇보다도 직원분들의 서비스가 정말 훌륭합니다.@@룸으로 예약하면 상견레 자리로 딱이에요!! 미세먼지만 없다면 뷰도 맛집..@@뷰 좋고, 서비스도 좋고, 식기류와 식사 구성까지 완벽..! 부모님 모시고 오고 싶은 곳!  맛은 사실 특별한지 모르겠고 속 편한 맛이었음 @@분위기와 서비스는 너무 좋은데 맛이 아쉬워요ㅠㅠ@@일단 뷰가 좋아서 ㅎㅎ 그리고 진짜 밥과 소 맛집인 듯! @@매우친절함. 음식하나하나에 정성가득하고 후식까지 맛있음. 다시 가고싶을정도로 만족함. 근데 맥적구이는 너무 평범한맛. 다른메뉴로 대체해보심이 어떨런지..@@2018년 7월 말 주말에 방문했는데 전화 예약이라 네이버에 리뷰를 남길 수 없어 벼르고 벼르다 이제야 리뷰를 쓰네요.  남자친구의 생일을 기념하여 부족하면 추가 주문을 할 생각을 가지고 편한 복장(청바지, 흰 반팔)으로 주말 런치를 예약해서 방문했습니다. 뷰가 잘 보이고 입구와 조금 가까운 자리에 안내받아 앉은 후 처음에 바로 건네주는 메뉴를 보면서 “부...@@@@@@서빙해주시는 분이 정말 편하게 서비스 해주셨음. 설명도 잘 해주시고. 재료와 조리과정만 들어도 가격대가 납득됨. 근데 맛이 빼어나지는 않음. 한 번 경험해봐도 나쁘지 않다 정도.@@음.. 뷰를 잘 보는 편이 아니라 가격 대비 좀 그랬음. 분위기 낼 때 가세요 ㅜㅜ@@특별한날, 특별한음식, 특별한장소@@서비스 음식 분위기 좋았어요 @@룸을 이용해서 만족도가 더 높습니다 가격대도 괜찮고 음식맛도 나쁘지않아요 특별한 날에 이용해봄도 나쁘지않습니다@@@@고기류는 전부 별로였어요.  다른 음식들은 만족합니다@@산천 점심 코스 먹었고, 친절하시고 서비스가 좋네요. 쌀이 맛있네요ㅎㅎㅎ@@맛도 좋고 분위기도 좋습니다 가격이 ㅠ@@Michelin Guide ⭐️  Modern Korean Course  by 광주요 + 전 광식 Chef  정식당과 함께 접대장소@@분위기 전망 인테리어 서비스 편리함 최신식 자동 편의시설.. 모두 너무너무 좋습니다. 5점 만점. 최고임. 그런데 맛은 여기가 미슐랭? 이라고 의구심이 들 정도로 좀 평범. 그래서 별 두개 깎습니다.@@상견례릉 하고 왓어요 서비스도 좋고 음식도 맛있고 누구는 가격대비 별로다 라고 하지만 이정도 서비스에 음식이면 이가격 받을만 합니다 감사합니다@@압도적 전망. 단아한 플레이팅과 담백한 음식. 과하지 않은 한식. 친절함@@새우 완자... 기름에 튀긴 작은 보리새우를 가지고 겉면을 코팅... 미쳤나요? 맥주집 새우 안주도 아니고...@@유명하다는 한정식집은 거의 가봤는데 그중 맘에 드는곳~^^@@시그니엘. 미슐랭 1@@@@@@훌륭함.@@블루스퀘어 왔다 우연히..@@"
라치오,이탈리안,02-400-3031,송파구,동남로4길 20 (우)05806,#데이트코스#점심식사#제로페이,3.7,31,"저는 쏘쏘 했어요.. 막 맛있지는 않았음@@음식은 정말 무난하게 맛있어요  가격과 양이 정말 혜자에요! 런치세트가 3만6천원인데 메뉴가 3개에 둘이서 먹기에 너무 벅차더라구요 세명이서도 먹을만한 메뉴입니다@@@@손님은 5 테이블 뿐이고, 정신없는 상황도 아니며, 동시에 주문한 사람도 없는데 우리 테이블 주문 빼먹음. 원래 늦게 나오나보네 생각하고 기다렸다가 30분 지나도 기별도 없길래 물어보니 그제서야 헐레벌떡 만들어서 5분만에 음식 나옴... 사람이 많았으면 이해를 하는데.. 테이블에 음식도 없는 사람들이 30분동안 멀뚱히 앉아있으면 이상하게 생각해야 되는거 아...@@나도 알지롱@@와 진짜 맛있어요 또 가고 싶어요 진짜 맛있어요 강추강츄 진짜 꼭 가보세요 진짜로@@나만 아는줄 알았는데 나빼고 다 알던곳@@가격은 다소 저렴한데 맛나요@@맛있긴한데 위생을 조금 더 신경 써 주시면 좋겠어요..빠네먹다가 머리카락이 나오고 오므라이스에서 비닐이 나왔거든요..@@@@옛날부터 다녔는데 지이이인짜 맛있어요 ㅜㅜ 문정동의 보물입니다 @@2인 세트 3인분 양 맛도 맛있어요~@@아쉽게도 가격은 상승 맛은 하락@@잘먹고가요^^@@갈수록 올라가는 가격과 반비례하여 떨어지는 서비스@@7년 단골. 맛있음 특히 크림류 추천. 가격도 합리적임@@네이버에 검색해서 찾아간 곳인데 분위기도 캐주얼하고 음식들이 제 입맛에 맞아서 대만족 특히 빠네 너무 맛있네요~  < 2인 주문 메뉴 > ​Set C ￦48,000 ( 하우스샐러드, 빠네크림파스타, 채끝등심스테이크, 에이드 2잔), 씨푸드토마토파스타 ￦12,500 ​= Total ￦60,500  #권꽁치 #꽁치필름 #꽁치그라피  #문정동맛집 #문정역맛집 #...@@나에게 파스타의 길을 열여주었던 라치오.. 그러나 이젠 창렬이 되어버린 라치오.. 안녕.. 라치오..@@맛도 있고 가성비도 괜찮은데 항상 갈때마다 기분 최악돼서 나옴 여자 알바가 싸가지 없게 한다거나 여자 알바 친구들이 와서 시끄럽게 떠들면서 민폐 부리고 감. 갈때마다 민폐 요소가 하나씩 있어서 맛은 있는데 가기가 싫어짐@@가성비 괜찮은 맛집@@맛 진짜없음.여종업원 불친절.도대체 요즘 저렴이파스타도 여기보다 나음.가지마@@아주 맛있어요@@@@아마트리치아나 가 이렇게 매운건가.   위에서 부르릉이 느껴질 정도.   사장은 스마트폰이나 보고있고  쌀쌀맞고 손님응대 꽝  물 달래야 주는 건가?   음식은 그나마 괜찮으나  다시 가고 싶진 않음. @@가성비 좋은 음식@@베스트메뉴라고 써쪄있는 빠네시킴.. 물론 새우도 꽤 있었지만.. 이게 베스트 메뉴인가 싶었음.. 다른 메뉴는 잘 모르겠지만.. 빠네 먹으러는 가지 않을듯.. 에피타이저로 나온 마늘빵은 세상 질김.. 또 이렇게 맛없는 마늘빵은 처음 먹어봄.. @@@@@@빠네랑 해산물볶음밥드세요. 핵맛. @@기대안하고 갔는데 가성비 좋은 동네맛집!!@@"
광양불고기,"불고기,두루치기",02-420-0211,송파구,백제고분로39길 6 (우)05616,#점심식사#친목모임#회식장소#제로페이,3.0,14,어느때부터인가 고기가 두꺼워져서 식감이 떨어졌어요! 한우 못지않게 미국산도 괜찮습니다.@@@@@@@@@@냉면 드럽게 늦게나옴ㅡㅡ!!!@@@@개인적으로 이 불고기를 이 가격이 먹는 사람들 이해가 안 가요 그때부터였을까요 제 자신이 이해가 가지 않았던 게..  테이블은 뭔가가 끈적끈적하고 고기 맛은 지극히 평범합니다 처음에 고기를 올려주길래 구워주는 줄 알았더니 알아서 구워 먹으라고 하네요 (안 구워주는 건 상관 없지만 미리 말이나 해줬으면) 냉면이나 식사는 괜찮은 거 같은데 고기는 다신 안 먹을...@@음식이 맛있고 교통이 편리해다@@@@육수불고기 맛있게 먹었습니다. 반찬은 가지수가 적지만 게장과 묵사발이 맛있습니다.@@맛 : 그닥 재료신선도 : 보통 차돌된장찌개에서 고기비린내나서 역했음 직원들도 부담스럽고 어딘지 모르게 불쾌한 느낌받네요 그런데 가격은 비싸다는..  기대했는데 실망중 실망입니다 돈버리고 싶으면 가세요 @@그럭저럭 기계적인 직원들 그리고 평범한 식사@@@@
어랑,회,02-401-5432,송파구,동남로2길 27 (우)05806,#점심식사#점심특선#제로페이,3.9,10,"Hey 이렇게 음식장사 할 거면 하지 말지 다음엔 안갑니다 오지 마세요@@캬~ 대박!! 친절함은 기본, 맛도 좋고 음식도 맛있고.... 마지막 칼국수.....아~~또 생각나네.@@음식이 정갈하고 아주 친절합니다. 손님과 식사하거나 소규모 회식에 제격이예요@@@@집근처 맛있는초밥 찾았네요.. 또 가려구요 ㅎㅎ@@한상에 10만원짜리 4인용 메뉴 예약해서 갔는데 사람이 많아서 순서대로 메뉴를 주시겠다고 해서 좀 황당했음 나는 미리 메뉴까지 예약하고 간건데ㅋㅋㅋㅋ근데 뭐 그거빼고는 메뉴가 맛나서 잘 먹고 왔습니다 차분히 기다릴 수 있는 사람만 가시길@@오키나와에서 먹었던초밥 맛을 잊을수가 없어 다시 가서 실컷먹고 와야되나 하고 종종 생각하던중. 방송보고 찾아간 문정동 어랑 초밥은 그 맛과  비슷하여 감동했습니다.사장님께서 먹는순서도 잘 설명해주시고 친절하십니다. 두근두근 설레는맘으로 또 갑니다.@@이브날 추천보고 갓다가 폭망~~ 가격대비  영 부실하고 밥(쥐똥만큼)추가가 3천원  이유는 8가지 재료가 들어갓다나 모라나  다시는 가고싶지 않음@@@@깔끔하고 맛있어요@@"
