식당이름,카테고리,연락처,구,상세주소,해시태그,별점,별점수,리뷰내용
신당동천팥죽,죽,02-2237-6385,중구,다산로44길 33 (우)04577,#비건푸드,3.8,21,"검정고무신보고 맛있어보여서 엄마랑 갔어요 아직 나이를 덜먹었는지 제 입맛에는 그냥그랬어요,, 그래도 국밥 한그릇도 못드시는 어머니가 맛있다고 싹싹 비워드셨습니다@@걸쭉하고 진한 팥국물...이거시 팥죽...동짓날 11시30에 갔더니..줄이 1km...코로나검사소인 줄... 임인년 새해 다시 방문하여 영접...이건 국룰...여름에 팥빙수 대신 이거 사서 집 냉동실에 뒀다가 얼려먹어도 딱@@유명한 팥죽집이래서 기대감 갖고 포장. 막상 먹어보니 멀건 팥죽색깔 소금물.  두숫가락 세숫가락...  역시 넘 짜네요  김치와 물김치도 저렴한 소금물 유명 맛집이라 들었는데  오늘 저녁만 그런거겠지 하며 버리고  라면 끓이는 중! 9천원이면... @@동지라는 특수날때문에 줄이길고 두시간가까이 기달려야 한다는건 이해해도 주인이란 사람이 줄이 이렇게 길고 사람들이 많이 기다리면 한사람당 포장제한은 좀 둬야 줄이 적당히 빠지지 앞에서 한사람이 한꺼번에 몇명분 포장주문을 하고 그걸 다 받아주니 줄은 전혀 빠질 생각을 안하네요.  사실 가격도 가격이지만 그냥 동네에서 가끔 생각나면 와서 먹을맛이지 한두시간 기달...@@옛날 팥죽 맛이고 새알도 쫀득하니 좋았는데.. 가격이 너무 비싸게 느껴졌어요. 9천원에 다시 먹으러 오긴 힘들지 않나 하는 생각이.. 주차 안되서 근처 공용에 주차하고 다시 와야하기도 하고..@@나쁘건 아니었지만 가격이..팥이 비싼 곡물이라 그런 듯...@@겨울 팥죽 생각날때마다 갑니다 달지 않고 진하게 부드럽게 쑨 팥죽맛이 일품 아끼지 않은 새알도 맛있고 소금 한알에 설탕 듬뿍 정말 너무 맛있어요 코로나 때문인지 한산한 모습에 제 맴이 더 안좋더라규요 올해 가기전 동지전에 또 방문 예정@@양도 많구 너무 좋아요! 서울 팥죽 찐 맛집@@휴가중에 갔다가 허탕 치고 다른데 찾다가 순 엉터리 집 발견! 가면 안될 바켓리스트에 하나 추가요  천팥죽은 제발제발 잘 만들어주시기바랍니다 가야할 바켓리스트가 되어주세요@@팥죽? 누가 주면 한 두 수저 뜨고 마는  좋아하는 음식이 아닌데 동묘쪽 선배  가게에 갔는데  비는 부슬부슬 같이간 선배님도 임플란트 하고 저  역시 임플란트 한지 얼마 안되서 씹기좋은 밥 뭐가있을까 의논하다 선배가 팥죽 잘하는데 있는데 가자고 해서 갔는데 헐  정말 맛집 선배는 여기가 맛집인줄도 모르고 1년에 한 번인가 오는 곳이라 한다. 창신동이 고향...@@배가 커서 혼자 2인분씩 먹어야 양차는데 오랜만에 식당에서 배부르다는 느낌 받은채로 집갔음ㅋㅋㅋㅋ 팥진짜 진하구 김치가 너무 맛있어요 ㅠㅠㅠ 옹심이도 많고.. 암튼 담엔 팥칼국수 먹으러 가려구오~@@벌레 나와서 먹다가 도중에 나왔어요 새알에 붙어있었습니다 반쯤 먹다 발견했는데 끔찍하네요 다신 안가요@@진하고 맛있는데 매장도 깔끔하고 양도 많음 여름메뉴 콩국수도 좋음 :) @@달지고 짜지도 않고 담백하면서도 순수한 팥죽. 맛이 자극적이지 않아 더 깔끔한 팥죽. @@이제 가격올라서 9천원입니다.  팥죽만원시대가 멀지않았습니다. @@2018.03.21 여전히 맛있음!!!! 속도 편하고 든든하고  2015.12.18 찬바람 불 땐 팥죽&새알!!! 진~ 한 팥죽 한그릇@@좋은 재료로 집에서 만든 팥죽 맛@@@@@@@@새알옹심이 팥죽과 팥칼국수@@"
맥도날드 서울시청점,패스트푸드,070-7017-0155,중구,남대문로9길 51 1층 (우)04523,,3.5,21,@@@@@@최악악악악 감튀는 오래걸리는데 맛없어서 버렸고 위층 끝자리에 의자가 제자리에 있어서 앉았는데 스테프 창고 문앞이였는데 여직원이 나오면서 말도없이 그냥 의자를 끌고 가는데 머라고 했더니 거기서 드시면 창고 앞이라서 걸리적 거린다는 듯이 얘기하면서 의자를 그래서 치워두는거라고 얘기하는데.. 짜증이 양상추는 없는데 문제가 있어서 쿠폰으로 대체해주면 말을 해줘야지...@@제로콜라 맛이 이상해요….@@드러워요 날파리 많고 양배추 바닥에 떨어져있고 토나옴@@여기 사람 많아서 그렇지만 여자 직원은 친절하고 남자 직원은 불친절했음@@@@일요일 오후 4시에 근무하셨던 분들이 너무 친절하셔서 좋았습니다. 좋은 서비스덕분에 하루가 참 행복했었습니다. 감사합니다.@@아랫분 의견 동감 / 일요일 저녁 점원 키오스크 앱쿠폰 안먹혀서 점원에게 물어서 주문받아 준다고 하고는 수준째 세워둬서 그냥 나와버렸음 손님 없었는데 절대 대응 안함@@여기 매니저인지 점장인지 불친절 끝판왕@@@@@@@@어떻게 똑같은 재료로 이런 저질의 퀄리티를 만들 수 있는지 대단하네요. 전직원 맥도날드 망원점 파견 좀 부탁드립니다. 많이 배워야할거 같아요.@@여기 매니저인지 점장인지 불친절 끝판왕@@@@@@@@어떻게 똑같은 재료로 이런 저질의 퀄리티를 만들 수 있는지 대단하네요. 전직원 맥도날드 망원점 파견 좀 부탁드립니다. 많이 배워야할거 같아요.@@@@
원조한치,"해물,생선",02-755-4163,중구,명동7길 14-5 (우)04534,#노포#제로페이,4.4,14,"술맛나는 맛집입니다.@@명동 찐 맛집입니다.@@한치불고기 먹으러 가즈아~~~@@맛있고 친절해요! 물티슈랑 물은 셀프~~ 담에 한 번쯤 다시 갈 거 같아옹 @@좀 좁지만... 친절하고 맛있습니다@@2인세트 배부르게 잘먹었습니다! 마지막에 라면사리 들어간 맑은 아구탕은 못찍었네용 2층인데 사장님도 자주 올라와주시고 친절하시고 만족스러웠던 저녁식사였습니다~~!@@사노비들에겐 좋은 한 끼 점심입니다.@@@@@@다녀 본 음식점 중에 가장 친절한 집. 가격은 좀 비싼 편이지만 음식 질이 좋고 미나리가 무한 리필 \○/ 이대로 주 ~ 욱  ~@@@@@@한치전문점이지만 생태탕때문에 찾게 되는 곳. 점심 식사로도, 저녁 술안주로도 좋아요@@@@"
필동해물,실내포장마차,02-2279-6574,중구,필동로 30 (우)04626,#노포#해물포차#제로페이,2.8,16,술먹다가 시간도 안됐는데 나가라고 라는 술집@@장식 하나 없는 찐노포의 포스를 지닌 곳. 낮술에 매우 적합하나 화장실의 불편은 감수해야 함.@@불친절해요@@@@남해 바닷가에서 먹는 해산물 한상을 먹는 느낌~@@왔다 입니다...!!!@@현금안하고 카드하거나 취하면 빈 소주병 슬쩍 끼워 넣어 매상 올리는 기분잡치는곳@@홍합탕 외엔 스끼다시도 없고 뭐가 맛집이고 좋은 지 정말 의문.. 블로거들에게 속지마세요. 같이 간 사람에게 욕 바가지로 먹었음.@@근처에 있을때 간단하게 한잔하는 곳 밖에 자리깔고  술맛은 나는 분위기 비린편 . 사장님 무뚝뚝 @@진짜 컨셉도 아닌것이 불친절을 떠나 친절을 바라지도 않지만 초온나 싸가지도 없는 가게임@@그냥 추억으로 가는 곳.  위생관념이 철저하거나 약간 비릿한 해물을 꺼려한다면 가지 말것.  친구나 동료끼리 오붓하게 한잔하기에는 좋다.@@저렴하니 소박하게 먹고 가기 좋은 실내외 포장마차  사장님 노웃음 ㅋㅋ@@해산물이 죄다 오래됨. 불친절은 기본. 배탈은 옵션.@@불친절함은 이 집의 매력~ ㅋ 맛집은 맛에 충실~ @@먹고쫌배탈@@가격저렴한선술집 테이블 개수 적어 일찍 가야함@@
을지로마포쭈꾸미,"해물,생선",02-2275-4655,중구,을지로15길 9-1 (우)04544,#노포#점심식사,4.3,21,"손님한테 ""먹어도 돼요~"" ㅋㅋㅋㅋㅋㅋㅋㅋㅋㅋㅋㅋㅋㅋㅋㅋㅋㅋㅋㅋㅋㅋㅋㅋㅋㅋㅋㅋㅋㅋㅋㅋㅋㅋㅋㅋㅋㅋㅋㅋㅋㅋㅋㅋㅋㅋㅋㅋㅋㅋㅋㅋㅋㅋㅋㅋㅋㅋㅋㅋㅋㅋㅋㅋㅋ에라이 ㅋㅋㅋㅋㅋㅋㅋ@@너무맛있고 친절하십니다. 위생은 그럭저럭@@달에 두어번은 갔었습니다. 사장님이 평소에도 친절한 편은 아니었는데 선을 넘을랑 말랑 하다가 드디어 넘으심 하필이면 위생상의 문제도 발견하여 앞으로는 안 갈 듯.. 가격도 올랐고 이런 대접 받으면서 사먹기는 싫음..  맛은 있어서 2점으로 할게여@@맵지만 맛있음 ㅎㅎ 마요네즈 찍어서 깻잎에 백김치에 싸먹으면 굳굳 근데 2022년 1월1일부터 쭈삼가격이 1인분에 12000원에서 15000원으로 오른다는데 한번에 너무 인상되는게 아닌가 싶음,,,@@친구랑 낮술때리기 참 좋았던 곳 ㅎㅎ @@우연히 찾아서 오게 됐는데 작은 곳이지만 맛있게 잘 먹었습니다 ^^  볶음밥 맛있어요!! ㅋㅋㅋ@@쏘쏘@@을지로 쭈삼 맛집!!@@옆집 조선옥에 들릴까했는데 우연히 간판을 보고 들렸습니다. 쭈구미를 정말 맛나게 먹고 왔어요^^ 안 분위기는 별로인데 음식맛은 쵝오입니다 강추~~~~@@@@마스크도 안쓰시고, 여쭤봐도 무표정으로 대답도 안하시고,, 그냥 다시는 가기 싫은 집이에요@@여긴 그냥 미쳤어요 쭈꾸미도 미쳤고 전도 미쳤고 그냥 정말 미쳣음 그냥너무맛있어요@@너무 맛있어요 쭈꾸미도 통통하구 양념도 너무 맛있어요!!@@입구에서 여기가 맞나? 싶었는데 진심 존맛탱입니다 볶음밥을 시켜서 꼭 쌈싸드세요@@쭈꾸미에 마요네즈 조합이라니 사장님 가방끈이 온 을지로를 쓸고 다니게 생겼읍니다... 존맛이요 ㅠㅠ 맛있는데 친절하시기까지 함 이런 집 을3에서 찾기란 쉽지 않을걸요!@@왜이렇게 맛있죠 쭈꾸미 탱글탱글@@별기대없이 들어갔다가 엄청 만족하고 나온 집. 쭈꾸미에 마요네즈가 합이좋다. 장어도 아주 긋긋긋 볶음밥도!@@맛 최고 서비스 최고 쭈꾸미 먹고싶을때마다 여기 와야겠다 진심 !!@@올해 최고의 쭈꾸미입니댜@@@@장어고 맛있고 감자전도 진짜 맛있는데 사진이 없네요ㅠㅠ 감자전 강판에 직점 갈고 채도 썰어서 같이 주셔서 식감이며 맛이며 너무 맛있구 .. 매운거 진짜 좋아하는데 쭈꾸미 진짜 맛있어요ㅠㅠ 장어도 너무 맛있어여.. 최근에 수요미식회 나온대서 걱정했는데 너무 조금 나갔더라구여... 아쉽....@@"
줄리아,중식,0507-1324-1196,중구,수표로 48-12 (우)04550,#분위기좋은#비스트로#제로페이,2.6,42,"@@@@음.. 너무 짜고 .. 인테리어만 좋습니다 @@마라샹궈 죽음의 짠맛 꿔바로우도 누린내 났어요 다른메뉴는 안먹어봐서 모르겠어요 내가 먹은건 맛없었어요 직원은 친절합니다 @@마라상궈가 메인메뉴 같은데 너무 짜네요. 짜서 음식을 남기고 꿔바로우를 주문했네요. 볶음밥, 꿔바로우는 먹을만 했습니다. 음식맛보다는 분위기로 먹는 집이네요.@@식기류에서 이상한 비린내가 나서 나만 이상한가 햇는데 같이간 일행들도 냄새 엄청 심하다고 햇음 불청결@@가격대비 별로@@양에비해 비싸요, 분위기는 좋습니다 @@힙지로에서 가장 힙한곳!!  속이 꽉찬 멘보샤와 마라상궈!! 최근에 먹어 본 마라상궈 중 제일 맛있었다는!! 웨이팅이 엄청 많았는데 예약하고 가서 넘 편하게 먹고 왔어요!! 직원분들 넘 친절!! :)@@안 좋은 평 처음 남겨봐요..나중에는 어떨지 모르겠지만 오늘 갔을 때는 마라샹궈랑 꿔바로우 둘 다 너무 별로였어요ㅜㅜ 특히 꿔바로우.. 마라샹궈는 그나마 사람에 따라 맛있을 수도 있어요 같이 간 친구들은 괜찮다고 했습니다. 마라샹궈는 절반 이상이 버섯이랑 야채인것도 좀 슬펐어요.. 와인에서는 물 탄 듯한 맛이 났구요. 분위기는 좋아요 내부 인테리어도 예뻐요...@@근래 먹은 마라상궈 중 가장 맛없음. 이맛도 저맛도 아님 꿔바로우도 그럼. 사장님은 뭐가 급하고 우선인지 메뉴 한꺼번에 시키라고 3번 정도 재촉함. 좋은 기억은 안생기는 식당임.@@마라탕 맛, 구성 경악스러움 버섯밖에 없음+마라탕에 떡국떡이 있음 ㅠㅠㅠㅠㅠ 한그릇사이즈에 마라탕인데. ㅠㅠㅠㅠ 맛도 별로 한그릇에 18,000원  추가로 어향가지 시킴 가지 별로 없고 마라탕이랑 80% 똑같은 야채구성 어향가지에 버섯이 왜… 목이버섯은 또 왤케 많은지  그릇은 이도 나가잇음 가격이 이런데 그릇을 못바꾸나..?@@유튜브 나얼 플레이리스트를 매장 브금으로 틀어주는 곳. 맛있지만 가격은 좀 쎈 편. 오후 6시 부터 사람들이 몰려드니 그 전에 가는 것도 추천@@우선 입구에서 웨이팅 시스템이 잘 못되어있습니다. 새로온 사람들이 먼저 들어가게 하구  안에 메뉴는 우선 가성비는 안 좋습니다. 맛도 그닥입니다. @@좋아하는 메뉴가 몇 가지 있어서 원래 종종 방문하던 곳인데 앞으로 다시는 안 가려고 합니다ㅜㅜ  얼마 전 예약하고 방문했는데, 저는 예약시간에 맞춰서 도착했고 지인은 야근 때문에 조금 늦는 상황이었습니다. 죄송해서 미리 인원수에 맞춰서 음식과 주류 모두 주문 넣어놓고 기다리고 있었는데, 여성 직원분께서 언짢으셨는지 1~2분마다 계속 왔다갔다 하시면서 흘깃 ...@@마라탕 짜고 비싸다. 재료는 싼 것만 넣는데 어째서1만8천원일까? 멘바오샤 먹고 입천장 까져서 괴로워요 @@을지로에 우후죽순 생긴, 실력 없는 인스타맛집의 전형  1. 마라탕 맛이 없는 것은 아닙니다. 그냥 아무 마라탕집 가서 9천원 내서 먹을 수 있는 수준을 1.8만원 내고 먹어야 합니다. 재료가 비싼 게 들어간 것도 아니고 특별한 맛이 있는 것도 아닌데 이해가 안 가네요.  2. 멘바오샤 사진 보시다시피 빵이 너무 두껍습니다. 새우살은 맛있지만 솔직히 그건 ...@@마라탕이 맛있어용 진짜 체고 !! 마라샹궈는 낫배드 분위기좋다~@@인테리어나 가게 분위기 좋음  마파두부 시켰는데 17000원이어서 비싸지만 그만큼 맛있으려니하고 생각했었음. 근데 노맛. 들어간 재료가 비싼 재료도 아니고 맛도 오히려 평타보다 더 낮은 것 같았음..? 진짜 너무 실망했는데 단백질이려니 꾸역꾸역 먹음… 으.. 돈아까워 @@@@음식점 가서 음식 남기는 편 아닌데 짜지 않은 꿔바로우 말고 나머지 마라샹궈 볶음밥은 다 남겼어요 마라 맛은 강한데 너무 짜서 입안이 정신을 못 차려요 자극적인 걸 원하셨던 건지 뭔지 잘 모르겠어요 너무 짜서 볶음밥 추가로 시켰는데 계란 안에 소금이 뭉텅이로 씹히고 최악이었습니다. 별 한개도 아까워요 여기는 인테리어가 먹여살리는거 같네요 @@여긴 분위기가... 끝판왕 급....  맛도 좋고... 술이 술술 들어감... 또 가고 싶네...@@전화 응대부터 심각하네요^^@@어향새우가지인가..? 맛있었어요! 친절하시고 근데 예약 안하고 가면 화장실 문 앞자리 앉아야함..ㅎㅎㅠ@@재방문했는데, 맛있다. 멘보샤랑 어향가지새우, 마라샹궈 맛있음. 꿔바로우는 개인적으로 비추임. 새콤한건 좋은데, 특이하게 흑설탕을 넣었는지 흑설탕맛이 강하다. 사람 없을 때 가면 편하다.@@꿔바뤄 맛있. 다른건 별로@@1. 바쁜 건 둘째치고 응대기 미숙함. - 물을 이전 테이블 먹던물 그대로 두길래 새로 가져다 달라함 -> 물만 가져옴->컵달라함->컵 하나만 가져옴 ->컵세개 더달라함  - 음식 나왔는데 수저 젓가락이 없음 -> 수저좀 주세요->수저 네개 가져옴-> 젓가락도 주세요->반찬이 없음 -> 반찬도 주세요..  2. 우육면 느끼함. 우육이니 그럴 수 있지만......@@분위기가 좋고, 힙합니다. 가격이 저렴해서 양이 조금 적은듯 합니다. 맛은 매우 훌륭합니다. 퓨전 중식이라 전통중식과는 좀 차이가 있어 전통중식과는 맛이 좀 다릅니다. 그래도 맛 자체로 훌륭합니다. 가게가 작아서 대기가 좀 긴게 단점입니다만, 어차피 몰리는 시간대만 사람이 많습니다.@@아니 맛있는데요?  마라샹궈에 공부가주 진짜 맛있네요@@꿔바로우 얇고 딱딱함  바삭이아니라 딱.딱 소스도 묽지않고 주르륵흐름 고기도별로고 돼지잡내좀남 양적은데 비싼편임 인테리어만신경쓰지말아주세요@@"
스시화정,"초밥,롤",02-757-7766,중구,세종대로14길 29 2층 (우)04526,#코스요리,2.8,20,"그냥 가지마세요..너무 맛없고 스시에 대한 이해도가 전혀 없음. 스시 전부 위에 고명?? 올라가는데 ♩♬♪♪ 스시 먹어보기는 했어요? 제발 빨리 망하기를 바랍니다@@저는 1인 10만원 스시 오마카세를 먹고 왔습니다. 맛도 엉망인데 서비스는 더 엉망입니다.  코스 중 몇 가지만 소개해드리겠습니다. 1) 닭조림은 소금을 부은듯 짜고 퍽퍽합니다. 2) 와이프가 등푸른 생선을 못 먹어 대신 꼴뚜기스시가 나왔는데  침조차 제거 안하고 주셨네요^^ (사진 참고해주세요.) 3) 조개스시 먹다 뱉었습니다. 4) 우니는 다른 리뷰에서...@@음식은 대체로 괜찮았어요 우니가 비리고 음식이 넘 빨리 나오는 거 빼면..^^ 룸자리가 방음 1도 안 되고 서비스가 너무 … 음식 주고 가실 때마다 문을 활짝 열어놓으시는데 프라이빗 이런 건 없는 룸인가봐요 ㅎㅎ 생일날 가서 기분 안 좋아짐 ㅎㅎ 가볍게 식사할 때 가세요@@맛있어요 화정세트 먹었어요. 일하시는 분 친절하십니다. 재방문 의사 100%@@가격대 생각하면 구성이 별로@@맛있고, 친절했어요:)  지인추천받아 갔는데 잘 먹었습니다@@런치 스시코스인 '화정코스'의 구성이 탄탄하다.@@그냥그래..@@완전 실망입니다   평일 중요한 날이라 1시 이후 타임으로 예약까지 하고 갔는데  “화정코스” 1시 이후 만원 저렴하다해도 35000원이면 싼것도 아닌데 서비스가 너무 실망이네요. 코스에 포함된 사시미도 안나오고 말해야지나오고 바빠서 잊어버렸다고 하시며 만원 할인 받아 신경을 안써주시는 건가요? ㅎㅎㅎ 사시미 안나오는 거 보고 코스메뉴 봐봤더니 스시도 12...@@맛 서비스 분위기 가격~ 괜찮구요 와인 콜키지 무료도 좋았습니다 (별점 5,   2018.08.17) 그 후 여러번 이용~  앞으로도 더 이용하려면  뭔가 개선이 필요하지 않나 생각합니다@@@@와... 런치 인당6만 오마카세먹고 이딴 개ㅆ레기 대접 받아야되나. 여자 한 분은 엄청 친절하심. 다른 여자직원 한분 진짜 서비스 개ㅆ레기같애서 진짜 기분 다잡치고나온다. 2시반까지래서 얘기 마저하고 있었는데 14분에 룸 들어오더니 ""저희 이제 쉬어야돼요~""하고 성질내네 ㅋㅋㅋㅋㅋㅋㅋ 어이가없어서 좋던기분 다 잡치고갑니다. 가지마세요그냥ㅋ@@써비스 빵점인집 고가의 스시는 먹을만하나 그에맞는 서빙이나  점원들의 태도는 돈내고 먹기 아까울정도임 초심을 너무나 많이 잃어버리고 말았다 @@평일 오후1시 이후 런치화정코스 할인이 되지만 써있는 메뉴 중 일부가 안 나올수 있다는거 참고하세요.  코스임에도 불구하고 앞타임에서 다 떨어져서 없다는 말에 황당했습니다. @@후기좋은거 보고 갔는데 솔직히 좀 전체적으로 실망스러웠던 맛@@@@생활의달인 (2018.7.23) 초밥~  일찍 부모님을 여의고 강한 책임감으로 많은 연구를 통해 이루어낸 실력~@@Creative Sushi@@화정스시 가격인상. 양은 보통@@스시코스(AB) 3만5천~4만5천원.오마카세 6만원.스시코스 특선 6만6천원/마루야마 마시미츠 수석 셰프가 이끄는 타츠미 스시(창작 스시)를 맛볼 수 있는 곳@@"
아리연,한정식,02-757-1994,중구,세종대로12길 12 해남2빌딩 지하1층 (우)04526,#상견례#점심식사#친목모임#코스요리#회식장소#제로페이,3.7,6,그냥저냥.룸이있어좋은곳@@아리연 '나'코스@@보리굴비 능지처참?  부관참시?  보리굴비 정식을 먹으면 새꼬시를 주는 이상한 집 ^^ @@공간 환경과 깔끔성@@@@음식 맛은 정말   환상입니다.@@
필동멸치국수,국수,0507-1353-2886,중구,퇴계로 210-4 1층 (우)04625,#제로페이,4.1,76,"멸치국수 국물 해장용 굿굿@@좋게 얘기 해서 그렇게 빯아주는 백종원이라도 능사가 아니라는걸  알려준 식당임@@멸치국수 5천원 김치주먹밥 2천원 가격대비 양과 맛 둘다 괜찮음@@양은 많은데 맛은 그냥 평범해요~ 건더기가 김밖에 없는것도 좀 아쉽네요@@멸치국수는 모르겠지만 소불간장국수만큼은 진짜 너무 달고 짬 나트륨 폭발@@난 ㄱㅏ끔 .. 탄수화물 금단현상이 오면 소불간장국수를 시킨다.. 웰치스 뚱캔도 시키는 내가 밉ㄷㅏ..@@@@©2021. ethwang All rights reserved. @@내  입에는 안맞네@@맛있습니다 개인적으로 국물에 애호박, 부추, 양파, 계란지단 등이 들어있고 간장(청양고추, 참기름, 고춧가루)다대기 얹어먹는 식의 잔치국수를 좋아하는 편인데도 불구하고 면에 김가루, 멸치 육수의 심플한 구성으로 상당히 풍부하게 맛을 내셔서 첫입에 반했습니다.  제 기준 잔치국수 탑으로 꼽는 진안 빵돌이네를 연상케 했습니다. 진하고 살작 얼큰한 멸치 육수에 ...@@육수가 정말 진하고 잔치국수는 여기가 최고입니다.@@가격 등을 고려했을 때 전반적으로 괜찮음! 굿@@육수 쓴맛은 멸치내장 우려나온 맛 비빔국수는 전통시장 국수보다 맛 없음   @@일단 쓴맛난다는 리뷰가 왜인지 알겠는게 멸치 내장이랑 머리 좀 빼고 끓이면 될듯한데 msg에 익숙한 젊은 사람의 입맛엔 맞지않다 즉 진짜 멸치 육수를 쓴다는뜻인듯하다 유튜버고 뭐고 그런건 모르겠고@@유튜버때문에 큰일이군요@@악질이네 블랙트리 @@유튜버라고 말하기도 아까운 악질 하얀트리가 맹물국수라며 비난하고 무단촬영한곳입니다. 사장님 힘내시고 하얀트리는 3대가 망했으면 좋겠네요.@@맛있게먹었습니다@@하얀트리 개투버한테 당한 집이구나 속상하시겠지만 힘내세여@@@@모 유튜버때문에  속상하시는 그곳 맞나요?   조만간 꼭 가서 맛나게 먹겠습니다@@가끔 국수 먹고싶을때마다 갑니다@@무난무난합니다. 개인적으로 비빔이 더 맛난 듯 합니다.  특별할 건 없고 낸 돈 만큼 아쉬움 없이 나오는 정도.@@국물이 씁쓸한맛이네요. 호불호가 있을거같아요. 양은 일반적인 잔치국수집보다 살짝 작은양이였습니다.@@너무 맛있습니다. 구수하고 씁쓰레한 멸치향이 훅~ 끼치는 옛날스타일 맛이에요. 면도 쫄깃. 제가 조미료에 민감해서 많이들어가면 속이 불편한데 여기 음식은 그렇지 않았어요. 한그릇 설거지하듯 먹고 한그릇 더 시키고 싶었으나 저녁이라 참았다는.. 아랫분 말처럼 곱빼기메뉴 생기면 좋겠네요 ㅋㅋㅋ 물만두도 맛있었어요. 방송에서 편집을 의도적으로 한듯. 전 또가고 ...@@국물도 진하고 멸치국수가 맛있었다 아쉬운건 곱빼기가 없는거 같던데...@@@@비빔국수 진짜 짱입니다~~~@@국물이 찐해요. 찐만두도 맛있네요. 추천합니다.@@처음에 먹었을때 쓴맛이 났으며 면을 먹다보이 비린내가 나면서 느끼하고 식욕을 감소 시킵니다. 사장님도 알아줬으면 해서 말씀드렸지만 저희가 다 잘못이라는 듯이 말씀하셔서 기분이 별로였고 오랜만에 가는거라 기대했던것 만큼 실망도 컸던 날이였습니다@@국수맛은 평범하고 가격이 싸서 괜찮습니다. 제육볶밥은 제육볶음 남은국물에 비벼주는것같은 맛이예요. 국수만 드세요.@@멸치국물은 진해서좋은데 조미료를 안넣어끓여서인지 가끔 들쑥날쑥 간이 좀 짜요 사장님이 간은맞쳐준다니 얘기하면 된다네요 둘이와서 하나시키고 좀 더달라니 1인식일때만  가능하되요. 그래도 인심좋으신 사장님 한번은드린다고하네요..감사 담엔 각자시키려고요 가볍게 술먹은 다음날  해장각임니다^^ @@@@서비스가 너무 불친절합니다.@@멸치 맛 고추맛 느끼기 전에....저한텐 좀 짜네요@@"
