식당이름,카테고리,연락처,구,상세주소,해시태그,별점,별점수,리뷰내용
박복순쭈꾸미,"해물,생선",070-7576-3526,송파구,백제고분로41길 42-20 1층 101호 (우)05623,#잠실맛집#잠실쭈꾸미,4.5,17,"@@맛 똠양쭈꾸미  맛있었음 국물도 자작하게있어서 굿 한국식으로 만들어서 굿  최근 송리단길에서 먹은것중에 가장 기억에남음  서비스 사실 서비스가 너무 완벽했음 서비스가 좋아서 맛이 더 +됨 또가고싶음@@매운걸 못먹지만 오랜만에 땡겨서 땀 흘리며 맛나게 먹었습니다 ㅎㅎ@@리뷰 처음 써봐요 진짜진쩌진짜 맛있어요@@평타@@양념이 짜지않고 간이 적당해서 좋았어요 ~ 가끔 비오면 매운게 땡겨서 동생이랑 자주 들리는데 맛은 변함없이 맛있네요 : )@@우연히 들렸던 곳인데, 벌써 두번째 방문 하네요 ㅎㅎ 와이프가 매운 음식을 좋아하기도 하지만 쭈꾸미를 좋아해서 단골 되었어요 ! 쭈꾸미 삼겹살에 볶음밥 진심 존맛탱 입니다 !!@@솔직히 쭈꾸미를 정말좋아하는데 한번먹어보고 인생쭈꾸미집되버림. 이집은 삼겹 쭈꾸미도 맛나고 나는 똠양꿍 개맛탱..ㅜㅡㅜ 요즘은 일주일에 2번씩감..  단골손님도 많은듯 가면 꼭 보이는 아저씨들도있음 ㅋㅋ 개웃김..ㅋㅋ@@사장님이 훈남이시고 직원분들 친절하셔요 청결하고 쭈꾸미 작살 맛있어요^^ 자꾸 생각나는 맛 적극 추천@@아무런 생각없이 먹었다가 푹빠졌네요~ 한번먹으면 꼭 다시생각나는 맛입니다  사장님도 친절하시고 식당분위기도 좋구 쭈꾸미란 음식의 장르를 업그레이드시켰다고 할수있을것같아요! 볶음밥도 예술입니다~~ 잘먹었습니다   @@사장님도 친절하시고, 똠양꿍 쭈꾸미 진짜 맛있어요!! JMT  자주 갈께요 @@평소에 쭈꾸미를 즐겨먹는데 여기는 정말 자주가요~ 금액도 저렴한데다가 나오는 스끼다시도 제가 좋아하는 거라 개인적으로 저는 정말 만족합니다! 모듬튀김 쭈꾸미양념에 찍어먹으면 진짜 JMT!!!!!!!!!!!!!!!! 그리고 마지막으로먹는 볶음밥은 화룡점정!!!!! 하투로 만들어먹으면 더 맛있쮸?헤헿ㅎ넘나리 강츄드립니당!!! >_<@@매운걸 많이 못먹어서 안매운 맛으로 주문했어요! 매콤하니 맛있더라구요 , 저는 삼겹 보다 우삼이 더 괜찮았어요!!@@맛있어요 직원분들도 친절하셔서 자주 갔습니다. 갈 때마다 사리추가를 해서 먹었는데 고기 양의 일관성이 없어보이는 점이 살짝 신뢰도를 떨어뜨리는 것 같아요. 그것 빼고는 다 괜찮았습니다@@집앞이라 자주 들리는 단골집 입니다 !! 매울때 튀김이랑 같이 먹으면 더 맛있는거 같아용 : )@@매운거 땡길때 마다 들리는곳 ! 마무리는 역시 볶음밥이쥬 ~~ 오늘도 배터지게 먹고 갑니다 ㅎㅎ@@@@"
삼방매,일식,070-4150-7718,송파구,백제고분로45길 23 1층 105호 (우)05622,#데이트코스#혼밥#제로페이,3.6,40,"차슈크기도 도톰하니 맛있다@@맛집이네요 진한 육수 두툼한 고기 좋네요@@맛있었어용@@차슈덮밥에 차슈 추가필수 매운돈코츠라멘에 마늘 5개 갈아넣기도 필수 너무 맛있음@@차슈가 다소 느끼하다. 나는 매운돈코츠라멘을 목었지만 담에 가면 그냥 돈코츠 라멘 목을듯. 국물 맛이 일품임@@매운돈코츠라멘 너무맛잇었어요! 차슈덮밥이 느끼하기때문에 둘이 궁합이 딱좋아요 그리고 차슈덮밥을 기대하고갔는데 의외로 네기부타동이 맛있었어요@@맛 네기부타동 라멘 매운맛, 라멘 보통 양이 작아 보이는데 상당히 많고 무난무난했음 그냥 기본!!   서비스 쏘쏘 모든것이 셀프라..@@감동적인 차슈@@차슈덮밥은 맛있대서 갔는데 진짜.... 친구 데리고 갔는데 미안해서 혼났네요ㅠㅠㅠ 니맛도 내맛도 아니었어요 밥에 소스도 거의 안 뿌려져있고.. 그냥 맨밥에 삶은 삼겹살 먹는 맛@@가게 엄청 아담하구 음식은 깔끔한데 양이 좀 적네요ㅎㅎ  차슈맛있어요@@차슈덮밥이 맛있어요 라멘은 느끼함..별루임@@정말 거짓말 안하고 너무 실망해서 반도 안먹고 나옴. 덜매운 돈코츠라멘 시켰는데 일식 라멘 냄새가 아니라 된장 냄새가 강해서 이건 뭐지 싶었음. 다시는 안감. @@여긴 무조건 차슈덮밥입니다@@여기가 맛있음??ㄹㅇ로? 김치는 다 시어있고 마늘은 비위생적, 집는 집게도 없고 젓가락으로 집어야함.. 그냥 접시에 덜렁 있음.. 돈코츠라멘 원래 좋아하는데 느끼하기만 하고 담백한 맛이 전혀 없음. 담백한 국물이랑 기름이랑 섞여있는 맛이 전혀아님. 챠슈 엄청짬. 같이 시킨 고기덮밥도 힘줄때문에 질깃하고 별로였음.. 바로 옆 롯백 푸드코트 하카타분코가 열배는...@@맛있어용@@돈코츠 라멘 진짜 쵝오. 일본에서 먹는거랑 별반 차이없이 진한 국물에 매료되었어요. 다음에 친구들하고 꼭 다시갈거에요. 완전 강추 별다슷개 채고 쵝오 채고고~!!!@@인생라멘집 남친은 챠슈덥밥이랑 라멘 두그릇 순삭@@ 넘나 맛있음 두그릇 쌉가능@@맛있어요 @@자주 방문했는데 이전까지는 “와 진짜 인생라멘이다” 느꼈는데 이번에 먹었을 때는 맛이 좀 변했네요  웨이팅을 해도 다 이해가 됐는데 이제는 안갈 것 같슴니다  너무 아쉽습니다ㅠㅠ@@진득할 정도로 진한 육수.  차슈 덮밥은 퍽퍽합니다. 부타동을 더 추천. @@차슈맛집 안 짠 라멘 신기@@챠슈 녹는다. 일본라멘 안좋아했는데 생각이 바뀐라멘집@@솔직히 맛집이라고 할만큼은 아닌듯 먹으시더라도 매우 느끼하니까 동일종류 메뉴 먹지 않기를@@돈코츠 라멘 국물이 진하지만 많이 느끼함 @@짜고 느끼하고....ㅠ하@@밥이 너무 날아다녀요 ㅠ 소식하는 저희 커플에겐 양이 괜찮지만 일반분들이라면 부족할수도잇을듯.... 차슈덮밥은 먹다보니 느끼하고 와규는 쏘쏘.. 안기다리니 괜찮앗지만ㅋㅋ 기다려서는 별로 ㅋㅋㅋ@@네기부타동도 맛있어요 여러분.. 이런거 보통 먹다보면 밥이 남지않나요??ㅜㅜㅜ 고기가 남더라고요.. 마지막숟갈까지 맛있게 먹었습니다 :) 다만 자리가 엄청 좁고 웨이팅 주의. 둘이서 가기 좋은 식당.@@@@브레이크끝나자마자 들어가서 차슈덮밥 매콤부타동 먹었눈데 부타동은 쫌 짰디만 둘다 맛있어용 어떠분 양이 혜자라고하는데 저는 양이 모자랐어요..ㅠㅋㅋㅋㅋㅋ 재방문의사있습니당ㅎㅎㅎ직원분은 안친절 ㅎㅎ@@"
장원보쌈왕족발,"족발,보쌈",02-423-8555,송파구,백제고분로7길 46 (우)05559,#가족모임,2.6,18,"중 짜리는 싸구려 같다한것같음 최악  좋은 족좀  쓰시지 ㅉㅉ@@고기가부드러워서 맛있게 잘먹었어요@@둘이서 먹고 이틀째 탈남 위생상태 걱정됐는데 딱이였음@@@@외국산을 파는건 문제가 안된다. 안먹을 사람은 안먹으니까. 하지만 국내산으로 속이는건 다르다.그건 손님을 등처먹는거다. 등처먹은 대가는 훨씬 크다. 제발 가지마라 이런곳.@@10년 넘게 단골이었는데 언제부터인가 배달온 고기는 형편없고 국수 면은 불어 터져 있던데 오늘 단단히 한 건....겉절이에 왠 다먹고 난 고추꼬다리가.....기가 차네요...에라이 드르븐 인간들아...@@음식가지고 장난NO @@하.... 위생좀 신경쓰세요 테이블을 안닥는건 살다살다 첨이네요 물티슈로 닦으니까 까맣게 나와서 식겁했습니다 가격도 너무 올라서 애매한데 위생까지 이러면 안가요@@야구장서 배달받는 보쌈맛집@@변함없는 맛@@@@수육은 무난 김치, 된장국은 맛있음 채소가 싱싱하지 않고 날파리 같은 게 계속 날라 다녀서 걔네들과 같이 먹는 느낌 깔끔한 느낌은 없음@@보쌈,쟁반국수 먹었고 맛있는듯 아닌듯한(?) 맛이예요. 근데 맛을 떠나서 여름인데 문을 열어놓아서 날파리가 굉장히 많이 들어오는데 음식위에 앉는 바람에 손으로 계속 부채질하면서 먹어야 합니다 ㅠㅠ@@좋아하는 보쌈집이고 자주가는곳인데요  엊그제 첨으로 부엌건너편에 앉았는데 지금 코로나때문에 난린데 서빙하시는분만 마스크끼고, 주방에 계신 분들은 아무도 안끼셨더라구요..정말 찝찝했습니다 심지어 고기써시는분 썰면서 몇번이나 고기주서서 드시더군요. 원래 위생상 주방에서 뭐먹으면 안되는거 모르시나요.거기에 심지어 코로나가 유행하는데 마스크도 안끼고 손님상에 나갈...@@@@이집 족발보쌈 쟁반국수 다 굿굿! 괜히 오래된 맛집이 아님ㅋㅋ 모두가 만족해서 뿌듯하다^^@@★★☆@@24시간 영업@@"
꼭그닭 잠실점,"호프,요리주점",02-417-7772,송파구,오금로11길 14 동성빌딩 2층 201호 (우)05548,#단체석#수제맥주#친목모임#회식장소#제로페이,4.0,22,"잠실에서 치킨집 하면 여기인것 같아요 평소에 먹는 치킨이 아닌 다른 고급진 요리를 먹는 느낌이랄까요? 맥주도 종류 정말 많아서 이것저것 마셔볼 수 있어서 올때마다 정말 즐거워요  최고로 강추 합니다! ☆☆☆☆☆@@여기 빠네치킨에 로제소스 맛나요!!! 게다가 여러가지 수제 맥주를 원하는대로 마실 수 있어서 너무 좋았습니다. 여친도 저도 만족하고 갑니다. 여기 맥주 짱짱^^@@수제맥주 나 맥주한잔하러 가기좋은것같네요 안주가 너무별론거같아요 시그니처라는 로제치킨은 가격대비 정말 군대에서 먹는 슈넬치킨같은 씹는맛에 저렴한맛나는 닭같네요 거짓말하나안하고 로제소스도 너무싱겁고 느끼하기만했습니다@@맥주 종류는 많은데 마실 만한 종류는 많지 않은 것 같아요. 그래도 직원 분들께서 친절하시고 이용 전에 설명 잘해 주시기는 했어요.@@맛있어요, 맥주 골라먹는 것도 잼남@@빠네치킨 맛있고 치킨 올려주는 퍼포먼스도 멋짐 근데 느끼한건 어쩔수없음 많이먹어서 배탈남 ㅠ @@음...빠네치킨.. 느끼하고... 칠리치킨은 괜찮아요..@@확실히 빠네치킨은 엄청 맛있는것 같아요 ㅋㅋ 맥주는 싼것 위주로 먹고 비싼건 살짝 맛볼수 있어서 좋아용 ㅋㅋㅋㅋㅋㅋ@@맥주도 다양하고 빠네치킨 완전 맛있네요 ㅎ@@빠네치킨은 상상 가능 한 맛 맥주는 잘 고르면 맛있음 맛도 다양함 직원분들 마스크 끼고 계심 한번쯤 가도 좋을듯@@맥주컨셉은 좋은데 냉동식품 안주들은 정말 ㅜㅡㅜ@@왜 가는지 알겠네요 ㅋㅋㅋㅋㅋ 역시 치킨이랑 치즈는 사기죠 ㅋㅋㅋ 맥주고를때 고민중 직원분이 소셔서 친절히 알려주시고 너무 잘먹었어요 ㅋㅋ@@방이동에 이런곳이.... 아 술 끊어야하는데.. 셀프주류소.. 대박 아이템... 여기 사장님 완전 최고@@수제맥주가 다양해서 취향데로 마실수 있어서 좋네요.@@강남점 생각하고왔는데 치킨이 따뜻하지도않고 다 남겼어요@@내일 또 가야지@@직원분들 다 친절하시고 요구사항 다들어주시고 ~ 치킨도 맛집이구 맥주도 시원하구 !! 꼭그닭 방이점 방문하구 행복한 하루였네요@@사장님 직원 분들 너무 친절하시고 맛도 최고네요! 또 갈께요! 장사 번창하셔요!@@굿!!@@개존맛! 또 와야지@@빠네치킨 강남점에서만 먹어봤는데 방이점도 역시나 맛나네요~ 양도 많고 빠네치킨은 치킨도 먹고 피자치즈랑 빵이 또 별미인듯 가격대비 가성비짱인듯~!! 여러가지 수제맥주를 따라마시는 재미에 고급진 인테리어까지 데이트하기에도 분위기좋은듯  잘 먹고갑니다 직워를 모두 친절하고 위생이 엄청 깨끗해보여서 좋았음 강주@@그렇게 맛있지도 않은데 왜 유명하지 ,. 맥주 먹기는 좋음@@"
스타벅스 송파방이DT점,커피전문점,1522-3232,송파구,오금로 241 (우)05645,#카카오페이,3.7,21,"알바생 싸가지 없음 남자인데 이름이 기억이 안나네@@집앞이라 자주 가요.. 넓직하고 좋아요@@조용합니다@@@@@@@@내 최애지점@@서비스. 태도.  별로@@좁음& 블랜드 메뉴 안 됨 ㅜ @@@@@@복잡하고 항상 바쁨. 맛은 스벅맛@@다른 지점과 맛이 달라요. 본사직영 매장이 이렇게 다를 수 있다니 이상하네요. 플랫화이트는 커피향도 없는 맹탕우유이고 딸기요거트는 단거 좋아하는 신랑도 다른 데서 먹는거랑 다르게 너무 달다고 그러네요. 그리고 화장실 수리 좀 하셔야겠어요. 변기가 물 내리고 물이 차오르지 않아 매번 가면 앞에 볼 일 보신분의 흔적을 보게되네요. 저도 그럴까봐 제대로 물 내려...@@드라이브쓰루는 괜찮은듯@@넓어서 좋다. 뜨거운 태양과 함께 뜨거워지고싶다면 2층 창 옆 추천@@2층 천장이 높아 한결 여유롭다@@좀 일찍 오픈 하길@@@@@@많이 애용하는 별다방입니다.  다만, 혹시라도 송파방이점 매니저가 이글을 읽기를 바라면서 몇자 적습니다.  1. 매장 청소가 너무 안되는거 같아서 안타까운 마음에 글을 적습니다.  2층에서 주로 커피를 즐기는데 창틀등  청소가 거의 안하는거 같습니다. 창틀에 먼지가 수북히 앉아있는데도 그냥 방치되어 있습니다. 또한  2층 외부자리역시 바닥은 담배꽁초가 나뒹...@@너무 좋아요@@"
원조부안집 잠실새내점,"육류,고기",0507-1302-3039,송파구,백제고분로15길 55 1층 (우)05559,#회식장소#제로페이,4.2,20,"비계덩어리 거리는 놈들은 걍 서양 가서 살고기만 쳐드시길 맛도 모르는 촌놈들이 맛에 대해 평가하는거 보면 구역질남.  그냥 공기밥좀 팔아줬음 좋겠음 밥이랑 고기를 먹고 싶은데 밥만 단독으로 먹으라는 것마냥 버터밥으로주니까 안어울림 @@맛있긴한데 삼겹살이 너무 비곗덩어리ㅜ...@@@@기본 공기밥이란 된장찌개는 판매 안 하고 버터 계란밥만 판매 2인분에 4,500원  직원들은 친절하고 고기 자체는 괜찮은 거 같은데 밑에 숯 때문에  그런지 고기맛,향이 숯에 베인 느낌?...... 막 웨이팅 할 정도로 먹을 맛은 아니었습니다.@@맛있음@@#원조부안집잠실새내점 #육즙목살 #쫀득살  육즙목살과 쫀득살로 유명한 부안원조집. 육즙목살은 특이한 이름답게 목살임에도 육즙이 풍부함. 쫀득살은 목살근처 부위라고 하는데 마치 오겹살을 먹는 느낌. 지방부위와 살코기부위의 조화가 끝내줌. 아쉬운 부분은 공기밥이 없다는 점. 밥이 먹고 싶다면 2인에 4,500원짜리 밥을 먹을 수 밖에 없음. 잠실 새마을시장 위...@@저녁 먹으러 왔는데 뭐.. 고기는 맛있었어요 근데 직원들이 별로에요 아 처음 주문 받으셨던 여자 직원분은 친절하셨어요! 처음에 목살 둘에 쫀득 하나 주문했는데 쫀득이 주문 누락됐어요 그래서 다시 쫀득 시키면서 10분밥? 그거 주문했는데 고기가 다 먹어가는데도 밥이 안나오길래 여쭤봤더니 주문 누락이라고 몇 인분 주문하냐길래 그냥 안먹겠다 하고 나왔어요!  기...@@늘 웨이팅 있는 곳인데 사람 없길래 가봄 쫀득살, 목살 주문했는데 쫀득살은 비계가 많아서 별로였고 목살은 괜찮았음(비계 좋아하면 괜찮을듯) 그러나 기다려서 먹을 맛은 절대로 아님 더 하고 싶은 말이 있지만 생략… 재방문 의사 없음@@직원분들이 친절한편이고 쫀득살과 껍데기가 맛났어요@@@@맛3 서비스3 위생2 이거 추천한 유튜버 고투헬  구석구석에 먼지 쌓이고 유리에는 기름 잔뜩 튀어있고 앉자마자 화구엔 그을음이랑 기름둥둥  저렴한 불판써서 고기 타기 쉽상이고 벤트가 역해서 연기를 잘 못 빨아 서로 연기 뿜으면서 식사  직원들 유니폼 입고 나가서 침 뱉으면서 담배피고 바로 또 고기 뒤집는... 사장님이 좀 아셔야 될거 같은데...  @@저 원래 귀찮아서 후기 잘 안 남기는데 정말 고기 맛도 밑반찬도 서비스도 가격도 최고였어요ㅠㅠ 고기도 하나하나 다 구워 주시구 친절하게 설명도 해주시구 네이버 예약하고 가면 서비스도 엄청 납니당!! 여러 지점 있는데 이 지점이 평점이 유독 높은 이유가 있는 것 같아요:-) 자주 갈게욧!!!@@저세상 맛 맨날 먹고싶다@@@@맛있어요@@오랫만에 동생이랑 같이 갔는데 직원분들도 너무 친절하시고 고기도 맛있고 고기냄새 많이 안나서 너무 기분 좋게 먹다 왔어요 항상 번창하세용 고깃집에서 마스크 더러워 진다고 새 마스크랑 락토핏 센스있게 주셔서 기분이 좋았습니다  @@@@@@리뷰는 처음이네요! 진짜 맛있어요!!  알바생분들이 너무 친절하십니다. 사장님이 알바생분들을 너무 잘뽑으셧습니다.@@두툼하고 육즙가득한 고기가 너무 맛있어요. 목살이랑 쫀득살 강추입니다! 전반적으로 깔끔하고 친절하고 서비스로 주신 껍데기도 넘 맛있었어요. 무엇보다 고기를 직접 구워주셔서 편히 먹고 왔습니다. 테이블마다 투명 가림막도 되어있어서 안심하고 먹었어요. 자주 가야겠어요^^@@"
파티세리도효,디저트카페,0507-1408-2049,송파구,백제고분로45길 21-1 2층 (우)05622,#데이트코스#제로페이,4.1,16,커피도 케이크도 무난 사람이 북적거리지 않았던 것은 괜찮았음@@홀케이크 최고@@조용하고 케이크 맛있고 커피 무난했고 좋은 곳이었어요. 크리스마스 초코롤케이크는 많이 안달아서 더 마음에 들었고요.@@치즈케이크 맛나당. 케이크 맛집이라고 해서 갔는데 친구들이 이런 데 어떻게 알았냐고 칭찬해주었다@@기대가 너무 컸나.... 케이크 별로였음@@디저트가 정말 맛있었어@@@@@@없어진것같네요->이전하셨나보네요 -디저트는 대만족인데 음료가 너무×100 작음. 벌컥벌컥 마시는 사람이라 세모금 마시니까 얼음만 남음 ㅠ@@디저트가 최고..@@@@@@Dessert@@@@@@아이스 아메리카노 / 더블치즈 타르트@@
송파아구찜,아구,02-403-0327,송파구,오금로44길 50-22 (우)05784,,3.7,20,"평일 저녁 반찬 없이 앉아서 30분 기다림 .. 손님 오자마자 음식은 늦게 나오더라도 반찬 세팅은 기본 아닌지..? 손님 많아서 감당 안되는데 사장님 같아 보이는 분 뒷짐 지고 있고 서빙하는 아주머니는 혼자 고군분투.. 손님들 마시고 남은 물통 그대로 리필하는 거 보고 경악함.. 다시는 안 갈 거 같음 @@반찬과 메인음식이 아주 정갈하면서 깔끔함 식당위생도 청결해보임 굿....아구찜@@비싸고 슴슴ㅁ한데 가족 같이 가기엔 좋아요@@송파구 아구찜@@좋아하는 집이예요:) 간도 적절하고 밑반찬들도 너무 맛있어요..! 대추절임은 종종 생각날정도! 볶음밥도 굳굳  웨이팅이 조금 있는 편이랍니당 아구량은 좀 복불복이긴해요ㅎㅎ(많은 날은 행복..)@@@@흠.. 양념은 괜찮은데 콩나물만 많고 고기는 없고 그나마도 살이 하나도 없었어요 진짜... 요즘 아귀가 다 그런건지 아무튼 뼈랑 껍질뿐. 밑반찬은 괜찮은데 밑반찬 먹으러 가는건 아니니깐 ㅠㅠㅜ 비싸게 받더라도 살 통통한 아귀 먹고싶어요@@맛 좋구요, 깔끔하고, 밑반찬 서비스 좋아요.@@맛은 있지만 양적고 많이 비쌈@@세상 존맛탱, 근데 조금 맛이 변한거 같아서 아쉬워요ㅜ@@깔끔한 음식과 정갈한 밑반찬. 웨이팅이 항상 있음.@@고기가 질기고 약간 비린냄새 남. 평점만 보고 갔는데 리뷰 날짜 안본게 후회. 최근 리뷰가 없었네 ㅠ@@맛있어요!!@@@@자극적이지 않은 맛있는 매운맛 @@@@반찬 완전 깔끔 맛있고 푸짐합니다@@@@@@늦게가면 재료 떨어집니다~ 볶음밥은 꼭 드시길~@@"
장털보설렁탕 본점,설렁탕,02-409-0520,송파구,중대로 288 (우)05724,#제로페이,3.3,23,"해장국  맛있어서 포장주문 많이 했었는데 주차관리하는 분의 불쾌한 언행에 다시는 이용하고 싶지않네요. 후기 살펴보니 이런 불만이 종종 있는거 같은데 사장님 관리 좀 하셔야겠어요!!!@@맛있어요@@가격은 점점 오르지만, 추억의 맛은 잊을수가 없음 ㅠㅠ@@도가니탕 17000원 비싼데 가성비 너무 안좋네요.  포장하면 양이 엄청 적어요. 매장에서 먹었을때랑 심하게 차이나요. 파는 씻지도 않은거 흙 묻어있고 참..@@맛있어요@@@@@@석박지 김치 대 존맛 설렁탕도 뭐 맛있다@@무김치 맛집☆☆☆☆☆@@일단 김치 합격@@여기 직원들은 영업시간에 홀에 삼삼오오 모여 앉아서 커피마시고 핸드폰보고 수다떨다가 손님이 오고가면 인사도 안하고 지나가는 동네 개쳐다보듯하고 주문할때 제대로 듣지도 않고 지맘대로 갖다주고 서비스가 개판이네요. 사장이 직원교육 처음부터 다시시키던지 짤르던지 하세요 사장도 똑같을라나....@@털보탕 고기반 국물반. 그 맛에 가는데 맛집이라하기는 좀 부족하고@@설렁탕 국물이 국물인지 물인지 구별이 안갔습니다... 진한 맛 까지는 안 기대하더라도 이건 좀...@@@@설렁탕은 금방 준비 되기 때문에 따뜻하게 후딱 먹고 가기 좋아요. 가끔 덜 우러난 국물이 나올때도 있어서 아쉬움. 오래된 동네 맛집인데 가격이 많이 오른것도 아쉬움.@@설렁탕 만원. 설렁탕 체인점들보단 당연히 낫지만 교통편도 안 좋은 동네인데 일부러 찾아갈 필요는 없어요.@@@@@@가격이 너무 비싸요 도가니탕 비닐포장 17000원 프라스틱 얇은 용기 1000원 별도 말도안됨  다른 유명 대형집 13000~15000원 용기도 두어개는 서비스 밥도 포함  포장 비닐용기 하나를 1000원 노래부르는 것을 보아 하니..@@항상 털보탕만 먹어봄 고기가많다ㅋㅋ@@명성값합니다 오래되었죠 최곱니다@@해장국 맛있다고 해서 갔는데 맛은 평타 수준이네요. 가격이 올랐던데 해장국을 8,000원 내고 먹을 곳은 아닌듯... @@@@"
남한산성 마천점,"호프,요리주점",02-408-8866,송파구,마천로39길 5 (우)05755,#제로페이,4.2,5,굿! 양도 많고 깔끔해서 맛났어요!@@불향나고 맛있어요! @@맛있네요~^^@@그다지 추천하지 않아요. 화장실 더럽 @@@@
스시준 잠실점,"초밥,롤",02-419-0627,송파구,올림픽로35다길 32 지하1층 (우)05510,#데이트코스#친목모임#제로페이,3.2,6,친절하시고 맛있어요@@그냥 그래... 비싸고 맛 없어요. 반찬은 샐러드만 드려요. 잠실에서 젤 맛있는 맛집은 ‘스시참’ 밖에 없네요..  연어초밥/캘리초니아롤  @@ㅠ@@@@가격대비 좋습니다@@이런 숨겨진 맛집이 있을줄이야@@
