식당이름,카테고리,연락처,구,상세주소,해시태그,별점,별점수,리뷰내용
청키면가 무교점,중식,02-538-3913,중구,다동길 33 효광빌딩 1층 (우)04521,,3.7,74,"@@볶음밥 쌀이 안남미라서 외국에서 먹던 맛이 있네요. 완탕면은 아직 익숙하지가 않음..@@완탕면이 너무 먹고 싶었는데 맛있게 먹었어요~@@@@가끔 새로운 국물맛을 원하면 먹을만 함.  하지만 성인남자인데  새우완탕면+새우완탕튀김 먹었는데도 금방 배가고픔.@@새우완탕면, 수교 먹을만함. 짜장로미엔 별로. 토요일엔 볶음밥 안됨(토요메뉴판 따로 있음). 직원 불친절. 주방에서 매우 큰 소리로 싸움.@@@@음.. 볶음면만 맛있음@@먹은것: 새우완탕면, 짜장료미옌과 수교  면이 꼬들한게 인도네시아쪽 꼬들한 컵라면 면보다 더 탄탄하고 꼬들한 맛이에요. 완탕은 국물에서 우려나오는 맛이 있었는데 자주 먹고싶은 정도는 아니였고, 수교는 단단한 맛이 있었습니다. 짜장로미옌과 수교 메뉴는 완탕면의 국물, 수교가 따로 나오고 고기와 소스에 국물없는 면을 말아먹는 맛이였는데 단짠과 고기에서 깊은맛이...@@완탕면 먹으러 다니다가 가지볶음에 반해서 요즘엔 가지볶음때문에 가요  볶음밥도 정말 맛있어요@@면의 식감이 호불호가 있을 수는 있겠지만 완탕이 너무너무 맛있어서 놀랍네요...!@@홍콩 현지의 맛 그대로 느낄 수 있고, 여러 가지 소스맛이 특히나 인상이 깊습니다!! 집 근처였음 생각날 때마다 가는 건데 ㅎ@@완전 비추 비싸기만 하고 돈""아까워서  한번 가고 절때 안감 아무 맛도 없더라  @@맛은 그냥 저냥 괜찮게 먹었는데 좀 불친절... 말없이 툭 던지고 가시네요...@@음식 맛은 나쁘지 않았으나, 다 먹어갈때까지 같이 시킨 음식이 나오지않아 한참을 기다렸습니다. 언제 나오냐고 물어보니 그제서야 아~그거 금방 해드릴게요~ 라고만 해서..유쾌하진 않은 경험이었습니다.@@최고예요@@완탕은 사랑이죠. 홍콩을 못가는 코로나 시대에  유일하게 한국에서 홍콩 여행의 향수를 느끼게 해주는 곳.@@감동적인 완탕의 맛!@@홍콩에서 먹던 바로 그 맛@@@@새우 완탕면 담백하고 깔끔하다 간을 세게 해서 먹는 사람에겐 밍밍하게 느껴질 수 있을 것 같은데 나는 담백한걸 선호해서 너무 맛있었다! 같이 간 친구는 청키 우육면을 시켰는데 나는 완탕면을 시키길 잘했다 헷@@@@홍콩에서 먹던 완탕이랑 꽤 비슷해서 놀랐어요. 제가 갔을때는 직원분들 다 친절하셔서 기분좋게 먹고왔네요. 가격은 좀 비싼감이 없지 않아 있어요@@점원들이 배달오신 라이더분 험담함...한푼이라도 더벌려고 저런다고. 손님도 욕할까봐 놀라서 먹다말고 나옴.@@새우완탕 너무 맛있었어요! 소고기보다 새우 추천합니당@@사람 별로 없는데 불친절함@@보통 제일 유명한 면 식감 진짜 특이하고요  볶음밥은 밥을 하나하나 뒹구는게 제가 좋아하는 그런 아이는 아니었습니다@@가격대비 양은 적음 ㅋㅋㅋ 근데 맛있어서 가끔 가게되네여@@혼자 가서 먹었는데, 맛있었습니다! 완탕면 식감이 특이했어요. 독특한 맛도 났었고, 혼자 가서 식사해도 부담없었습니다:)@@@@꼬들꼬들한 에그누들 생각날때 가는 곳. 나름 홍콩에서의 그 맛을 먹을 수 있는 곳임. 개인적으로 꼭 여기 완탕면 아니더라도 모름지기 완탕면은 테이블마다 놓여있는 그 고추기름장? 을 첨가해서 먹어야 맛있다고 생각함. @@완탕면 먹으러는 갈만함 요리는 너무 비쌈@@@@에그누들 꼬들한 식감이 너무 좋았어요@@완탕면은 정말 기대 안하고가야 맛있다. 면이 꼬들꼬들해서 특이하고 괜찮았는데 존맛탱까지는 아니고... 볶음밥이 맛있다. 청키볶음밥.  요즘엔 둘이가면 청키볶음밥이랑 완탕과수교 시켜서 먹음ㅎㅎ 일요일 브레이크타임 x@@"
유가,중식,02-3789-9688,중구,퇴계로12길 70 (우)04633,#제로페이,4.2,45,"제가 먹어본 유린기중에 제일 맛있었습니다 양도 많아서 완전 최고.,,, 쟁반짜장과 짬뽕은 기본에 충실한 그런 맛이었어요 사장님도 완전 친절하시고 기분 좋은 가게였습니다! @@@@진짜 맛있어요 남산가는길에 맛집엄청찾아보다가 평좋아서갔는데 짜장면은평범하게맛있고 볶음짬뽕이랑 유린기 존맛탱입니다 짜장이랑볶음짬뽕섞어먹어도 맛있고 다음에가면 쟁반짜장 볶음짬뽕 유린기이렇게먹을거같아요 재방문의사있습니다!!!!!!!!@@볶음짬뽕 존맛탱 ! ㅋㅋ 탕수육은 부먹으로 나왔는데도 바삭했어요. @@모든 메뉴를 안먹어 봤지만, 일단 먹어본 볶음밥 짬뽕 볶음짬뽕 맛있습니다.  볶음짬뽕 새롭네요! 서비스도 친절하십니다.  잘먹었습니다. @@소문대로 볶음짬뽕에 쟁반짜장 섞어먹으니 정말 맛있네요@@일반 중국집보다 더 달고 고소하고 진한것 같아요@@굿@@찐맛집@@ㄹㅇ 맛이 미쳣음. 너무맛있다. 나만알고싶은곳 인정,,@@나만 알고 싶은 집@@맛녀석에서 보고 주민추천 이니까 맛있겠지~?? 해서 갔다가 줄 서있어서 못먹고 돌아섰다가 이번에 다시 방문했는데, 일찍가니까 자리가 있네요~^^ 하지만 역시~... 다먹을때쯤 되니까 한 두팀씩 줄 서더라구요~^^ 잡채밥, 짜장 정말 맛있고 계란국 난리납니다~^^ㅋㅋ고기튀김도 맛있었고 볶음짬뽕은 호불호가 좀 있을듯해요~... 왜냐면 조금 맵고 간도 좀 세구요...@@5시까지 쉬는시간…@@유린기 진짜 맛있어@@행복해지는 맛이네요 :)@@괜히 맛집으로 소문난게 아니었구나? 유린기는 내 혀를 유린하였고 짜장면은 탱글탱글한 면빨이 입을 녹였고 결정적으로 잡채밥이 너무 맛있어서 입을 다물지 못하게 만듬 ㅋㅋ 앞으로 중식집 데이트는 유가에서@@잡채밥, 짜장면, 유린기 클리어! 정말 맛있음@@양송이덮밥, 짜장도 넘 맛있네요. 쟁반짜장,볶음짬뽕 콜라보는 담에 시도하겠어 ㅎㅎ@@가성비@@@@먹어본 유린기중에 제일 맛있었어요! 짜장면이랑 볶음짬뽕도 최고~~@@유린기 맛있어요@@직원분 바쁘신 중 친절하시고 음식도 맛있음! 다음엔 와서 요리 먹고 싶네요@@가격이 합리적이고, 양이 풍부해서 좋습니다^^ 맛도 좋고요! 짜장은 기본에 충실하고 제 스타일입니다! 유린기는 기대보단 조금 아쉽네요ㅜㅋㅋ 다음엔 볶음짬뽕과 탕수육 시켜보려고요! 한결같이 오래 장사해주세요!@@일반적인 중국집 대비 짜장면과 탕수육에 들어가는 고기의 품질이 좋습니다.  짬뽕은 많이 맵지 않으면서 슴슴한 감칠맛이 도는 편이고 재료들도 신선합니다. @@@@@@먹어봤던 건 다 맛있었어요~다음번에 라조육밥 도전~@@고루고루 맛있는 집@@유린기는  맛있었어요 나머지는  보통...@@"
서울다이닝,양식,02-6325-6321,중구,동호로 272 웰컴시티 2층 (우)04617,#코스요리#제로페이,4.5,39,"@@플레이팅 맛 좋아요 근데 분위기가 어수선할때다 많아요 자리나 인테리어 배치 때문인진 모르겠지만 ㅠㅠ@@저렴한 가격에 깔끔하고 풍부한 코스요리를 즐길 수 있어서 좋았어요   특히 비스크 파스타, 소고기 스테이크, 딸기+초코크런키+아이스크림 이 세 메뉴는 두 번 먹고 싶을 맛!   하지만 커리 드레싱 곁들인 샐러드는 맛이 너무 강해서 전체 코스 흐름을 깨는 느낌이 들었습니다 @@진짜 맛있게 잘 먹었어요 재방문의사 높음!@@조흠@@다흐흑 세심하게 배려해주신 덕분에 프로포즈 잘 했습니다ㅠㅠ 경황이 없어서 감사도 제대로 못 드렸네요 너무 맛있고 좋은 경험이었어요~!@@가격대비 잘 나오고 맛있었어요 :) @@디너로 방문했는데 우리집 식탁 위에도 있는 이케아 조명을 발견해수 덕분에 케쥬얼한 느낌이었다. 요리들 깔끔하고 색다른 느낌이라 그림먹는 느낌.양이 많진 않았는데 천천히 시간을 가지고 음미하듯 먹으니까 양이 부족한 느낌은 아니었다. 나쁘지 않았다@@좋았음 @@맛잇어요@@@@@@전체적으로 깔끔하고 코스밸런스도 좋았던곳! 아기와 같이가서 인지 룸으로 예약되어 있어서 더욱 편하게 식사할수있어서 너무 좋았다. 서버분도 친절하셨고 메뉴구성도 좋지만 서빙타이밍도 딱딱 떨어지고 좋았음 주차도 어렵다는 얘길듣고 갔는데 평일이라서 인지 생각보다는 어렵지않게 했고 전체적으로 다좋았는데, 내가 간날 한참 식사시간에 안쪽에 공사를 하고있어서 진짜 계...@@각각 맛이 훌륭하지만 양은 저에게는 부족하네요 ㅠㅠ 그래도 너무 맛있어서 별 다섯~!@@미슐랭(2018~2021) 4회, 블루리본도 4회 획득한 파인 다이닝치곤 가격대 합리적임. 실내가 다소 작으나 분위기 괜찮고 규모에 비해 서버와 요리사들이 많다. 런치와 디너 코스만 선택 가능한데 유럽요리를 한국식으로 만들어서 그런지 입에 맞지 않는 음식은 없었으나 나오는 메뉴들이 하나같이 키즈메뉴처럼 미니멀해서 대식가에겐 비추. 이베리코가 정말 기억에 남...@@이 가격에 이 구성 가성비 최고 미슐랭입니다 특히 전체적으로 안짜고 안심이 정말 맛있어요 디너는 평 그닥이라 런치 갔는데 대만족! ^^@@런치메뉴가  가성비가 좋아요. 오늘 돈좀쓰더라도 날위해 즐기고싶다 하는 기분이 들면 가세요 ㅎㅎ@@너무 기대했나, 그냥 평범한 맛.  친절하고 분위기는 좋음@@디너(10만원) 먹어봄. 처음 나온 두 메뉴가 정신이 번쩍들정도로 시큼해서 별로 였다. 바로 다음 요리가 중화시켜주긴했지만.. 생선, 닭고기 요리가 가장 맛있었다.  그러나 새롭고 신선한 맛은 없어서 아쉬웠다. 비슷한 퀄리티에 가격은 더 저렴한 쉐시몽 디너(75000원)가 더 만족스러웠음.@@아직까지는 한결같은 집. @@여기 괜찮았어요!!@@두번째 미슐랭이었는데 정말 만족함 추천함 내가먹은건 점심임 @@훌륭한 음식과 훌륭한 음식점은 다르다는 생각..  아무리 훌륭한 식사라도 가격이 너무 비싸면 가기 꺼려지는데 이렇게 멋진 파인다이닝을 이렇게 훌륭한 가격에 즐길 수 있다니.. 5점을 안줄래야 안줄 수가 없네.@@아주 좋았습니다 전체적인 밸런스도 좋았고... 뽈뽀랑 건고추 퓨레는좀 아닌것 같았구요 그래도 다른 메뉴는 훌륭했습니다 재방문 의사 100퍼입니다@@주변평이 좋아서 예약은 했는데, 전화예약시 직원 태도가 상당히 불쾌하네요. 장사 잘되니까 예의따위는 상관없다는건가요. 식사도 하기전에 이미지 깎아내리는데 아주 이바지 많이하시네요. 맛없으면 진짜 노답일텐데 기대되네요.@@존맛. 다른 파인다이닝은 기본 10은 넘어가는데 여긴 가격까지 아주 훌륭하다. 서비스까지 아주 칭찬해.@@구운토마토 물 질질 흐르는데 옆에 따닥따닥 구운 생선을 올려놓았습니다. 생선위에 올린 밤퓨레? 생선이랑 안어울렸구요. 그옆에 고추장소스? 고추장 맛 전혀 안나고 간도 안맞고 쓴맛나고 매운맛 외에는 느껴진 맛이 없었습니다. 다녀온 수많은 미슐렝 식당중에 최악의 생선요리였네요.  새우로만든 묵(?)은....뭐랄까 니맛도 내맛도 아닌 밍밍느끼... 그나마 죽순피...@@맛이좋아아아@@설명은 생략한다.@@Course Only@@"
유림면,국수,02-755-0659,중구,서소문로 139-1 (우)04515,#제로페이,3.3,102,"맛있지만 굳이 찾아가서 먹을 맛집은 아니예요@@친절하신데 가격대비 맛이 딱히@@맛있고 사장님 굉장히 친절하시네요!@@맛있게 먹었고 무난한 집이라고 생각하지만 일행은 소바찍어먹는 국물에서 계피사탕향과 단맛이 나서 별로였다고 평함@@오래된집이죠 전 아주 맛있게 잘 먹고 다녔어요 @@흠@@@@비빔국수 고명이 너무 없네요. 냄비국수도 평범.@@@@부담없이 가볍게 방문하면 좋은 곳입니다.@@그다지 깨끗해 보이지 않은 고무장갑을 끼고 서빙하는 직원모습 안좋아 보입니다@@메밀국수 먹고 나오면서 배고픕니다, 양이 넘 적고, 제가 간날은 메밀간장에서 멸치비린내가 너무 심해 역겨울정도였어요.. @@유림면이 대중적인 맛이라면 이곳은 재료 본연 맛이 살아있는 메밀국수 웨이팅이 좀 있긴 하지만 회전이 빨라서 금방 순서가 돌아온다@@비빔메밀 맛있었어요@@앞에서  고무장갑끼고  설거지 하고  그  장갑  그대로  서빙해줌  장갑에  빨간 국물  든거  단무지에  닿은거 보고  단무지  안먹음  여름인데  식당안이  더움.  앞에  사장님도  더워함. 양적음.  비쌈.  굳이  이런거  다  감수하고  먹을맛인가  현타옴@@비빔메밀이 좀 더 내 입맛. 웨이팅 있는데 회전율 높아서 금방 금방 빠져서 ㄱㅊ@@오랜만에 갔는데 예전같지 않다. 그래서 식사시간인데도 널럴하구나..@@메밀 생각날 때 한 번씩@@@@회사 근처이나 거의 3년만에 오늘 처음가봤는데 특별히 갈 일 없을듯...@@@@이게 미슐랭이라니 맛도 평범하고 면도 보통이고@@별 5개 미만 혀에 문제있음 ㅇㅇ@@글쎄요..@@도대체 왜 맛집인지 모르겠다. 딱 휴게소에서 먹는 우동 맛. 모밀 맛. 후 비싸@@갑자기 비와서 쌀쌀한 타이밍에 냄비국수 호로록~~ 이집이 괜히 맛집이 아니였음 면발 건데기 국물  하나같이 조화가 잘되고 맛있다 단무지도 인위적인 맛 아니라 굿 재방문 매우 충분!!!!@@맛은 있는데 줄설정도는 아닌것같아요@@@@[ 미쉐린가이드 50년 전통 메밀국수 맛집 ]  유림면, 간판에도 ‘50년 전통’을 강조해서 더욱 기대가 됐습니다. 메뉴는 정말 ‘면’만 있더라고요. 메밀국수, 비빔메밀, 냄비국수, 비빔국수, 온메밀. 고기가 없어서 아쉬웠습니다만 “국수에 엄청 자신있는 맛집이구나” 싶었네요. 저는 메밀국수랑 비빔메밀 주문했습니다. [비빔메밀]은 할머니가 해주시던 고소하면서...@@아니 인생맛집 발견;;;;; 손님도 가득 찼는데 왠지 모를 차분한 분위기와 친절하시고 겸손하신 사장님덕에 기분 좋은 식사를 마치고 나왔습니다  저 원래 이런거 안쓰는데 오늘 처음 음식점 리뷰 남겨봅니다...최고입니다!@@비빔메밀 먹었는데, 투박한 단무지와 양념장이 인상적. 가격이 비싼 느낌@@메밀향 어디에서 느껴지는 지... 메밀 엄청 좋아해서 기대하고 방문했는데 ㅠㅠ 너무 기대해서 그런지 실망함...ㅠㅠㅠㅠㅠ 맛은 나쁘지 않았지만 너무 기대를 하면 안될듯 ...ㅠㅠㅠㅠㅠ 하지만 맛없지 않음 ㅠㅠ 맛도 좋았지만.. 너무 기대를 한 내탓인가... ㅠㅠ@@음 서울 3대 모밀 맛집이랬는데. 솔직하게 평을 적어보자면 너무 더운날 들어가서 시킨 판모밀은 면은 시원하지 않게 온기가 있고 메밀맛이 느껴지는것도 잘 모르겠었습니다. 국물이 진하지 않고 자극적이지 않은데 모밀에 찍어먹으니 밍숭해서.... 더위도 가시지 않았고 맛도 슴슴하니... 마쉐린 2020표시도 되어있던데 뭔가 좀 많이 아쉬웠어요. 모밀장국을 그냥 마...@@육수만 따로 마시면 맛있으나. 면과 먹었을때 맛을 못느낌. 청실홍실 과 비교 했을때 맛은 떨어지며 가격은 너무 비쌈@@@@"
진고개,한식,02-2267-0955,중구,충무로 19-1 (우)04555,#노포,3.7,55,"곱창전골 1인분에 28000원 2인이상 주문가능한 정신나간 가격 ; 외국인손님 상대로 바가지 씌우는 가게인지 밑반찬도 형편없음 곱창전골도 그다지 맛없음 곱은 신선한데 곤약이랑 애호박 이상한 재료들어가서 잡탕 같음  쓸데없이 종업원은 많음 인건비 감당하려고 음식값이 비싼건지 위생도 그리 깨끗한 편은 아님 테이블도 좁고 의자도 겁나 불편   @@곱창전골 3인분 먹었다. 나한테 온 곱창은 딱 2개. 반찬으로 나오는 보쌈 대신 겉절이. 먹을 것도 없이 87000원.주차비는 왜 그리 비싼지 40분 정도 주차에 7000원. 거의 100,000원에 곱창 2쪽이라니. 절대 갈 곳이 못되는 장소. 벌점 -5점@@@@둘이 가서 어복쟁반 주문하고 소주 두 병. 너무 많다고 그러는데도 괜찮다고 고집부림. 반 넘게 포장해서 집 가는 중. 고기도 맛나고 양이 진짜 많네요. 넷이 먹어도 푸짐할 듯. 다음엔 여럿이 와야겠어요. 딱딱한 의자와 그만큼 딱딱하고 고압적인 아저씨 말투는 흠. 그런 의자에 앉아서 드시는 어르신들이 더 대단,@@반찬 전부 말라비틀어져서 못먹었어요... 갈비탕이랑 비빔밥 먹었는데  고기가 너무 별로예요 진짜!!화난다 @@종업원이 센스있고 친절함. 음식도 맛있음. @@숨겨진 맛집@@맛집이여오..@@광어초밥+도시락정식@@아주 오래된 식당입니다. 갈비찜, 곱창전골, 초밥 등 장르불문인 것 같지만, 일본인 사업가를 대상으로 사업하던 곳이란 걸 생각해 보면 고개를 끄덕일만 합니다. 특히 한약재를 듬뿍 넣은 갈비찜은 여기보다 맛있는 곳을 못 찾았어요. 최고의 맛집입니다.  사사롭고 진솔한 여행 블로그 시티헌터 https://www.cityhunter.world@@최고의 맛집으로 인정합니다. 겨울철 만두국 최고지요. 곱창전골 어복전골 게장!  별 다섯개@@손님 식탁에있는 물을 왜 가져가나요?? 서버 훌륭하네요. 좋은 경험했습니다 @@@@@@@@늘 맛있게 먹는 곳입니당ㅎㅎ 직원분들도 친절하시고 손님  모시고 가기에도 좋은 곳이예요ㅎㅎ@@김치 하나만으로도 5점 주고 싶습니다. 친절하고 노련한 응대도 인상적입니다.@@괜찮아요@@@@육회랑 갈비찜은 기억안남는 평범한 맛이었고 어복쟁반이랑 곱창전골은 맛있게 먹어서 처음 맛보고 연달아 몇 번 갔었네요 직원분들도 다 친절하셨어요 @@버섯이 맛이가서 먹다 뱉었네요 기본찬들도 다 말랐네요 먹고 배탈날거같은 맛...@@세월은 지나도 클라스는 변치 않는다,,⭐️@@게장! 아 게장!! 말이 필요없는 집. 내 나이만큼의 역사가 있는 집.@@몇 년만에 들렀는데 식당이 예전의 모습을 그대로 간직하고 있어서 밥을 먹는 동안 행복했습니다. 요즘 새로 생겨나는 식당들과 비교를 하자면 아쉬운 부분들도 있지만 굳이 비교할 필요가 있을까요. 시간과 추억이 깃든 곳이기에 변함 없이 그대로 있어주는 것만으로도 고맙습니다.  이곳에서만 먹을 수 있는 육개장과 오이소박이는 친근한 음식입니다. 충무로와 을지로, 이...@@양념게장 갈비찜 먹으러 가는곳이죠 김치는 포장도 해가고 최고에요@@담백하고 깊은 맛이 좋아요. @@여전히 유명하지만, 짜고 맵고... 왜 유명한지?? 내 돈으로 먹을 바엔 다른 데를...@@불고기랑 양념게장정식 먹었어요. 맛 대비 불고기 가격이 비싸서 아쉽네요. @@갈비찜 오이소박이@@평양냉면을 좋아한다면 여기도 좋아할거에요. 어복쟁반은 너무나 단백고소, 오이소박이는 엄청 시원하고, 갈비찜은 너무 부드러워요 (소이연남 맛이랑 비슷). @@@@@@육계장 갈비찜! 가성비는 떨어짐@@갈비찜@@@@"
우육미,"육류,고기",02-2233-1501,중구,퇴계로 373 (우)04566,#드라이에이징#제로페이,3.8,37,"겉만 살짝 익혀 다 잘라 나온 것을 테이블에서 다시 구워주는 방식입니다. 자르고 다시 굽는다고? 육즙이 이미 좀 나갔을텐데 싶었어요. 이미 자른 단면을 굽는거라 또 살짝만 구워서 줍니다. 마이야르 반응 없이 구워 먹은 스테이크는 처음인듯하네요. 그만큼 맛은 별로였어요. 환기가 잘 안돼서 냄새가 엄청나고 주변에 기름이 많은 것도 단점입니다.@@@@맛있었어요 고기에비해 가격도 싸구요 역시핫플답네요~~^^@@오늘 다녀왓고 2층 자리에 앉았었는데... 벽으로 기어가는 그 무엇.... ㅎ ㅏ 위생 관리 좀 해요 제발 @@애매...@@@@진짜 레전드…@@그날 티본 콘디션은 조금 아쉬웠던편. 그래도 가격대비 훌륭했던 퀄리티@@@@그럭저럭 비주얼만큼의 맛은 아님@@음식은 맛있어보이게 나오는데.. 맛은 그냥 soso~~@@맛있고 분위기조음! 고기 궈주심~~@@한우투뿔존맛 볶음밥존맛 된장찌개랑 짬뽕은 별로.. 하지만 고기가 진짜 존맛이라 다음에 또갈거에요 그때는 된장밥을 시키겠습니다@@보기좋은 떡인데 먹으면 평범해요. @@고기 부드럽고 맛있어요~~ 평양냉면은 별로임@@프리미엄 티본 2인 - 존맛 깍두기볶음법 - 평범@@직원들 착하고 맛있어요옹@@@@ 맛집이 맛으로만 평가되나요? 메뉴야 한우투뿔이니 삽질안하면 평타는 치는맛인데, 직원들 태도와 서비스수준은 해방직후의 전쟁터보다도 못한듯... 맛없으면 안가면 그만인데 일하는 인간들 태도가 엄청 기분나빠서 굳이 댓글쓰고 갑니다. 관계자분들한테 사과받고 싶네요. 사장님 정신차리세요 알바관리하시구용@@나쁘진 않은데 좋지도 않음 @@주변 살아서 자주 갔는데 이제 안갈것 같아요 안좋아도 리뷰 안쓰고 안가고 마는데 기분 너무 나빠서 써요  신당역 주변에 고기집, 핫플들 많은데 점점 경쟁력이 없어지는 거 같네요  된장찌개 시켰는데 전이랑 달리 두부가 없어서 여쭤보니 오늘 다 떨어졌다고 하시네요 시키기 전에 말해주셔야 하는거 아닌가요ㅋㅋ  재료 없을때 가면 그만큼 못먹는 건데 가격도 그대로고...@@티본으로 기분업이 되는곳! 한우티본(2인), 짬뽕 먹었어요~ 이정도면 나름 합리적인 가격같아요~ 콜키지(와인,위스키) 병당 만원이라고 하네요!@@여기 티본도 맛있고 직원분이 옆에서 직접 구워주십니다. 사이드로 나오는 메쉬포테이토랑 식사류인 볶움밥, 짬뽕 다 맛있어요! 웨이팅 있어니까 주말엔 일찍 가세요~@@분위기 좋고 직접 구워주셔서 더 좋은 고깃집. 가격대가 있는 고깃집이라 고기는 역시 맛있는데 놀랐던 것은 짬뽕도 맛있다. 가끔 기분내러 오기 좋은 곳.@@고기도 맛있는데 곁들이는 으깬감자 별미  사이드메뉴로 시킬 수 있었음 좋겠는 @@티본에 붙어잇는 안심만 맛잇음@@가게 와꾸보고 들어갔다 낚임. 티본 시켰는데 식감 실망.  차라리 아웃백이 나을 듯? 평양냉면 심심함. 임팩이 부족. 티본 먹을거면 길건너  백송 서대살이 백배 나은 듯.@@가게분위기도 서비스도 좋음. 특히 으깬감자치즈가 고기랑 너무 잘 어울림. 우미살에 비해 삼결살은 아쉬웠음.@@다 먹어봤는데 우미살이랑 삼겹살이 진짜 너무 맛있어@@분위기 맛 굿굿 목살이 삼겹살보다 맛있었음@@"
