식당이름,카테고리,연락처,구,상세주소,해시태그,별점,별점수,리뷰내용
달콤제빵소,"제과,베이커리",02-495-0010,중랑구,봉화산로 227 (우)02054,#베이커리카페#카카오페이#제로페이,2.4,21,"정말좋아요@@@@값 만 비싸고 맛은 없고, 전에 있던  고깃집이 휠씬 좋은데 정말 맛없는 빵집 , 조금 먹다가 버린 빵은 진짜 처음, 망하고 다시 고깃집이 생겼으면 좋겠다,@@음? 고급화전략인가? 했더만  빵포장 셀프에 빈정상함 빵맛은 그냥 저냥 먹을만은한데 이돈주고 여기서 사먹을바엔 다른데가서 사먹겠어요 이도 저도 아닌 컨셉에 그냥 안타까울따름이네요....@@직접 포장 너무 좋음. 그리고 손님이 직접 포장하는 게 뭐 큰일이라고ㅎㅎ. 요즘 같이 환경 생각하는 사람들에게 딱 입니다. 락앤락 들고가서 담아오면 뚝딱. 비닐봉지 낭비도 안하고 남은 빵은 그대로 냉동실에 넣으면 딱임. 가격은 비싸긴 함. 근데 SNS용 빵집들도 다 비싸잖아요. 이거 생각하면 다 똑같이 비싼 빵임. 갠적으로 쵸코 크로와상 맛있더군요. @@너무 비싼데 빵도 셀프 맛도 별로입니다@@후기쓸려고 보니 다른분들 점수가 엉망이네요 ㅎㅎ 빵먹어보니 빵맛이고 커피마셔보니 커피맛입니다.. 테이블간 거리 멀고 쾌적하네요 시내상권에 20대정도 주차할수있고 뭐 이정도면 굿입니다^^@@주창장이없고 너무달고 고구마 카스테라는 먹어보니 싸구려빵같은느낌 밤식빵도 달아서 금방질리네요? @@눈길을 끄는 외관, 깔끔한 내부.  그에 비해서 비싼 가격, 퀄리티 떨어지는 빵맛. 계산은 친절히 해주고, 포장은 내가. 한번 가봤는데 진짜 한번만 갈것 같음. 별 반개를 줄 수 없는게 아쉬울뿐...@@유기농이라 비싸게 파는듯한데 포장도 셀프고 불편함. 가성비 별로. 빵맛도 그냥저냥. 솔직히 유기농이라고 저렇게 비싸게 판매를 하는건 아무런 정보가 없는 소비자 입장에서 이해를하기 어려움. 빵을 먹고 싶어 왔는데 ~""이 돈이면 고기를""  왜 이런 생각이 들가~@@오픈한 다음날 바로갔는데 빵종류가 적어요 아침마다 조금씩 먹을 빵이 필요했는데 그런종류는 식빵하나.. 몽블랑이랑 먹물바게뜨 두개 샀는데 너무달아요 고급스런 달콤이아니라 설탕단맛.. 셀프포장이라 시럽이 봉지에 덕지덕지묻어서 나중에도 불쾌했어요 개선했으면 좋겠어요@@신내동에 새로운 빵집이 생겼다고 해서 몇 번 가봤는데, 일단 가격이 너무 비쌉니다. 동네 빵집 수준이 아님... 가격이 비싼 만큼 빵이 눈돌아갈 정도로 맛있는 것도 아니고... 손님이 직접 빵 포장을 해야하는 셀프포장의 번거로움은 그렇다쳐도 전반적으로 가격대비 질은 딱히.....@@너무 비쌉니다. 게다가 값어치도 못해요. 심지어 포장도 셀프고요.@@빵값은 비싸고 포장은 고객이 다하고 불만족스러웠습니다.    가격 대비 서비스나 품질 질이 현저히 떨어집니다. 동네빵집이 잘됐으면 하는 마음으로 갔지만 많이 개선 되었으면 하는 바램입니다.@@가격은 비싼데 빵은 스스로 포장하고 잘라야 합니다. 자르는데 빵칼도 구비를 안해놔서 조금 당황했습니다. 팡도르는 처음 먹는데 빵이 질겨 원래 이런가 하고 검색하니 전혀 아니라서 실망했습니다. @@코로나 시국에 빵좀 대놓고 안팔았음좋겠다. 비닐로포장을하던지 뭘로 덮어놓던지...@@이번에 새로 생겨서 벼루고 벼루다가 다녀왔습니다.  빵이 정말 맛이 있었습니다 :) 특히 할리피뇨가 들어간 소세지빵이 최고였어요. 할라피뇨의 매운 맛이 느끼함을 잡아줘서 깔끔하게 먹었습니다.  개인적으로 초코빵도 좋아하는데 초코빵도 종류가 많아서 너무 행복합니다 ㅋㅋㅋ  전체적으로 가게 내부가 깔끔하고 통로도 넓직하여서 빵을 고르면서 다닐때에 불편함도 없었...@@가격이 중랑구랑 어울리지않음 ㅎㄷㄷ 가게규모,직원수에비해 특색있는빵이적어 아쉬워요 이집은 앙버터빵을 조금 딱딱한 식감을 사용하는듯@@평범.@@음악이 흐르는 매장 안에서 빵과 커피잔을 들고 친구들끼리 모여 즐거운 이야기를 나누는 광경을 보며 빵을 중심으로 생기 넘치는 공간 문화가 신내동에....@@빵 맛이...빵 비주얼도... 하하 @@"
다청쌈밥 망우점,쌈밥,02-2244-0909,중랑구,봉우재로 237 (우)02172,#제로페이,5.0,1,다양한 쌈과 반찬에 고기도 구워먹는디 7천원 이라는 극강가성비. 가마솥밥이 질지도않고 설익지도 않고 딱맞게 익은 흑미밥이 나오는데 밥맛도 너무좋다.@@
짜장마루 신내점,중화요리,02-495-6561,중랑구,신내로7가길 11 (우)02085,#제로페이,4.1,15,"기대 이상의 맛이었습니다 탕수육은 가위로 잘라드세요@@진심 맛집@@맛과 가격 모두 만족합니다 특히 짜장면 양이 엄청 많아요 4,500원에 곱배기 양을 주시네요 ^^ 이런 가게가 계속 잘 되었으면 좋겠어요-!@@백화점 불쇼 보여주며 먹는 15000원의 불맛첨가된 짬뽕 짜장면을 먹느니 여기와서 두그릇 먹겠다@@너무 맛있는군요.별을 더 주고 싶네요 @@맛없을 수가 없는 중국집  동네 중국집이라는 것이 아까울 정도.  8번 팔보자장 탕수육 추천!@@두꺼운 탕수육 튀김옷에 뻣뻣한 고기까지 환상의 콜라보네요@@너무 맛있어요@@@@가격도 저렴하고 맛있어요 ㅎ@@날고기는 서비스인가 ? 탕수육 반쯤 베어 물고 삼킨 후에 느낌이 이상해서 보니 거의 날고기! 주인 아줌마는 익은 거란다@@너무 맛없어요 ㅜㅜ음식다남기고왔어요....가지마시길@@사람 많고 맛있음! 짜장 짬뽕은 중상 / 탕수육 상 엄청 바삭하고 따끈함@@갓성비@@진짜 맛있음@@"
도미노피자 중랑점,피자,02-436-3082,중랑구,망우로 377 1층 (우)02086,,1.2,13,"피자스* 드세요 피자스* 드시라고 했어요@@역시 ♩♬♪♪ 점포네요 후기가 전부 꽝이군요 엉뚱한곳으로 보내고 다시 찾아와서 식은걸줘서 돌려보낼 예정입니다. 가게주인인지 전화받더니 몹시 퉁명스럽운 목소리로 그럼 취소할까요 라고 하는데 진짜 기분이 드럽네요.  사과가 먼저가 아닌지… 저런 마인드로 도미노피자점포를 하다니 ,,, 배민엔 댓글알바들만 있는지 다들 좋아라하는데 도미노피자 중랑점은 이제 완전손절...@@그냥 편하게 개인장사하세요 도미노피자 욕먹게하지말고ㅎ@@배달 개늦는데 전화도 안받음@@여긴 걸핏하면 예약주문만 가능하네요. 환장하겠네... 시간도 두시간이여@@방문했는데 직원이 없어서 주문못한다고 죄송하다 하면되는걸 들어가자마자 아무말도 안해서 서있었더니 갑자기 짜증나는 말투로 직원없어서 안된다 소리침 주문밀린걸 우리한테 짜증왜냄 대체 그럴거면 장사왜 하는거임@@앱으로 픽업주문했고 6시전에 픽업가능하다고 떠서 가지러 갔더니 아직 만들고 있다고 해서  조금 기다렸는데, 20분이 지나도 안나오길래 문의했더니 점장이라는 사람이 자기들 시스템상 어쩔수 없다고, 완성 안되도 됐다고 뜬다고 하며 짜증내며 기다리라 함. 뭐 저런 사람이 점장 달고 응대하는건지@@절대!!!! 여기서 시키지 마세요!!!! 좀더 알아보고 시킬걸 괜히 여기서 시켜가지고 먹기도 전에 기분만 잡침. 고객응대가 아주 10쓰레기임. 점장이라는 남자부터 잘못됐는데 밑에사람들이 제대로 배울리가. 실수를 해놓고도 당당하고 배째라는 식입니다. 다시는 도미노에서 시켜먹고 싶지 않을 정도입니다.@@직원응대가 아쉬워요 벨이라도 있던가 다들 뒤돌아서서 잡담하면서 피자만들고 있고 피자가 들어있는 상자도 탁 던지면서 가져가라고 하던데 진짜 무례했어요@@텅 빈 매장에 사람이 와도 아는척도 안함 결제해야할 금액을 손님한테 물어보는건 뭐 어쩌라는건지 참...@@쓰레기점. 배달 예약시간 필요없고 주문폭주때문에 늦는다고 함. 예약시간 25분 초과해서 취소시켜달라니까 불만있는 말투로 변명하다 알겠다고 함@@왜 피자에서 비린내가... 치즈는 무슨 미농지만큼 뿌려져있고... 한마디러 맛이.없네요.. 만원짜리 피자스*이 더 나은느낌.... 다신 주문 안합니다@@배민으로 시켰는데 피클 소스같은거 하나두 안갖다주심!@@"
명동사골칼국수&칡냉면 본점,국수,02-432-2003,중랑구,중랑역로 153 1층 (우)02011,#제로페이,5.0,6,맛있습니다 사장님도 친절하시고 서비스 만두는 화룡정점@@항상 맛있음@@@@가격대비 아주좋음.@@사골칼국수 따봉맛@@맛있는 칡냉면집  필자는 냉면을좋아함 여기는 5개줘도 됨  추천mo!@@
시즌,카페,,중랑구,사가정로49길 62 1층 (우)02221,#로스팅전문#제로페이,4.7,9,@@분위기도 좋고 커피도 맛있어요!! 흑임자라떼 달지않고 좋아요^^@@컵이 심플하니 이뻐요! 산미 있는 커피를 좋아하는데 케냐aa가 떨어져서 아쉬웠어요ㅜ 커피 맛은 평범한 편이었는데 카페가 깔끔해서 좋았어요 @@@@진짜 여기 가지마세요ㅡㅡ 저만 가고싶으까요 >_<@@와플이랑 바닐라라떼랑 먹으니 JMT네요 :)@@너무너무 맛있고 이쁜 공간이에요. 일주일에 여섯번은 가는거같아요ㅎㅎ 다만 먹고 가시냐고 물어보셔서 먹고간다고 말씀드렸는데도 일회용잔에 주시는날이 많은게 아쉬워요...! 하지만 너무 좋은곳이에요@@@@@@
망우정식,한정식,02-438-3918,중랑구,용마산로115길 8 1층 (우)02164,#안심식당#가족모임#제로페이,2.0,3,"@@황태정식 // 황태구이 단품은 괜찮았으나 같이 나오는 국과 반찬은 수량도 맛도 가격대비 한참 모자라네요.  사장님은 여의도 황태*가 가셔서 황태정식 한번 드셔보셔도.. 거긴 올해(?) 천원 올라서 11,000원입니다(임대비 고려)@@음식맛은  그냥저냥 나쁘지 않은데...위생개념이 좀 필요하더군요.  샐러드가 나왔는데 청경채뿌리에 흙이 붙어있고, 밥먹는 도중 파리 두마리가 자꾸 반찬에 앉으려해서 손으로 파리 쫓아가며 밥먹었네요. 식당직원들은 파리쫓아가며 밥먹는걸 봐도 아무런 액션이 없고...@@"
원조춘천 닭갈비막국수,닭요리,02-437-5587,중랑구,중랑역로 79 (우)02101,#제로페이,4.8,5,막국수는 별로 쫄면보다 당면 보끔밥 먹어보쟈 담엔 존맛탱@@카레맛@@원래 좌식이엿는데 입식으로 리모델링했네요  벽지도바뀜 ㅋㅋ 원래오던곳아닌줄알고 나갈뻔 ㅎㅎ 맛은 더 맛있어진건지 똑같은데 배고파서 더맛잇는건지 몰겟지만 어쨋던 맛잇어요 @@맛있네요@@@@
청석골잔치국수,국수,02-948-9819,중랑구,중랑역로 152 (우)02010,#친목모임#제로페이,4.3,4,"잔치국수는 평범하지만 비빔국수는 정말 맛있어요! 주먹밥도 꼬숩고 맛있습니다@@사장님 혼자 하셔서 주문이 밀리면 음식이 늦게 나오긴 하지만 맛있어서 자주 가요 ㅎㅎ@@맛 ***** 시설 *@@맛 대비 손이 느리시고, 위생이 다소 아쉬웠어요@@"
위드마카롱,디저트카페,,중랑구,사가정로49길 6 (우)02228,#제로페이,5.0,33,전세계 프랑스 일본 여기 못비빈다. 2천원에 꾸덕한 두꺼운 필링에 쨈에 각종 부가 재료들에 섬세한 캐릭터 그림까지 최고최고!!! @@유튜브에서 코로나 지원하신 사연 보고 일부러 찾아갔는데 딱 후회안될 정도의 맛입니다. 요즘 마카롱 잘못 사면 쫄깃한 게 아니라 질긴데 꼬끄가 부드럽고 이에 안 달라붙으면서 쫄깃한 식감도 있어서 맛있게 잘 먹었습니다. 저는 청포도 들어간 조개모양 마카롱이 제일 맛있었습니다. 뚱카롱은 필링이 너무 많다고 느껴집니다. 마카롱에 혜자라는 표현 안 맞는다고 생각하는...@@근처에가면 꼭 방문하겠습니다.@@짱짱@@사가정에 이런마카롱집이 있다니 놀랍다@@핵맛있네요 ㅋㅋㅋ마카롱 안좋아하는 저의 인식을 바꿔준 곳입니다. 갈일 있음 한번 가고 싶네요@@가격 좋고 사장님 좋고 맛 좋고@@수니가 최고 좋아하는 마카롱가게@@여기 마카롱 필링 정말 맛있어요~ 일부러 멀지만 찾아가서 사먹어요@@@@여기로군.@@코로나 뿌시고 오신 능력자라는 소문듣고 별부터 박고 구매하러 갈겁니다. 무조건 번창하십시요!@@한국가면 가서 가게에 있는거 다 사올께요... 마카롱 더 만드시느라 혼좀 나셔야죠..@@감사합니다.@@코로나 봉사사연보고 왔어요 폭풍구매로 혼내드리겠습니다@@모처 자게판에 캡쳐글을 보고   응원하러 왔어요 ^^ 실천으로 보여주신 이웃사랑에  이런분도 계시구나하고 기가차서 말이 안나옵니다 ㅎㅎ 멀어서 직접 가지는 못하지만  건강하시고 사업번창하시라고 응원합니다.@@응원드립니다 지나갈때 꼭들를게요@@사가정역이면 집에서 가깝네요  : ]  인천입니다  돈쭐내러 가겠습니다!!@@생업을 두고 의료봉사가시다니 진짜 천사신가봐요. 지나갈때 반드시 돈으로 혼쭐내드릴게요. 항상 응원합니다.@@응원합니다 항상 건강하시고 행복하시길 사업번창하세요 분명 잘되실거에요! 서울갈일있으면 꼭 한번 들리겠습니다!@@4월29일 다시 오픈 하셨다는 소식 들었습니다.  먹어서 혼내줘야 할 가게라고 들었습니다. ^^ 감사합니다. 항상 번창 하시길 기원합니다. @@여기군요 돈쭐을 내드려야하는 곳이!!!!!@@아주 먹어서 혼구녕 내줘야 하는 가게. @@~5월 영업 안 함@@@@택배로 받을수 있으면 구입해야겠네요 대구를 도와주셔서 진심으로 고맙습니다@@@@선한 사람이 만드는 선한 마카롱♡@@그냥 최곱니다. 코로나 박살내는 마카롱 !@@일단 별 5개 박고 갑니다. 코로나 의료 현장에서 최선을 다하시는 헌신에 감사드립니다. 건강하게 잘 다녀오시고 조만간 찾아가겠습니다~@@
경미양꼬치,양꼬치,02-491-7113,중랑구,면목로 277 (우)02240,#안심식당#점심식사#혼밥#제로페이,4.7,7,맛있음@@양꼬치 단골입니다. 양은 적지만 깊은맛.@@맛있는데 불친절함 ㅋㅋㅋ 몇번 말해야하고 대충 대답함.@@맛있음..근데 주문을 잘 못들음...매번갈때마다 주문 한개씩 꼭 놓쳐서..꼭 두번씩 말해야함..@@꼬치 먹고싶을때 항상 여기로 와요. 친절하지만 추가요구사항은 잘 이행이 안되는 편이였어요.@@서비스도 잘주시고 가격대비 음식맛들이 다 좋아요@@동네 맛집 가성비 좋고 친절해요@@
오스테리아주연,양식,02-433-9098,중랑구,봉우재로37길 9 (우)02153,#소개팅#코스요리#제로페이,3.0,12,"정말 맛있었어요...♡ 또 가려구요@@고기는 되게질겼고.. 파스타도 그닥이였습니다 가격 대비 좀 실망스러운 맛이였어요@@세번째 가는데 주방장이 바뀐건지 이젠 안갈거 같다 고기가 질김  맛은 좋은데 소금을 지역별로 뿌려서 짠곳 안짠곳이있음@@넘넘 맛있어요:)@@죄송한 말씀이지만 차림새에 비해 맛이 크게 좋지가 않다. 메뉴에 적힌 설명과 미사여구만 보면 새로운 식경험을 할 것 같은데, 그런 건 거의 없어서 아쉬웠다.@@분위기는 너무 좋은데 소고기에서 소냄새 너무 심해요.. 진짜 못삼킬정도로 ㅠㅠ 파스타에서는 와인향이 남니다.. 양도 적고 두번 다시 안갈듯하네요@@구냥 구래여 기억에 남는 맛은 아님@@@@맛이 뛰어나지도 않고 양도 적어요. 근방에 이런 식당이 없어서 그나마 별 세 개 드립니다 ㅜㅜㅠㅠㅠ@@파스타는 괜찮았지만 스테이크는 완전 비리고 질겼고, 콩피다리도 별로였어요.  다시 갈것 같진 않네요@@확실이 이 동네에 이런 곳은 없지만, 이런 동네에 이런 보물 같은 곳이..! 라고 할 순 없다. 화장실이 깨끗하지 않은건 뭐 그럴수 있다지만, 테이블 매트가 깨끗하지 않아 내가 물티슈로 닦아야했던건 실망스러웠다. 음식은 가격대비 나쁘지 않다고 할 순 있지만 좋다고는 말할 수 없다. @@김동기쉐프는 가게를 꼭꼭 숨겨서 오픈하는 탁월한 재능이 있지만 그걸 힘들게 찾아갈 가치가 있다. 오리다리콩피 최고!@@"
싹쓰리솥뚜껑김치삼겹살,삼겹살,02-435-3339,중랑구,봉우재로 97 (우)02139,,3.3,3,"고기도 부드럽고 괜찬아요.. 반찬도 맛있어서 몇번리필하고.. 볶음밥 으로 마무리 .. ^^ 괜찬은 편입니다@@생삼겹이라되어잇는데 냉동삼겹살나오고 고기질,맛도 안좋고 김치맛도 중국산마냥 맛도이상함  카카오맵평점높길래갓는데 배신당한기분 지인들이 별점준건가?싶음@@맛있음@@"
도리도리야포차 상봉본점,실내포장마차,02-435-5145,중랑구,봉우재로33길 45 (우)02154,,5.0,4,여긴 항상 맛있어요@@진짜 맛있음 술을 부르는 맛 대창도 푸짐하고 맛있고 햇반추가해서 비벼먹으면 감동의 눈물흘림@@닭도리탕 맛있음@@@@
KFC 먹골역점,패스트푸드,02-976-1795,중랑구,공릉로 8 1층 (우)02037,#카카오페이#제로페이,3.9,12,"@@맛과 친절함까지... 갬동입니다 ㅠ@@깨끗하고 친절하고 맛있어요 기름이좋아서그런지 깔끔한맛입니다@@친절.깨끗.맛 삼위일체@@어지간한 kfc지점보다 우수한 지점입니다. @@김지원 종업원님 감사합니다! @@화장실 가는게 너무 불편해요@@@@30분 기다렸습니다 너무 오래걸리네요@@가까운데 kfc가 생겨서 완전 좋네요~ 밤9시 넘으면 치킨 1+1도 하는거겠죠?ㅎㅎ@@kfc치킨이 짠건 원래 감안해야하는 부분이고(트위스터같이 덜 짠 거 먹으면 됩니다) 직원 친절이나 청결도, 음식 나오는 속도는 칭찬할 만 합니다@@치킨을.... 소금에 절이셨나요..... 너무 짜서 안먹고 버렸습니다@@"
구하나,와인바,02-433-9188,중랑구,면목로45길 15-7 1층 (우)02228,#분위기좋은#소개팅#칵테일바#제로페이,4.5,2,더 좋은 와인들이 들어왔으면@@@@
만희네참숯불닭갈비,닭요리,02-491-4918,중랑구,사가정로 371 (우)02228,#제로페이,3.1,8,@@@@다른 분들 말대로 간이 많이 삼삼하고요 야외 화장실의 경우 안팎에 세면대나 호스가 없어서 화장실 이용한 뒤 손을 못 씻어요@@고기만 갈비처럼 저며서 숯불에 구워먹음. 고기자체는 슴슴한데 은근히 깊은맛?있고 매운소스 찍어먹으면 진짜 굳! 파저리.. 두번드세요@@춘천닭갈비 생각나는데 갈 수 없는 상황이면 전 여기로 가요! 맛있어용@@닭갈비 양념 슴슴하고 식감이 버석버석해요; 냉면 그냥 시켜봤는데 비주얼은 엄청 심플한데 진짜 맛있어요ㅋㅋ냉면만 먹으러 가고싶어요@@닭갈비도 맛있는데 진짜 냉면 맛집. 사람 많은 데 이유가 있음@@그닥....@@
짚신매운갈비찜 사가정점,갈비,02-432-6608,중랑구,면목로45길 19 (우)02228,#제로페이,4.3,4,저는 강동사는데 주변에 구리.하남 먹어봤는데 사가정 만큼 잘하는곳 없는듯 퇴근길에 맨날포장하고 싶네유 항상 잘먹고 있습니다 사장님@@@@매운갈비찜 체인점 중 가장 맛있는 곳@@악세서리 사러 갔다가 이사온지 얼마 안됐으니 맛집 아시냐묻고 가게 사장님이 일러주셔서 갔어요 이미 예전에 다른 지점 가봤어서 의구심이 들었지만 그 사장님 믿었어요. 사장님 나빠요@@
굽다503.15,"육류,고기",02-435-3141,중랑구,망우로32길 20 대림빌딩 1층 (우)02120,#제로페이,5.0,1,첫번 방문때 감동해서 친구들 데리고 또 갔는데 모두 대만족하고왔어요 삼겹살은 고기질이 너무 좋고 쫄깃해서 1등!! 이베리코는 육향이 죽음이에요 소갈비살도 아주 좋네요 사장님 완전 친절하시네요@@
꿀꿀부라더스족발,"족발,보쌈",02-434-5853,중랑구,망우로50길 32 1층 (우)02149,#데이트코스#제로페이,4.8,5,"불족도 좋아하는데 온족에 불소스 추가해서 찍어먹으니까 다른 매력의 매운맛을 즐겼네요 ㅎㅎ 주먹밥이랑 같이 먹으면 환상의 조합 ,, 전 족발 여기서만 먹는답니답@@@@@@전반적으로 매장이 깔끔하며, 족말의 맛도 훌륭하다. 종종 방문하는걸로@@배달로 시켜먹고 맛있어서 배민에 리뷰 올리려다가 사진 수정 하려던 참에 삭제를 잘못 눌렀는데....시상에 리뷰 삭제하면 재작성이 왜 안되는지!! 촴나...결국 카카오맵에 리뷰를..ㅎ 암튼 맛있고 양좋은 족발이 멋스러운 부직포백에 고이 담겨 옵니다. 단 불족발은 쪼콤 매워요, 전 잘 먹었지만 남편은 펄펄뛰는거 보니 매운거 못드시는 분은 조심요. 막국수도 맛있...@@"
이가네곱창,"곱창,막창",02-979-0702,중랑구,동일로157길 5 (우)02009,#제로페이,4.9,17,"맛있는데....  양도 많다!!!!!  꼭 먹길 추천합니다!!  아니 조금만 드세요(?)  나만 안 기달리고 포장해서 먹게요!!@@@@너무 친절하고 맛있게  먹었습니다 양도 엄청 많아여@@곱창은 여기서만 먹어요@@곱창 오돌뼈 상당히 괜찮다 근데 돼지 곱은 먹는거 아니라던데..@@여태 먹어본 곱창 중 손가락안에 꼽혀요 쫄깃하고 양념도 자극적이지 않으면서 너무 맛있어요 최고ㅠㅠ@@@@너무 친절하셨던 것이 종종 생각나 썼습니다@@이가네는 사랑입니다♡ 사장님도 너무 친절하시고 음식도 너무 맛있어서 자주 힐링하러 가는곳! 야채곱창이 저의 원픽인데 오돌뼈도 진짜 맛잇어요 술안주로 끝! ＼^0^/ 요즘은 코로나때문에 포장해서 먹는데 변함없이 감동이에요!@@곱창에서 냄새 안나고 맛있어요,,, 맛집 인정...!!!@@맛+가격+친절함 의 완벽한 삼위일체. 나만알고싶은가게. 같이 나오는 미역국으로 인해 술을 먹는 동시에 해장이되는 마법. @@참 맛있습니다. @@친절+맛있음+가성비굿 3박자 척척@@핵존맛 일주일에 한번못먹으면 병걸림@@항상 1인분 포장해가는데, 양도 많고 너무 맛있어요 ^^ 감사합니다 :)@@순대볶음 맛있어요!@@가성비 양 맛 모두 최고 기본에 충실했지만 존맛탱ㅇㅇ@@"
카페향아,카페,,중랑구,사가정로46길 18 (우)02237,#데이트코스#디저트카페#애견동반가능#케이크주문제작#제로페이,4.2,13,사가정역 근처에서 마카롱 제일 잘 하는 집이에요. 기본스타일 마카롱인데 꼬끄도 맘에 들고 필링도 너무 과하게 달지 않아 좋아요. 그리고 크렘브륄레가 왠만한 양식레스토랑보다 더 맛있어요. 단지 영업시간이 짧아 평일엔 일찍 퇴근하지 않는한 못 먹어 슬프네요ㅠ@@마카롱이 진짜 맛있어요 적당히 달고 쫀득쫀득하고 근래에 먹어본 마카롱 중 최고였어요  근데 케이크는 좀 부족하다고 느꼈어요. 무화과 케이크였는데 과일도 크림도 밍밍했습니다. 쉬폰은 폭신폭신하게 맛있었는데 뭐랄까 케이크는 전체적으로 단맛과 임팩트가 부족했어요.@@마카롱 맛있어요@@@@선물용으로 사면서 몇개 더 사서 먹어봤는데 정말정말 너무 맛있어요~ 지나치게 단맛이 아니라 달콤하고 고급진맛이에용 마카롱은 달아서 싫다던 부모님도 맛있다고 여긴 괜찮다 하시네용 ㅎㅎ 커피도 진짜 맛있어요! 사장님 센스도 정말 짱짱입니당 12구는 선물용이라 못찍고 6구만 찍었습니당 색도 이뻐서 눈도 즐겁고 맛도좋은 마카롱이네요!@@마카롱 좋아하시면 꼭 가보세요!!! 사장님도 넘넘 좋으시구 마카롱 말고도 디저트 메뉴 정말 다 맛있어요ㅠㅠ계절메뉴도 있어서 더 좋아요@@사장님이 엄청 친절하시고 마카롱맛나요!@@사장님도 친절하시고 카페도 이쁘고 마카롱 맛집입니다 ㅎㅎ 커피도 맛있어요 ~@@내부는 작고 아기자기해요 디저트는 괜찮았고 음료는 그냥 그랬어요. 마카롱은 맛있어용@@마카롱이 진짜 맛있어요ㅠㅠ 사장님도 항상 친절하시고 너무 좋아요@@커피가 개맛없음...ㄷ 디저트는 평타@@존맛이니까 그냥 가세요 ㅠ 사가정에 이런 데가 생기다니 내지갑 가져가버려@@퍼지쿠키랑 마카롱 존맛@@
