식당이름,카테고리,연락처,구,상세주소,해시태그,별점,별점수,리뷰내용
라라브레드 송파점,디저트카페,1800-1990,송파구,오금로16길 4 (우)05618,#데이트코스#브런치카페#제로페이,3.9,154,"와 다들 라라브레드 라라브레드 할 때 왜 그런지 몰랐는데 진짜 먹어보니까 알겠어요.... 너무 맛있고 이 정도 양 비주얼 맛에 이 가격이면 비싸지도 않은 것 같고 브런치 메뉴가 걍 미쳤습니다ㅠㅠㅠㅠ 지하 공간이 넓고 분위기도 좋아서 브런치 즐기기 딱인 것 같아요!!@@비싸고 그냥 그랬다@@진짜 너무 맛있네요!! 더테러치즈 진짜 춱춱하고 치즈 덕후들 달려가세요!! 그리고 투움바 파니니도 소스가 최고입니다.. 강추해요@@송파의 성심당, 송파의 뚜쥬르! 좋은 재료에서 비롯된 풍부한 맛과 합리적인 가격대가 인상적이다. 오래오래 자리 지켜 주시길.@@석촌호수 근처에 항상 줄 서있는 브런치카페를 봐왔는데 드디어 가봤네요ㅋㅋㅋㅋ 기대 이상으로 맛있었어요@@빵 종류도 다양하고 다 맛있는 메뉴뿐이라 맨날 통장돼요ㅠ 브런치 중에 아보카도랑 새우 들어간 거 먹었는데 지금까지 먹은 브런치 중에 손에 꼽을 정도로 맛있었어요! 재방문할거에요ㅠㅠ@@빵이랑 음료랑 뭐 하나 맛있는 게 없어요...분위기도 시장바닥같아요 파운드케잌 스펀지같아요@@브런치도 맛있고 빵도 맛있었어요! 내부도 예뻐서 브런치 먹고 빵 포장해가면 딱이에요@@다 좋은데 화장실 음악 소리가 너무 커서 귀가 아파요@@새우의 역습? 그거 진짜 맛있어서 2년 전에 먹고도 생각나서 또 다녀왔어요 .. 이번엔 투움바 파니니랑 치아바타에 완전 반하고 갑니다 ㅜㅜ@@빵은 맛있어요. 다만 평일 2층엔 사람 없다고 아주머니 무리들이 무례할 정도로 시끄럽게 떠들어서 금방 나왔네요.. 직원분들께서 다른 층도 자주 오가며 관리해주시면 더 좋을 것 같아요:)@@잠실에 라라브레드 처음 생겼을때부터 갔는데 갈수록 빵도 더 많아지고 브런치도 맛있어지네요ㅎㅎ@@브런치 맛있게 먹었어용!@@식빵은 무조건 여기서 먹어요 쫄깃쫄깃 ㅠㅠ@@빵이랑 브런치가 맛있어서 자주 찾는 곳, 시즌마다 신메뉴도 나와서 자주 가게되는 것 같아요@@갈때마다 사람이 많아서 포장을 주로 이용해요 올리브치아바타랑 쫄깃식빵 진짜맛있어요!@@리뷰 알바들인가요? 동네 아무데나 가서도 먹을 수 있는 그런 빵들뿐인데 도대체 뭐가 특별한건지 리뷰들 정말 ㅠ 속았네@@크로와상이랑 브라운치즈브레드 진짜 맛있어요@@넘 예쁘고 맛있어요 크리스마스 케이크로 강추해요!@@넘나 예쁘고 맛있는 케이크였어요@@엄청 부드러운 딸기 생크림 케이크에요! 잇몸으로 먹을 수 있을 정도로 사르르 호로록~ 딸기도 많이 들어있고 시트도 퍽퍽하지 않아요! 다 먹고 나면 입술이 슈렉처럼 초록초록해지지만,, 맛있어요ㅎㅎ@@갈때마다 맛난빵들이 한가득이라 한두개 사고나오기 너무 아쉬운 라라브레드ㅠㅠ 늦게가면 빵들이 거의 다 팔려가지고 일찍가는게 좋을것 같아요! 매번 빵 포장만 해가다가 최근에 브런치 먹었는데 요기 브런치 맛집이네여!! 파스타랑 파니니랑 둘다 강추입니다! 거기다 이번 크리스마스 케이크 진짜 너무 이뻐요 안에 딸기가 가득가득해서 덕분에 연말파티 잘 즐겼습니당@@사전 예약으로 케이크 수령해서 즐거운 홈파티 보냈습니다! 친절하게 응대 해주셔서 좋았습니다 ㅎㅎ@@사진에 있는 메뉴 진짜 존맛탱 ㅠㅠ 친구가 미리 시켜놔서 메뉴이름은 모르는데 진짜 맛있어요 간단하게 진짜 짱임 ㅠㅠ 다들 드셔보시길 소스가 도라방스.. 또 먹고싶네요.@@처음 가보기전에는 비쌀줄 알았는데 비싼편은 아님(물론 가격이야 높지만 우리나라 자체 빵값이 비싸니)  그리고 앵간한 빵집 보다 맛있음 맛있는빵집 일반빵집 사이 중간쯤은 되는 맛@@먹을때마다 왜 인기있는지 모르겠어요 그냥 무난해요@@쿠키 세 가지 맛 먹어봤는데 얼렌지쿠키가 너무.. 맛있어요.. 다른 종류들도 더 먹어보고싶음ㅜ@@지나갈때마다 사람이 많은거같아서 기대했는데 생각보다 별로에요. 인기메뉴가 다 떨어졌었고 제가 고른 빵들은 그저 그랬습니다. @@딸기요거트 스무디가 진짜 맛잇어요 바닐라 라떼도 생각이상! 더블초코브라우니 맛잇어요  대신 지하층과 2층 다 너무 시끄러워요 ㅠㅠ 핑크색 방은 소리가 울려서 엄청나요;;@@@@연유프레첼?안에 버터들이 다 녹아서 흐물흐물 빵만드시는분 옆에 지나가는데 담배냄새가....괜히 찝찝 위생적으로 괜찮을런지@@@@맛있다!@@음................@@라라브레드는 식빵이 진짜 최고.. 먹어본 식빵 중에 제일 맛있음@@"
청와옥 본점,순대,02-416-3456,송파구,위례성대로 48 반도빌딩 1층 102호 (우)05627,#데이트코스#회식장소#제로페이,3.2,102,"@@3번 가본사람임. 본점2회 분점1회.  1. 간판엔 수제(手製)탕반이라지만  국은 수제일지 몰라도 공장순대임. 2. 현재 24시간 아닙니다. (코로나 문제 오픈8시 저녁10시 끝) 3. 반찬 정갈하고 맛은 확실히 있는데, 멀리서나 20분이상 줄서 기다려서 먹을 만한 맛은 아닙니다. 4. 국밥이 너무 늦게 나옵니다.  직원들이 바쁘다보니 알겠지만 말투가 약간...@@메뉴는 깔끔하지만, 웨이팅이 최소 30분 정도로 너무 길고, 8시 반이 라스트오더입니다. 기대하고 가면 실망하실 것이고, 기대 안 하고 가면 그럭저럭 만족하실만한 수준입니다.@@여러말 많지만  인정할수밖에 없는맛@@식자재 처럼 종업원 취급하면 않될텐데 애석합니다@@카운터 직원 ×싸가지네요...@@알바생 거의 최저시급주면서 일 엄청 시킴  일하는 사람을 사람답게 안 대하니 직원들은 계속 바뀌고..  @@호추천@@안내하는 직원이  고객 에 대한 태도가 영 못 됬네요.기분 나쁘게~~@@오징어숯불구이 맛있다고 합니다@@빈 테이블이 앉은 테이블 보다 더 많은데, 사람들을 일부러 계속 대기시킵니다. 상도 다 치워놓은 상태에서 손님을 안 앉혀서, 코로나야서 일부러 그러나 싶었는데, 그것도 아니고 결국엔 붙여서 앉히던데, 잘 이해가 안가네요.@@웨이팅 심함@@웨이팅 20~30분 정도 하다가 입장했고 편백정식에 얼큰순대국이랑 육회 추가했어요! 가성비 좋고 음식도 다 맛있었는데 아래 후기들 보니까 서비스 관련해서 말이 많기는 하네요ㅠㅠ.. 저희도 주문 누락 실수를 겪었는데 “안나왔어요?” 하시더니 한참 뒤에야 설명 한 마디 없이 뒤늦게 툭 주고 가셨어요. 그리고 화장실의 청결상태가ㅠㅠ 심각했네요@@장사 잘된다고 그렇게 불친절하면 언젠간 망합니다. 음식 맛있어서 기분 좋은데 직원들때문에 다신 오고싶지 않네요. 그리고 육회,육사시미도 포장을 잘해서 사갈수 있게 해야지, 포장판매는 안된다니 답답할 노릇입니다.@@직원들이 자주 바뀐다면 문제있는 식당이겠죠 분명@@@@안산에 있는 시골순대가 더 맛있다!! 순대가 너무 적어 4개가 뭐니  그리고 옆에 앉은 사람 대학생인거 같은데 딱 봐도 누가봐도 다 먹었는데 안일어나더라 ~~ 와  카페에 있는것처럼 앉아있음………. 아니 그건 자유겠지만 딱봐도 기다려서 먹는 곳인데 개념이 있나없나?!@@몇번가봤지만 오징어는 항상 슬쩍구운맛이나고 구운건지 볶은건지모를맛에 오징어가 미지근하다 미리 만들고 모양만만들어서 나오는거같고 중요한건데 반찬이 셋팅되어있는데 무채보고 깜놀했네 누가봐도 먹다남은거 코로나시대에 정신머리없는 가게 직원불러 이거 먹다남은거 내놓은거냐고하니까 새로갖다주긴하는데 이핑계저핑계대고 드러워서 반찬하나도 안먹음  반찬들 잘보세요 다신 안갑...@@맛은 소소인데 문제는 직원교육 안시킵니까? 들어가서 우리가 아니라 우리 앉은자리 뒷 테이블에서 메뉴주문하니까 짜증내고 , 우리쪽 테이블로 오면서 혈압오를거 같다고요? 내가 뒷테이블이었으면 진짜 화났을듯요 12월 3일 오전 10시 22분경 마르고 나이좀 있는 여 종업원이었는데 교육좀 제대로 시키세요@@나방국밥 잘 먹었습니다. 편백정식+얼큰국밥+육회 주문했으며 편백정식에서 나온 국밥에 나방이 나왔습니다. 국과 밥을 새로주셨는데, 이미 입맛은 전부 떨어져서 거의 손도 안대고 나왔습니다. 이제 국밥은 더이상 못먹게 될 것 같네요. 화가나지만 계산도 다 하고 나왔습니다.  문제발생시 손님응대가 너무 장난스러워서 황당스러웠습니다. 얼렁뚱땅 넘기려고 하는 느낌을 ...@@1시간기다렷다@@순대국의 맛은 괜찮고 냄새도 안나서 좋지만, 점원들은 마치 짠듯이 음식 나오고나면 아무리 불러도 오질 않음@@맛집이라고해서 친구랑 먹으러 왔는데 1시간이나 기다려서  먹었네요 순대국밥 맛있기는했지만 기다려서먹을만큼 그런 정도는 아닌듯 @@@@그럭저럭 먹을만하다.  가격대비 혜자.@@청와옥~ 주차는 힘들어도 맛은 최고 입니다~~@@주문 : 순대정식 국물이 진국 고기도 많음...입술에 립밤 바른 것처럼 맨들맨들...계속 댕긴다.....줄 서서 먹을만 함...가격도 장소 퀄리티 대비 착한 편(방이시장 국밥 체인식당도 8천원)@@좋습니다 만족했습니다 @@입맛까다로운 편아닌데... 순대국좋아하고 또 방송도 나와서 기대하고 갔는데.. 편백찜?에 순대나온거 돼지냄새나서 못먹었어요@@오징어볶음 맛나고 순대국은 좀 짜요@@맛있게 먹었음@@Mashitta.   홀이 다소 정신 없어서 식사 집중하기 어려움. 홀 매니저가 캐셔에서 큰 소리로 직원들과 소통하는데..인이어 무전기라도 사는 게 좋을 듯@@들어가자마자 아줌마 직원이 위아래로 훑고 한명이라니까 수기작성하세요 말 한마디 띡하고 자리 안내도 안하고 주방으로 들어가네요 기분나빠서 안먹고 나왔어요 이런집은 안먹어봐도 알듯@@@@순대 맛집@@"
갓잇 송리단길점,양식,02-487-9451,송파구,백제고분로45길 4-14 트리비유 1층 (우)05620,#데이트코스#멕시코요리,4.0,196,"한국스러운 멕시칸이에요! 정통맛은 아니었지만 그래도 맛있었어요~!!@@어센틱한 멕시코 요리는 전혀 아니지만 이정도면 한국에서 꽤 맛있는 멕시코 요리인건 확실합니다ㅋㅋㅋ웨이팅 너무 길던데.....굳이 오래 기다릴 맛은 아니에요!(배달도 되니까ㅎㅎ)@@타코가 맛있어요, 대기가 길어서 타이밍 잘 맞춰서 가야되요 ㅠㅠ @@타코가 정말 맛있어요@@좌석끼리 가까이 붙어 있던것도 아쉽고 무엇보다 또띠아가 무한리필이 아니라는 것은 알고가셔야할거같아요!@@@@정말 맛있긴 한데 테이블 너무 다닥다닥 ㅠㅜ@@@@good food good vibe! definately want to visit again :)@@맛있는데 웨이팅 심함@@직원분들이 다 정말 친절하고 타코도 너무 맛있었어요!!@@@@브레이크타임 끝날때 맞춰서 가서 그런지 한 5분정도 기다렸어요. 음식 나올때까지 시간이 좀 걸리긴 했지만 직원분이 친절하게 응대해주셔서 참을만 했어요! 특히 검정 동글이 안경 쓰신 남자직원분 덕분에 기분좋게 식사할 수 있었어요 세심하게 신경써주시기 쉽지 않으실텐데 감사했습니다. 가격대도 나쁘지 않고 여태 먹어본 타코 중에선 제일 맛있었어요.@@웨이팅 2시간..ㅠㅠ 맛있었지만 그정도의 맛은 아니었어요@@맛있지만 웨이팅...이..@@맛있다 ㅠㅠ 타코 좋아해서 너무 좋았지만 양이 좀 아쉽…@@건강하고 신선한 멕시칸 맛집@@웨이팅이 너무 길고 음식 나오는 속도가 정말 느려요 회전율 최악..집에서 배달시켜먹는게 나아요@@맛있긴 한데 음식 나오는게 넘 오래걸려서 배고팠어요 ㅜㅜ@@맛있어요 가끔 생각납니다@@다른 지점이 더 맛있긴해용..ㅎ@@@@맛있고 친절하심 오픈 맞춰서 10:50분에 갔는데 이미 대기 있어요 일찍 가야 하는 곳@@@@언제가든 웨이팅이 있어서 테이블링 앱으로 원격 줄서기 해놓으면 꿀이에요. 메뉴들 다 무난하게 맛있고 양이 혜자입니다! @@너무 맛잇게 먹었어요 웨이팅 있을 수 있으니 일찍 가는게 좋아용 주차는 여성회관@@@@살인적인 웨이팅이 원망스러울뿐.. 맛 한번 보면 곧바로 사르륵 용서됩니다@@웨이팅 넘 길게했답니다@@기다릴만한 가치가 있는맛ㅠㅠ 나중에 또 방문할게요@@맛있는 플레이트였습니다! 남자 둘이서 배부르고 맛있게 먹었네요@@맛있어용 근데 너어어무너무너무 음악소리가 큽니당..ㅠ@@갓… 주기적으로 먹고싶은맛@@괜찮은 가격과 구성의 세트메뉴를 팔지만, 웨이팅이 극악이라 '이렇게까지 먹을 맛은 아닌데' 싶은곳@@감사합니다. 음식도 맛있는데, 직원분들과 사장님께서 참 친절하셔서 즐겁게 식사할 수 있었습니다. 인기가 많아 다음 번에는 좀 일찍 와야겠어요!@@"
고도식,"육류,고기",02-422-8692,송파구,백제고분로45길 28 (우)05619,#카카오페이#제로페이,3.8,99,"고기메뉴와 어간장 황태소금은 특색있어서 한번 먹어볼만은 했던것 같으나 맥주잔이 문제가 많았다.. 깨진잔2번 기름때 묻은거 1번.. 바닥도 미끄럽고 청결에 좀 더 신경쓰면 좋겠다~@@사랑해요 고도식@@줄 서서 먹을 곳이 아님 바쁨 테이블 관리 안됨 충전 부탁했는데 안됨 직원이 바빠서 못했다 함 대안이 많음@@줄서는식당 알등심~ 천겹살 방이먹자골목옆 송리단길 황태소금과 어간장 찍어먹는 독특한 @@평일 점심 열두시 반 도착, 대기 없이 입장했고 빈 테이블 많더라고요! 알등심 2인, 천겹살 1인, 볶음밥 1개 먹고왔어요. 맛있는데 특별하진 않음… 저는 두 번 갈것같진 않아요. 줄서야 하면 절대 안 갈듯ㅋㅋㅋ@@@@알등심~진짜 맛있게 먹었어요~ 찐맛집이네요@@맛있어요!!!@@이게 왜 맛집?@@진짜 이게 왜 맛집?@@직접 구워주고 소스 너무 맛있고, 볶음밥까지 배부르게 먹었네요@@돼지고기인데 소고기 맛이 나요:)@@@@먹어본 돼지고기중에 제일맛있어요 처음먹었을때 충격을 잊을수없음 밑반찬도 다양해서 다채로운 맛을 즐길수있음@@알등심 강력 추천@@대기만 없으면 최고일텐데, 분위기가 술먹는 분위기라 사람이 잘 안빠짐! 그래도 존맛@@여러 고기구워주는곳 가봤지만 이렇게 고기 굽기 힘든 집은 처음인듯.20분 정도 불판 불만 올리고 고기도 한참 뒤에 주고선 굽지도 않고 계속 고기 구워줬던 다른 테이블들 가고....열받아서 저희가 고기 올렸네요.고기 맛도 다른데 가서 먹어도 될정도라 다신 안올거같아요.ㅡㅡ 환풍기도 없네요.아, 순두부찌개랑 파김치는 맛있었어요.ㅋㅋ@@미래의 나새끼야 혹시 송리단길에 맛집을 찾다 여기가 필터링 된다면 참고하렴.  개성없음, 육향없음, 볶음밥 맛없음, 그나마 천겹살인데 애매함, 알등심 거르고 된장국 거르고 순두부가 그나마 맛있음. 송리단길은 그저 감성 팔이@@후우 또 먹고싶다.. 돼지고기도 이렇게 육즙좔좔 나올 수 있다고요ㅋ@@☆점수기준표☆ 별5개-일부러라도 간다 / 4개-맛있다! 자주 갈만하다 3개- 적당히 생각날때 한번씩간다 / 2개- 2번방문은 그닥? 1개- 이곳을 선택한 과거의 내가 밉다  적당히 맛있고 친절함 순두부찌개 굿 웨이팅이 쓸데없이 너무심한데 이정도까지 기다릴곳은 아님@@맛있어서 눈물흘림@@@@밑반찬이 하나같이 맛이없어요.... 밑반찬 먹으러가는건 아니지만 고기랑 먹을때 김치도 곁들여먹는건데 3종류인가 있었는데 너무 별로... 신경좀써주세요 고기는 무난했어요 디자이너님 브랜딩해놓으신거 예뻐서 방문했던건데 실망..@@맛있어요! 약간 웨이팅 했지만 가격대비 맛이 좋습니다@@순두부랑 된장술밥 맛있네요. 고기도 부드럽고 좋아요~ 웨이팅이 매우 길었어요.1시간 20분 정도 기다렸어요 ㅋㅋㅋㅋ@@맛있어요!!@@@@@@@@@@그럼에도 불구하고 기다릴만한 맛집@@천겹살이 제일 맛있네요 볶음밥은 싱거워요@@고기맛도 좋고 서비스도 좋아요 특히 볶음밥이 맛있음. 주말에 웨이팅이 심했으나 평일은 괜찮네요@@웨이팅은 생각보다 금방금방 빠졌는데 고기는 가격에 비해 양이 적었구 밑반찬이나 이런게 너무 부실했어요. 파로 돌려막기한 느낌,,? 그리고 알등심은 몇개빼곤 퍽퍽한 느낌이 있어서 굳이 또 먹을것같진 않아요@@맛있어요 그리고 고기도 다 구워주시고 직원분 매우친절하세요!! ㅎㅎ 또 가고싶어요@@"
다운타우너 잠실,햄버거,0507-1317-3696,송파구,백제고분로45길 3 1층 (우)05621,#데이트코스,4.0,171,남친이랑 데이트하러 갔는데 넘 좋았어용 ㅎㅎ웨이팅이 좀 있긴 하지만 기다려도 좋은 맛...ㅎ 아보카도 들어간 버거라 든든했어요~ㅎㅎ@@직원들도 친절하고 좋았어요~ 그리고 햄버거는 무조건 트러플입니다. 맛있습니당.@@@@포장도 이삼십분 기다리네요 그런데 맛있네요 다음번엔 치즈버거 먹어서 크라이치즈버거와 비교해보려구요@@감튀도 먹어 보고 싶었는데 나름 다이어트 중이라고 아주 조금 양심 챙겨 보고 싶어서 참았어요... 재료 싱싱한 거 눈에 보여요! 아보카도 겁나 많이 넣어 줘서 부드럽고 패티도 마싯... 술술 들어가여~~~@@말모 멍멍 갈릭감튀 안먹으면 겸상안함 ♡@@존맛!@@너무 맛있게 잘먹었어요!! 체고체공@@@@@@원스타올드패션드 햄버거가 더 맛있었던 기억. 한 번 먹을만한 곳@@가격이야 치킨 한 마리 값나왔지만 차치하고 혼자 포장해다가 먹었는데 진짜 맛있어요ㄷㄷㄷ@@맛있지만 갈 때마다 주차요원때문에 기분 나쁨@@@@@@@@념념 치즈버거 정석의맛@@청각장애인이라고 안 들린다는 제스처로 여러번 표시하였으나 직원이 마스크 쓴 상태에서 말하니까 소통 불가로 매우 불편합니다 주문 마감 시간을 표시해서 보기 쉽게 안내해주시면 합니다@@아보카도버거가 제일 유명하다고해서. 토요일 12시좀 넘어서 갔는데 20분쯤 대기있었어요. 11시오픈@@햄버거에서 따끈따끈 먹는 내내 김이 나고 퀄리티가 좋음 아보카도 버거는 담백하고 건강한 맛 재방문의사 많음~ 버터갈릭 프라이도 맛있다 음료가 다양해서 좋음@@가격 생각하면 쏘쏘@@@@좋습니다 @@햄버건 쏘쏘 과카몰리감튀맛나요@@그렇게 웨이팅해서 먹을 정도는 아니에요 다른 수제버거에 비해 너어어어어무 평범한맛.. 딱히 와 맛있다 할정도는 아니에요 그냥 햄버거 글구 양 적어요@@@@@@최애수제버거집!!! 유명한곳 여기저기 가봤지만 이곳보다 맛있는 곳을 못찾았어요~@@아보카도 추천으로 먹었는데 왠지 선호도 떨어지는 조합이었음에도 불구하고 맛있었다 건강버거!맛까지 굿@@아보카도버거 해쉬브라운버거 버터갈릭프라이즈 진짜 너무너무 맛있었음! 수제버거집 중에서도 진짜 손꼽을만큼 맛있음! 최고!@@@@맛은 있는데 웨이팅 1시간넘게 하면서까지 먹을 맛은 아니에요^^... @@@@인생 최고 수제버거집 @@@@
해주냉면,냉면,02-424-7192,송파구,백제고분로7길 8-16 1층 (우)05561,#제로페이,3.3,129,"댓글들 다 어디 알바들인가.. 매운거 호불호야 당연히 그렇다쳐도, 불친절도 호불호 갈린다고 쳐도.. 대체 가격 얘기는 진짜 정신이상자들인가.. 20년 전에 가격이랑 지금 가격이랑 같음? 당신들 20년 전 월급이랑 지금 월급 다르다고 누가 욕하면 기분좋음? 뭔 이상한 소릴 내뱉고 있어.@@너무 자극적이게 매워요 거의 버리다 시피했어요 ㅠ 맛도 평범한데 왜이렇게 인기가 많은지 모르겠네여 @@맛있어요@@맛있어요@@너무 맛있어요 ㅎ@@가끔씩 양념의 맵기 정도가 달라지긴 하는 것 빼곤 10년 넘게 찾아가고 있는 단골맛집 매운냉면 먹고싶은 날엔 여기가 최고임@@그냥 쏘쏘 .. @@@@예전이랑 맛이바뀜 부모님때부터 30년 넘게 다님 몇주년인가 주던 수건까지 집에있음 그만큼 단골인데 몇년전쯤부터 맛이 좀 바뀜 아무리 뭘 추가해도 그맛이 안나더라 물냉...@@@@인생 최고 불냉면@@@@매워서 호불호 많이 갈릴 것 같지만 한달에 한두번은 생각남. @@20년 넘게 다녔어요 오래오래 장사해주세요 스트레스 받을때는 해주냉면 최고  @@기대보다별로@@20년만에 방문  가끔 매운맛을 보고싶을때 생각나는 냉면@@왜 7000원인지...... 처음 먹었던 때가 4500원? 그 정도였는데 그때는 맛도 맛있게 매워서 잘 먹었어요 그런데 어느순간 오천원 육천원을 지나 칠천원이 됐는데 ... 안사먹어요. 육수도 가위도 무도 셀프고 맛도 보통인데 가격이 비싸요.@@유명하다고해서 기대했는데..호불호갈릴거란 후기를 보고도 갔으나..나는 불호. 진심 집앞에 있는 어느 냉면집을 가도 여기보다 맛있을것이다. 육수 짬.@@맵기민햐@@죤맛 ㅋㅋㅋ@@여름엔 냉면 ㅋㅋ@@그냥 그래요. 사람은 엄청 많네요.@@@@@@좋아요.!@@예전에 모텔촌 사이에 있을때는 만두도 쿨피스도 없었는데 갑자기 생겨서 당황 (오랜만에 감) 그래도 변함 없이 매운 양념장 ^^ 존맛 혀와 위를 때리는 매운맛 @@장점 엄청빨리나옴 단점 엄청불친절@@맛없어요  왜 유명한지 진심 모르겠음  그냥 동네 집앞 냉면집이 더 맛있네요@@토요일 2시 기준 웨이팅이 있었지만 회전이 빨라 오래 기다리지는 않았음 먹을때는 나쁘지 않은데? 정도지만 먹고 나와서 또 생각나는 맛 @@포장은 무조건 2인분부터 가능. 가격은 2021년 5월달 기준으로 6000원에서 1000원 인상 되서 7000원. 육수가 맛있다고하는데 마셔보면 MSG맛. 육수맛이 일정하지 않고 어떨땐 싱겁고 어떨땐 너무 짜다는거. 옛추억 소환으로 가끔가나 모텔골목쪽에 있던 그때가 더 맛난듯..@@난 맛있음.. 얼죽아 아니고 얼죽냉@@@@아니 손님좀 잇었다고 바쁜척하는건지 죄다 셀프면서 아줌마들 겁나 돌아댕기면서 툭툭치고 다님 그리고 식당에서 숟가락을 안줌 ㅋㅋㅋㅋㅋ 물냉면이러서 숟가락 달라니까 우린 숟가락 안줘여~이러네 참나 ㅋㅋㅋㅋ 면도 다 떡저서 풀어지지도 않고 맛도 서비스도 최악 다시는 안갑니다 매운맛도 그냥 켑사이신만 넣은건지 속만 쓰린 매운맛임 @@말해뭐해 최애임@@맛있고 친절하다. 15년째 오는데 올때마다 먹는법 설명해주실정도로 친절함;; 후기에 정신 이상자들이 많넴@@"
