식당이름,카테고리,연락처,구,상세주소,해시태그,별점,별점수,리뷰내용
오챠드1974,이탈리안,02-2252-1974,중구,퇴계로 373-1 (우)04566,#데이트코스#제로페이,3.1,27,"가격대비 퀄이 좀….많이 낮다 그냥 전시보고 가까운 곳이라서 들렸는데..더 알아보고 다른 곳 갈 걸 생각했다@@무난하게 괜찮았어요@@맛없다..@@음식은 꽤 맛있었습니다! 근데 시간이 오래 걸려요!! 너무 오래요. 테이블 간 거리는 멀지 않고 좁은 편인데 왜 다들 마스크 벗고 떠드는지... 제지를 안할거면 환기라도 되게 문 좀 열어뒀음 싶네요.@@신당역 근처 맛집!  모듬버섯스테이크샐러드와 오챠드피자 먹었는데 너무 맛있었어요 ㅎㅎ 직원분들도 친절하고 분위기도  좋아요.@@동대문이랑 가까운 파스타집! 피자랑 스테이크 먹었는데 기대이상으로 맛있었음♥@@만약에 이 집을 꼭 가야겠다 하시면 여러분  ‘스테이크샐러드’ 드십셔 !@@@@@@진짜 별로네요;;;;; @@1줄 요약: ""2명이서 4만원대 먹는데, 홈메이드 파스타보다 못한 퀄리티""  이 음식의 맛을 본 사람이라면 차라리 집 근처 마트에 가서 가장 싼 소스를 사서 직접 파스타 해먹는 것과 비슷하다고 느낄 맛.  음식 퀄리티 대비 매겨진 가격을 지불하기 매우 이까울 정도였음.  etc. 주방 들락날락 하는데 아무도 위생모를 안씀. 코로나19 때문에 사회적 거리두기...@@뮤지컬 보기 전 근처에 있길래 방문했던 식당.  샐러드가 2만원이 넘길래 무슨 자신감으로 비싸게 받나했는데 3만원 받아도 먹을 맛이었다. 샐러드에 들어있는 고기는 입에서 살살 녹고 버섯, 가지 등등 샐러드에 있는 모든 것들이 최고였다. 이 곳에 베스트 메뉴라고 말할 수 있다.  게다가 화덕 피자의 도우는 왜그리 쫄깃한지...  다만 파스타는 어디서나 먹을 ...@@작년에 갔었지만 시간이 많게 된 이 시국에 리뷰를 써봄  여기서 먹고 나오면서 다음에 우리가 너무 자만해졌다 싶을때 자기자신을 되돌아보고 싶을때 이 시간에 다시 오자고 얘기했던 기억이 남. 그만큼 우리가 잘못한게 대체 뭐였을까 되돌아 보게 해준 곳임@@맛있어요 버섯많아서 좋았어요@@공연 보러온김에 우연히 방문. 의외로 음식들이 맛있네요. 비주얼도 좋고 재료를 아끼지 않는 느낌입니다. 전 30분 정도 웨이팅 했어요.@@브레이크 타임 40분전에 갔는데 식사 안된다고 해서 헛걸음 했어요. 공지된 것도 없는데 손님 받는 시간이 마음대로 인 것 같아서 좀 별로네요.@@평도 되게 좋고, 웨이팅도 있어서 갔는데.. 하.. 진짜 스테이크샐러드는 정말! 맛있었는데, 그 뒤에 나온 오일파스타.. 오일이 그냥 맛없었어요..싸구려맛.. 토마토리조또도.. 진짜 싸구려맛....  최근에 다른곳에서 토마토 리조또 먹은 곳이랑 진짜 비교됐어요... 저희가 메뉴를 잘못 시켰을 수도 있는데 그 2개는 진짜 별로였어요 ㅠㅠㅠㅠㅠㅠㅠㅠㅠㅠㅠㅠㅠㅠ...@@생각보다 작았고 분위기는 괜찮았음@@주말인데 웨이팅도없고 음식이 다 맛나네요 ㅋㅋㅋ 가격도 이정도할만하네요 양도 많구요 ㅋㅋㅋ완전배부릅니다 ㅋㅋ 밑에 리조또 평보고 시켜봤는데 성공ㅋㅋ고기도 부드럽고 많고 꾸덕하고 맛있습니당ㅋㅋㅋ루꼴라토마토파스타도 짭조름하면서 루꼴라랑 잘어울려요 ㅋㅋㅋㅋ 저 피자는 여기 시그니처피자인것 같은데 야채가 달콤상큼하고 도우도 쫄깃하고 담백해요 ㅋㅋㅋ 홀직원도 모두 ...@@평이 좋아서 갔는데 매우 불쾌한 서비스 받고 왔네요. 앉는 자리 바닥에 휴지도 안치워져있었고 위생도 별로였고요. 일부러 찾아갔더니 거기서 저녁먹은 것 때문에 행복했던 주말 저녁이 안 좋게 마무리 돼서 생각할수록 너무 화가 나네요.  생맥주에 이물질 있는건 자주 있는일인가봅니다. 대수롭지 않게 여기시더라고요. 개인적으로는 별 반 개도 아깝습니다  굳이 로그인...@@가격이 너무 사악하나 맛은 평타 치는 곳@@@@이거 두가지 시켰는데 소스가 진하고 정말 독특하고 맛있어요 고기도 큼직하고 꼭드세요!!@@@@좋습니다!@@스테이크 샐러드& 엔쵸비 파스타&토마토 리조또& 샐러드파스타  오랫만에 맛난 맛집 탐방.@@Pasta & Risotto@@"
산동교자,중화요리,02-778-4150,중구,명동2길 26 (우)04535,#노포,3.4,56,"동네 중국집만도 못함. 불친절한 아줌마들.  미지근하고 성의없는 음식. 불결한 실내. 다신 화교식당 안가고 싶음.@@이것은 인생 오향장육이다 오향장육에 물만두 넣어먹는 천재 맛도리조합 추천해주시는 사장님... 이 집은 진짜다@@불친절@@아이들 데리고 갔는데 소스 따로 달라고 하니 먹기 좋게 따로 주시고 친절하셨어요. 군만두도 맛이 좋더라구요. 물만두도 먹어보고 싶었는데 이미 시킨 게 양이 많아서 다음 기회에 와서 먹어볼까 합니다.@@군만두는 재탕한듯 바싹 말라서 두개먹다가 도저히 포기. 옆 테이블꺼는 멀쩡하던데... 항의했더니 목청높여  뻔뻔한 변명일색. 원래 만두는 한번 튀겨놓는단다. 옆테이블꺼랑 비교해보라니까 원래 색깔은 제각기 다르단다. 수십년 장사했다는 아줌마가 변명도 후지다. 저런걸 손님상에 올리는 마인드와 그걸 지적하는 손님을 대하는 태도를 보니 다시는 가고싶지않다. 별 1...@@몇년전에 간짜장이랑 탕수육 시켜먹었던걸로 기억하는데 간짜장은 야채인가 해물에서 셔가지고 쒼 맛이 올라왔었고 테이블 밑에는 죽은 바퀴벌레 시체가 있었고 테이블에 앉아 살짝 보이던 주방은 너무 더러워서 다시 올일은 없겠다 싶었습니다 @@짜증날정도 맛없는집 짜장나오는데 20분걸림 면은 탄력없고 짜장은 싱겁습니다.  이에 불친절과 주문혼란은 덤!@@삼선간짜장, 굴짬뽕, 탕수육을 시켰는데 삼선간짜장은 손톱만한 냉동새우 몇개에  일반과 3천원 차이가 났다. 굴이 철이라 굴짬뽕 시켰지만 조미료와 마늘맛에 혀가 얼얼했고 몇개없는 굴맛은 전혀 느껴지지 않았다. 탕수육은 조밥을 내놔서 애기 새끼손가락만 햇다. 같은 층에 있는 모든 분들이 남기거나  맛없다고 중얼거리고 나가셨다.   음식을 남기는 걸 정말 싫어하...@@오랜 내공이 살아있는 맛집입니다.@@오래된 내공이 느껴지는 내부와 서비스ㅋㅋㅋㅋ중국집에 덴뿌라요? 역시나 튀김에 일가견이 있음ㅋㅋㅋㅋㅋ빨간 젓가락까지 취향! 둘이 가서 배터지게 메뉴 3개 클리어하고 사장님하구 담엔 오향장육에 물만두 먹으러오겠다고 웃으면서 약속하고 나왔닼ㅋㅋ 예약도 되긴한데 그냥 안붐비는 시간에 가면 좋을듯!@@최악입니다. 맛도 동네중국집만 못하고 서비스 최악에 고객이 주문한 음식도 더 비싼걸로 바꿔서 주문하시더군요.   또 물만두는 원하지도 않았는데 서빙하는 동시에 오향장육 위로 부어버리시지를 않나..   뒤에서 서빙하시는 분은 밥 먹고 있는데 가래를 영혼까지 끌어모아서 휴지에 감싸 버리시지를 않나.   먹다가 소리 때문에 토할뻔 했어요. 밥맛떨어지는 생생한 소...@@@@@@@@한 10년 넘게 산동교자 이용하고 있는 사람입니다. 주방장이 바뀌면 약간씩 맛이 변하기는 했어도,그래도 꾸준히 평타 이상은 하고 있었는데,(잠깐 불향이 강해서 한 마디 할까 한 적은 있었지만. 기실 불향 어쩌고 하는데 그거 탄 맛입니다.) 방송의 힘이 무섭기는 하더군요. 이제는 정말 평범한 동네 중국집이 된 것 같습니다. 볶음밥이 기름 범벅으로 나오는 것도...@@아니 앉아서 먹기 좀 드러운곳 같아서 포장해달라니까 1인분은 안된데 ㅋㅋㅋㅋ 청소좀해요 그랬음 앉아서 식사하고 오향먹지 ㅠ @@오향장육과 물만두가 유명하다고 해서 먹어봤습니다. 바닥에 깔린 소스는 새콤하고 파는 아삭하고 마늘은 매콤하고 여러가지 향이 어우러져 맛있게 먹었습니다. 다른 테이블 전부 탕수육 드시고 계셔서 고민 끝에 도전해봤는데 후회는 없네요.  물만두는 오향장육 소스에 먹어도 맛있고 간장에 찍어도 괜찮았어요.  배가 약간 덜 차서 추가로 주문한 군만두가 사실은 제일 맛...@@물만두 군만두 탕수육 먹었고 탕수육 맛있어요 튀긴 음식 추천해요 위생은 기대 마시고요 오항장육 먹으러 조만간 재방문할 예정입니다@@짜장은 싱거운 예전 스타일 . 찾아갈정도는  아님  주문,계산시 확인 필수 - 맘대로 2인분주고 계산 포함 좁은공간 ㅡ 테이블간 거리유지 없음 . 칸막이도 없음 @@2층 자리는 복층 주택의 그것처럼 천장도 낮고 불편하지만, 그만큼 자신있는 집이란 생각이 듭니다. 짜장면은 이 주변이 그렇듯 묽은 느낌으로 괜찮고, 군만두는 왜 이집의 상호명이 되었는지 알게 하는 퀄리티입니다. 격한 감동까진 아니고 보통이라 생각할 수도 있었는데 결국 교자가 다 했다 라고 말씀드릴 수 있겠습니다.@@음식 최고!@@최애 중국집이었는데 오랜만에 가보니 평범한 중국집이 되어버림...@@짬뽕과 물만두!! 맛있어요. @@오향장육이 유명하지만 짜장면도 맛있네요@@위생이 너무 별로였습니다.. 맛도 그냥 그겋네요@@음식은 맛있어요. 주류 주문시 조금이라도 더 비싼걸 팔고자 하는 사장님의 강력한 의지때문에 좀 불편해요. 뭐 이해는 합니다만. @@짜장면과 탕수육이 정말 맛있어요~~@@탕수육 개맛있아요  짜장은 맛있는데 짜요ㅋㅋ 면발 겁나부드럽구 사장님도 친절했어요@@맛있음 모든 메뉴 먹어보고싶다.. 덴뿌라 짜장면 추천@@@@@@군만두@@굴짬뽕 맛있음@@탕수육은 부먹으로 나오고 핵꿀맛 짜장면은 그냥 평범 담에는 오향장육,만두 먹어볼래요 @@오향장육과 물만두가 맛있는집 계절음식 굴짬뽕~~~@@"
도치피자 장충점,피자,02-2277-8005,중구,동호로24길 27-6 (우)04617,#가족모임#데이트코스#분위기좋은#빈티지분위기#회식장소#제로페이,2.8,33,"바퀴벌레 나왔어요.  주차장 없음. 유료 주차 따로하고 와야 되요. @@피자가 바삭한스타일은 아님 그래도 마싰! 파스타는 오일류 추천@@@@제가 계산안했는데 돈아깝습니다 피자들고 먹는데 손이 씨꺼매져요 탄재가 후두둑 떨어지고 다 씨꺼매서 먹을수가 없습니다 겁나 비싸기만하고 맛도 이건 아닌거 같아요 지금보니 리뷰 개안좋네 밑에 탓다고 하는글도 있는데 음식값에 비해 성의도없고@@나쁘지는 않지만 가격 생각하면 좀 아쉽네요 피자보다는 파스타가 더 맛있는 듯?@@I went there with a friend. After checking in we waited for the waitress and she made us wait for a while. We decided just to look at upstairs whether it was full or not. After seeing that upstairs wa...@@평이 안 좋아 걱정했는데 운이 좋았던 건지 직원 응대도 만족스러웠고 피자도 너무 맛있게 먹었어요@@화덕피자를 좋아합니다. 운좋게도(?) 동네에 나름 맛집이 있어서 종종 들러왔고요. 시국이 시국인지라 외식을 자제하던 중, 간만에, 부러 사람 뜸한 시간을 골라 방문했습니다. 그런데 언제 이렇게 방침을 바꾸었는지 손님응대가 엉망진창이네요.  2층 가도 되냐니 2층은 오픈 안했다, 그럼 창가 구석 세팅이 잘되어있는 테이블에 앉겠다니 거긴 우리가 써야한다?(대체...@@화덕피자 매니아인데, 도우가 많~이 아쉽네요. 너무 두꺼워요. 바삭함 없고.... 일행이 도치피자 다른 지점도 똑같다는 걸로 보아, 장충점만의 문제는 아닌 듯...  분위기나 서비스는 나쁘지 않았어요. 신라호텔 투숙객인데, 장충동 족발보쌈 싫으시면 한번쯤은 가볼만 합니다.@@두 명이서 프로슈토 피자랑 크림 베이컨 파스타 하나 시켰었는데 아주 맛있고 배부르게 잘먹었습니다. 밤에 갔어서 그런지 분위기도 조용하고 괜찮았었습니다. 그래도 가격은 꽤 있는 편이긴 하죠.@@부모된 입장에서 마스크착용하고 일하는 직원들 보니 안쓰럽네요 맛있게 먹고 갑니다@@조금 비싼게 흠이라면 흠... 그래도 피자맛은 일품!! 주방이 뻥 뚤려 있어서 인지 직원들 일하는 얘기가 들리는것도... 볼륨만 조금 낮춰주시면... 그래도 직원들이 친절해서 봐줌 ㅎㅎ@@@@최악의 서비스@@최고에요@@@@주방부터 홀까지 싹 다 갈아치워야 함. 가격은 비싸게 쳐먹으면서 그냥 딱 동네 피자 퀄리티. 가격 생각 안 하면 그럭저럭 먹어줄만 한 정도.  제일 큰 문제는 홀 서빙하는 양아치들임. 1. 지들 떠들고 핸드폰 하느라 몇 번씩 불러야 오는 건 기본. 2. 내가 돈 내면서 뭔 떠받들어 달라고 하는 것도 아니고 살면서 구박받는 느낌으로 밥 쳐먹은 건 또 처음임....@@회사옆이라 종종가는데 예약전화 한번 할랬다가 ㅎ 몇마디도 안하는 예약전화에 이렇게 언짢게 만드는것도 능력인것 같아요. 자리도 잡아주지도 않았지만 적어도 예약을 못잡아주면 빈말이라도 미안한 척이라도 할텐데 ㅎ 워크인할 정성 없으면 ㄲㅈ 수준이였어요 ㅎㅎㅎ  되려 알바가 더 친절하게 받고 주인인지 매니저인지가 전달 받아서 전화를 받더니 저렇게 말해서 너무 벙쪘...@@음식은 나쁘지 않았으나 직원들  매너가 꽝이네요 너무 친한지 수다 삼매경에 불러도 수다떠느라 나타나지 않고 주방에서 수다떠는 소리가 테이블 까지 시끄럽게 들립니다. 심해요@@외관좋고 점내 분위기도 좋은편이다. 직원들 태도는 보통. 음식은 맛은 있었으나, 특히 피자는 퀄러티에 비해넘 비싸다;;  한번은 가도, 코스트퍼포먼스땜에 두번은 안갈듯..@@로제맛 나는 파스타 먹었는데 진짜 최악이였음@@초심을 잃었네요,,, 도우가 두껍고.토핑도 없어서 빵만 잘 먹고 나왔습니다^^@@진짜 최악  초반엔 장충동에 이런 가게가?! 하고 좋아했다가 그 이후로 가면 피자는 다 타고 파스타는 맛없고 그냥 비싸고 요리 못 하는 집@@예전에 먹었을때는 무지 맛있었는데, 맛있는 피자집들이 많이 생겼는지 평범한 느낌이였음. 그래도 맛 깔끔하고 분위기도 괜찮은 편임@@피자가 토핑만 다르고 맛이 똑같아요  보기만해도 예측가능한 맛 백종원 선생님 오셔야 합니다 서비스도 그닥 맛도 그닥  피자가 맛이없기가 힘든 음식인데 돈아까운 맛입니다. @@@@도우 다탄걸 주네요,,,다신 안갑니다@@@@@@화덕 피자 맛있어요~^^@@"
한가람 본점,한정식,02-318-3088,중구,남대문로5길 25 1층 (우)04526,#건강식#데이트코스#약선요리#제로페이,4.2,40,"밑반찬 메인 후식 단호박 식혜까지 다 맛있었어요~ 잘먹고 갑니다 @@오랜만에 영양 가득한 식사를 하고왔네요. 다른 메뉴 먹어보러 다시 방문하려구요. @@그냥 나쁘지 않아요ㅎㅎ 근처에 있으면 자주 올거 같은데 멀리서 찾아 올 맛은 아님@@@@제 인생 식사였어요  깊이가 다릅니다  ㅠㅠ  @@웬만해선 리뷰를 남기진 않습니다.. 어머니 모시고 간다고 네이버, 인스타 꼼꼼히 찾아보고 갔는데 매우 실망스럽습니다. 절대 추천 안합니다.  음식도 그냥 그렇고, 분위기도 어수선에다 시끄럽습니다. 음식도 툭툭 놓으면서 서빙이 다된줄도 몰랐습니다.   예약 확인도 안하고, 결제할 때 비용도 알려주지 않고 마지막까지 서비스 너무 별로네요.  기분 좋은 식사하시...@@네이버 예약으로 하루전에 예약했어요 사장님이 친절하시고 맛도 괜찮네요 감사합니다 !@@밑반찬 진짜 맛잇어요  근데 떡갈비가 황태 떡갈비여서 넘 슬프네여 그냥 떡갈비로 하지ㅠㅠ @@그냥 밥 먹을 곳 없나 찾다가 들어간 집인데 건강한 맛으로 맛있었다. 밑반찬으로 나오는 김치전은 밀가루가 너무 많았지만 그외의 밑반찬과 메뉴는 맛났다@@간장게장(1인에 3만원) 주문해서 먹었습니다. 가격대비 음식에 대한 성의가 부족하고 맛도 특별함없이 평범합니다. 밥집인데 최소한 쌀은 좋은거 쓰셔야죠~@@너무 많있어서 다 먹고 찍었네요 짜지 않고 재료가 신선하고 친절해서 강추합니다~♡♡@@연잎정식 12000원으로 올랐네요… 그치만 밑반찬도 맛있고 연잎밥도 맛있어요! 반찬 리필해서 더 먹음! 먼가 건강한 한상을 먹고싶은 날이었는데 딱 거기에 맞는 식사였음!!@@@@진짜 맛있다ㅠ 후회하지않음 주차는 극동빌딩 주차장 이용하면 편리함@@뭔가 건강한 밥을 먹는 느낌. 반찬 쫙 깔아놓고 먹는 재미도 있고. 가성비 또한 좋음 괜히 근처 직장인들의 숨은 맛집이 아니더라@@@@가성비 좋은 약선요리집 하지만 메뉴에 따라 맛에 편차가 크다- 메뉴선택을 잘해야 맛있게 먹을 수 있다  약선꽃게장정식- 정말맛있다 가면 꼭 시킨다. ++ 흠... 요즘 사람이 많이 안와서 그런건지 비린내가 좀  난다 처음에는 비린내도 전혀 없었고 짜지도 않아 최고의 간장게장 이었는데.....  최근들어 비린내가 조금 나며 조금 짜다. 그리고 서비스로 주시는...@@코스 먹었습니다 게장이 제일 맛있었구요 신사동 프로간장게장과 동급이였습니다 밥은 처음부터 달라고 했는데 맨 마지막에 주시더라구요 찬은 전부 간이 있는데 밥을 마지막 코스에 주시니 먹는 내내 짭니다 가격대비 만족스런 식사였습니다@@말해뭐해, 반찬 하나하나 정갈하고 너무 맛있습니다.@@건강식 메뉴로 속이 편안해요^^@@정갈하고 삼삼한 한 상@@공기밥이 곤드레밥인데다가 밑반찬이 8찬이나 되고 맛도 있어서 만족스러웠는데, 정작 메인메뉴가 너무 부실함.... 삼겹살은 삼겹살이라고 부르기에 민망할 정도로 작고 수분기가 없는, 대학가 술집에서 나오는 안주 느낌이었고, 김치찜은 진짜 너무너무너무 싱거워서 아무런 맛이 느껴지지 않을 정도였음 차라리 가격을 좀 더 올리고 맛을 보강하면 어땠을까, 하는 아쉬움....@@밑반찬도 삼삼하니 좋고, 기본으로 곤드레밥 나오는것도 좋고, 새우장 새우가 탱탱하고 굵은것도 좋고, 보쌈 냄새 안나는 것도 좋고 다좋아요.@@밑반찬도 너무 정갈하고 맛있고 정식 메뉴 하나하나 다 맛있었어요 저번에 개인적으로 왔다가 너무 맛있고 친절하셔서 팀원들 모시고 회식 왔는데 다들 만족하셨어요!  저희 실수로 국물 살짝 흘렸는데, 새로 가져다주신다고 하고 괜찮다 말씀드리니 서비스로 단품 메뉴 주셔서 완전 놀라고 감동했어요ㅜㅜ 완전 강추 드립니다~@@맛있어요! 간이 전체적으로 짜지 않고 딱 맞아서 좋아요 비주얼도 좋고요! 한식 좋아하시는 부모님 모시고 갔는데 만족하셨습니다. 특히나 참게탕 국물이 진짜 맛있었고, 꽃게장 게딱지에 메밀면 찍어먹어보라고 하셔서 먹었는데 진짜 맛있었어요! 정식 여러개 시켰는데 다 성공적..! 밑반찬도 괜찮았고, 후식으로 나온 호박식혜도 맛있었어요. 부모님이 일단 정말 좋아하셨...@@수원사는 제가  서울시내 갈때마다  일부러 찾아가는  애정하는 식당입니다.  오늘 친구랑 같이  2시 다되어서 도착하니(그 시간대는 처음)  직원 쉬는 시간인지. 한두분은 청소,  나머지분들은  테이블 앉아 휴식시간이신듯 했어여.  다 좋은데..핸폰으로  음악 뽕짝스탈 트시니깐  원래 매장에 흐르는 음악과 겹쳐서  약간 정신이 없었고-.-   3시가 되자 ...@@아너무나  기가막히고 환상적인 전통의맛 깊고  진한 임금님 수랏상 같은맛 완전 죽이네요@@+도미뱃살, 황태떡갈비, 육전, 불고기, 모듬보쌈, 유자막걸리, 유자청주, 복분자주 뭐 하나 빠지지 않고 맛있음@@토요일 저녁 마감 직전에 방문해서 그런지 밥이 다 식어서 아쉬웠음 -> 그래서 별점 하나 뺌 반찬도 정갈하고 간도 적당했고 특히 새우장이 짜지않고 감칠맛이 좋아서 만족 다만 위에 말한거처럼 연잎밥은 주문 즉시 쪄내는 방식이 아닌건지, 마감 때라 그런건지 약간 데워나온 듯한 비주얼에 찰밥이 바로 식어서 딱딱했음 담엔 제대로된 시간에 방문해보고싶음@@카카오맵 평가가 좋아서 방문. 주말 낮에 방문했을 때 외국인이 많아서 낚인 건가..생각했지만 외국인이 맛있는 식당을 잘 찾아온 것 같음. 화학조미료를 일체 사용하지 않는다는 점이 매우 마음에 들었음.  밑반찬도 정갈하고 주메뉴로 주문한 도미뱃살구이, 황태떡갈비도 양념이 조금 쎘지만 입맛 돋구고 좋았음.  기본으로 나오는 미역국은 요새 많이 생기는 미역국 전...@@"
초반식당,삼겹살,02-2261-2005,중구,수표로6길 8-1 1층 (우)04554,#친목모임#회식장소#제로페이,2.6,17,그럭저럭...@@첫 방문에 단순 겪은 일들만 말씀드립니다.  1. 환기가 안돼서 먹고 나오면 옷에 고기냄새 진동을 합니다.  2. 하도 정신없길래 추가 주문해도 늦게 나올 것 같아 첫 주문 후 음식 나오기 전에 추가주문했습니다. 중간에 혹시 몰라 아주머니께 주문 들어갔는지 확인해달라했더니 누락으로 주문 안들어갔습니다. 재주문 후 고기 거의 다 먹어가는데도 안나와서 취소해달...@@아주머니 화가 나셨나 봐요 ㅠㅠ 화이팅! 타이어 씹는 줄 알았어요 @@@@아무리 초벌한다고 냉동 고기 숨길수 없어요. 고기 정말 맛이 없어요. 아저씨 써비스는 많이 친철하신데 고기 퀄리티가 너무 아쉬워요. @@부대찌개 보통 @@같은 돈을 내고 먹어도 다른 서비스.... 고기의맛은 평타지만 막창은 글쎄요...약간 비리며  타이어 씹는 느낌이였습니다.  서비스 생각하고 오시지 마세요  @@코로나때문에 예약하기 위해 전화했는데 직원님이 할필요앖다고 하셨다가 저희는 도착했을때 안 된다고 하셨어요. 다른 고깃집에 갔어요. 너무 실망스럽습니다.@@4만8천원에 이만큼 먹을 수 있는 아주 획기적인 식당  그렇다고 막 그렇게 맛있지도 않음 @@댓글 첨 달아봐요~ㅜㅜ가격대비 양은 너무 적은 것같고 퀄리티는 소소...가격을 생각하면 저에게는 많이 아쉬운 곳이네요. 물론 고기자체는 맛났던것같아요. 밑에 분은 세트 두 개를 시키신걸까요???저거에 반정도였듯... 이 시국에 안달고싶었으나  다른 분들 사진과 달리 부추도 없었구요. 둘이서 48000원자리 먹었는데 세트 양이 정말 작게 느껴졌습니다(개인적인...@@매장도 깔끔하고 고기도 두툼하니 맛있고 직원분께서 다 구워주셔서 좋다 그리고 곱창도 먹을수있어서 개이득@@육질 진짜 괜찮음. 쫀득쫀득@@왈왈왈왈왈왈!!!크르릉...킁...왈왈왈왈왈!!!!!!컹컹왈왈왈왈왈왈!!!!!!!!왈왈왈!!!!!!!왈왈왈왈왈왈왈!!!!!!!!!!!!!!!!!!!!앞으로 삼겹살은 여기@@서비스부터 맛까지 최강@@@@이정도 맛이면 다음에 또오고싶음!! 명품 고기집은 아니지만 이정도 퀄리티면 가격도 적당한듯!! 사장님과 직원들도 친절하고~~ 딱히 불편한건 없음~~ 괜찮은 고깃집을 찾은거 같네요^^ 홀이 넓지는 않으나 너무 붙어있지도 않아서 같이간 여자분들이 좋아함. 회식장소로 강추~^^@@맛을 떠나서 비싸고 양이 적음 삼겹살 2인세트에 29000원 이면 1인에 14500원 인데 다른곳 보다 비쌈. 차돌 된장이 있어서 그런가 보다 했지만 다른곳에서 주는 서비스 된장이랑 차이 없음 주변 다른 고기집은 보통 삽겹살 12000원에 200그람 임 양은 정량이 다 나왔는지 모르겠지만 둘이 먹어 많이 모자름@@
