식당이름,카테고리,연락처,구,상세주소,해시태그,별점,별점수,리뷰내용
명동교자 본점,분식,02-776-5348,중구,명동10길 29 (우)04537,,3.8,655,"@@명동 오면 한번씩 들리는 가게, 회전율과 음식 나오는 속도가 빠르고 맛있어요. 다만 테이블 간 간격이 너무 좁고 시끌벅적한 분위기는 아쉬웠네요 물론 어쩔수 없는 부분이긴 하지만요@@칼국수 맛 하나는 보장@@@@@@마늘러버로서 정말 좋아합니다ㅎㅎㅎ @@어제, 35년 만에 가보았습니다. 옛날엔 닭고기 국물이었는데, 이젠 볶은 소고기를 사용하여, 옛맛이 안 나는게 참 아쉽더군요. 결과적으로 국물도 더 짜졌구요. 면발과 양파 부추 고명, 마늘향이 가득한 김치는 옛맛 그대로였습니다.@@10년째 주기적으로 가고있는데 요새 맛이 살짝 중국스러워진 것 같은건 저뿐인가요...?  아무튼 존맛은 존맛이에요..만두 사랑해요@@쫀맛 칼국수, 양도 많고 맛있어용@@진짜 최고! 언제가도 빠르고 맛있어요.. 제 인생 칼국수@@여기 맛은 그 어디도 따라갈 수 없지요.. 명동 교자 최고@@맛있어요 근데 2층 화장실 앞은 좀 냄시남@@@@클래식@@맛을 떠나서 시장판인줄@@헙@@@@@@♩~~짜 물이제일 맛있어 엄청 맛없고 안매운 짬뽕맛임.  댓글알바쓰지마라 진짜 두젓가락ㅑ먹고 버렷다 김치는 무슨 다진마늘 한스푼 먹는줄 진짜 역대급 맛없었다  근데 만두는 먹을만함   국수 금방금방 나오니까 국수1개만 더 시켜보고 입에맞으면 국수 한개 더시키삼.... 진짜제발 ㅜ @@아주 아주 유명한 가게. 마늘맛이 강한 김치가 맛있어요! 개인적인 취향으로 칼국수보다는 만두가 맛있어요. @@칼국수 칼칼하고 시원한 후추 맛과 김치 맛 최고  칼국수+김치, 비빔국수+교자 조합 최고@@맛있음 근데 음식들 전체적으로 조금 짠 편@@주문하면 엄청!! 금방 음식이 나온다 약간 짜긴 하지만 맛있고 배부르다 바쁜 가게 특유의 약간의 불친절함??은 있긴 하다@@칼국수 많이들 드시는데 그렇게 맛있지는 않습니다 그래도 이름값 하는지 만두는 맛있는 편이에요 전체적으로 가성비는 별로지만 한번 쯤은 경험으로 먹어보셔도 괜찮을듯@@진짜 맛있음~~@@언제가도 맛난 식당@@ 유명무실. 국물은 과도한 조미료 맛이고, 면은 다 불어서 탱글함이라고는 느낄 수 없음. 만두 크기는.. 고향 만두 아시죠? 그거 하나만 합니다. 피는 뭐 저리 불균형하게 크게 만든 건지. 가격도 칼국수 한 개 1만원.    개인적으로 조미료 개좋아하고 외식은 집밥과 다른 맛이 나야 한다고 생각하는 사람인데, 그럼에도 이 집 국물은 도저히 조미료 탕이라는 ...@@언제먹어도 맛있는 칼국수@@@@@@먹을때는 그냥저냥 맛있네 굿 굿 ~~ 했는데 역시 .. 헤리티지 + 빠른 회전율 + 북적북적한 분위기 + 고즈넉한 2층 이름까지 명동교자인것으로 ..  더 구수하고 맛있ㄱㅔ 느껴짐 마늘김치는 마늘향이 정말 강해요 그치만 자꾸 생각나고 또 먹고싶어지는 ..@@무슨 말이 필요할까요.. 명동 가서 여기 밖에 안가니까 아직도 명동에서 뭐가 맛있는지 모르겠어요ㅋㅋ 가격이 더 올라도 계속 가야 해서 곤란.. 광역버스 타고 혼자라도 가는 곳@@유명하대서 방문해봤는데 명동거리 상권 다 죽은거에 비해 여기는 사람 바글바글 하더라구요 자리는 좁지만 1~3층 다 운영하는것 같고 저는 2층에서 식사했어요 만두 비빔면 칼국수 모두 맛있게 먹었네요 :) 아, 갠적으로 김치는 제입맛에 안맞았어요.@@맛은 좋으나 직원이 불친절해요@@줄이 어마어마 했지만 순환이 빨라서 금방 들어가요 국물 뜨끈뜨끈 지대루 진하고, 교자는 육즙팡팡 웰케 맛있나요~~ 겉절이도 넘 맛있어용ㅋ 인원수대로 주문하면 밥, 면 리필이 가능한 점도 아주 굿이에요 굿굿굿~  넘 바쁜 매장이랑 어수선하고 정신없고 눈치가 좀 보이긴해요ㅠㅠ@@"
금돼지식당,"육류,고기",0507-1307-8750,중구,다산로 149 (우)04607,,3.8,197,"+좋은 고기 +직원이 다구워줌 잘구움 +생각보다 가격착함  -이 웨이팅을 굳이? 외국인 많이 찾아서 대기 더 길어짐@@제 인생 중 제일 맛있게 먹은 고기집입니다!! 유퀴즈에 잠깐 소개된 거 보고 갔는데  정말 맛있게 먹고 갑니다. 다만, 웨이팅은 2시간은 기본으로 생각하고 가야하나 봐요..@@맛있어요@@역시 소문난 맛집 맞네요.ㅎㅎ@@맛집으로 굿!!@@@@여섯명에서 모든 고기를 다 먹어봤는데... 진짜 다 맛있어요... 저희 테이블 고기 구워주시느라 정말 고생하셨고ㅠㅜ 서비스도 좋고 맛도 좋고 웨이팅이 긴 이유가 있는 찐맛집입니다•̑‧̮•̑@@여기 돼지고기가 그 동안 먹은 고급 다이닝 스테이크보다 더 맛있네요... 등목살, 본삼겹...정말 맛 있습니다. 요즘 어린친구들이 올리는 인스타그램 핫플레이스에 갔다가 늘 실망해서... 여기도 그런건 아닐까 했는데 여긴 찐입니다. 또 가야겠습니다.@@본삼겹 등목살 눈꽃목살 전부 나름 먹는 맛이 있어요! 삼겹이랑 눈꽃 맛있게 먹었어요 하지만 목살 이정도 하는 집은 많고 더 맛있는 집도 있죠…@@맛있습니다~ 육즙이 팡팡 살아있네요 삼겹살도 맛있는데 등목살이 맛이 젤루 좋았어요.. @@@@맛있음 가격있음@@맛있었어요~~@@@@남자친구가 하도 극찬해서 코로나 전년도에 한번 가본 곳인데 고기가 맛있으면 얼마나 맛있겠어~하고 웨이팅 싫어해서 30분넘어가면 그냥 근처 곱창집이나 가야지 싶었는데 다행히 40분만에 입장! 툴툴거리며 들어갔는데 눈꽃목살이였나 첫 한입에 충격.. 추가주문으로 다시 시켜먹었을땐 그정돈 아니였는데 암튼 첫 한입이 너무 임팩트가 컸습니다..ㄷㄷ 테이블 세팅도 정갈...@@평일 점심이라 웨이팅 없음. 목살류가 맛있었고 김치찌개는 평타 :)@@유퀴즈 돼지고기 편에서 추천하는 영상을 보고 멀리서 떨리는 마음으로 갔습니다.  미리 세팅 되있고 고기 구워주셔서 뭔가 다르네 하고 기대하며 먹었습니다. 일단 맛있어요  근데 먹던 고기 맛이라서 다르건 못 느꼈어요. @@@@개인적으로 삼겹살은 같이나온 갈빗살빼고는 별로엿고 등목살 추천합니다. 육즙가득 촉촉해서 맛있어요ㅎㅎ 김치찌개는 평타정도 다만 기름지다보니 찌개랑 장아찌랑 먹어도 좀느끼해요..웨이팅 한두시간할 정도는 아니엿어요@@고기맛은 ㅍㅌ 웨이팅과 가격은 ㅎㅌ 왜 미쉐린인지 의문가는 맛. 기본 김치조차도 없어 계속 느끼하다@@서울 오면 한번쯤 꼭 가볼만한 인생 고깃집, 2022 미쉐린 가이드 서울@@평점 깎을만한 요소는 없었지만 굳이 기다려서 먹을만한 맛집은 아닌듯 한번 쯤 와볼만했지만 두번은... ㅇㅎㅎ직원분 고기 잘 구워주심 !@@@@ㅇㄷ@@꺼억@@고기 구워줘서 좋음  맛도 좋음  다만 가격이 사악함  성인2명 기준 무조건 3인분 이상 시키게 되어있고 특히 삼겹살이 1인분만 시키는게 안되는걸로 기억함  술까지 몇병까면 2인이서 2시간도 안되서 5만원 후루룩 @@화요일낮1시 웨이팅없이 눈꽃목살 먹었는데 고기 좋아요 구워주고 설명이랑 서비스 만점 주차만 아쉬운데 뭐 서울은  ㅎㅎ 웨이팅만 없음 천국 이네요 ㅋㅋ 20분정도는 줄설만할거같은데 그이상은 흐음 ㅎ @@@@그냥 고기집. 줄서서 먹을 정돈 아님. 근처에 괜찮은 고기집 많음@@안 기다리면 4점. 요즘 좋은 고깃집이 많아서 1시간씩 죽칠 이유는 없다.@@엄청 유명해서 가봤어요. 근데 이 날 따라 제 입맛이 없던건지 평일 치고도 엄청난 웨이팅을 기다리고까지 먹을 정돈 아녀유@@솔직히 여기 근처사는 주민이지만,,, 기다려가면서 먹을필요는 전혀없는 것 같음@@평일 점심시간 지나서 간거라 기다림없이 바로 먹어서 쏘쏘 웨이팅있으면 안갈듯 기다리면서까지 먹을정도는 아님@@맛은있는데 웨이팅 1시간하면서 먹을빠엔 그냥 삼겹살집가는게....비슷한데맛집이라고 해서 조금더 맛있는느낌...?그냥삼겹살집가세요...^^@@특별 한 맛을 기대했는데 보편적인 고깃집.@@"
우래옥 본점,냉면,02-2265-0151,중구,창경궁로 62-29 (우)04546,,3.9,482,"에레이...@@알맞게 깔끔한 육수 적당한 면발과 고명 새콤한 겉절이 반찬  이 세가지의 삼위일체로 평양냉면을 대표한다고 믿게되었다.  을지로에 간다면 꼭 다시 가고 싶은 곳.@@고기 먹으러 갔다가 이집에 왔으면 냉면은 꼭 먹어봐야 한다고들 해서 맛보게된 직관적으로 육향이 강하게 배인 감칠맛나는 기분좋은 짠맛의 평양냉면 since 1946@@지나치게 오른 가격.@@조금 비싸긴하나 냉면 넘 맛있습니다@@맛있게 먹었습니다@@불고기는 쏘쏘 육개장은 별로  그냥 앞으로도 주구장창 평양냉면만 먹어야겠다 @@@@아아 이것이 '슴슴하다'는 뜻이로구나....♨️ ""고기 빤 물""이라는 말이 왜 나왔는지도 짐작이 가는 맛. 소고기의 향이 국물 전체를 감돈다. 기본 제공되는 면도 양이 실하다. 사리 1개 추가는 너무 많고, 양껏 먹자면 반 개 추가 정도는 권해 드린다. 겉절이에 기름이 조금만 덜 버무려졌다면 좀더 상큼했을 텐데 고건 살짜쿵 아쉽기도.@@@@지금껏 먹어 본 평양냉면 중 제일 맛집, 그냥 단단한 기본의 맛. 가격은 비싸지만 이왕이면 평냉은 여기서 먹고 싶다. 함께 나오는 김치도 은근 맛깔나고 중독성있어서 생각난다. @@토핑으로 올라오는 나주 배가 사람을 현혹시켜.@@@@처음 후기글 남기네요. 1~2년동안 종종 미쉐린 갔었는데 오늘부로 미쉐린은 절대 믿지 않기로 햇고, 안가기로 햇습니다. 한국 미쉐린 선정에 뭔가 문제가 잇는것같은데 좀 확인봐야겟습니다. 특히 굴무침은 맛도 밍밍햇지만, 양도 너무 적어 모두 역대 최악이었습니다. 미쉐린이고 고전적인 한옥 분위만큼 조금더 노력 부탁합니다@@@@@@잘 먹었습니다 @@오픈전에 갔는데 이미 대기가 50번 얼마나 맛집인가 싶어 기다렸다 먹었는데 정말 맛있다. 함흥파인데 이정도면 이제 평양파해도 되겠다.@@처음 먹어봤는데, 그럭저럭 괜찮았어요! 근데 면이 너무 질겨요 ㅠ@@수저나 탁자(컵이 잘 안 떨어질 정도)나 매번 더럽다고 생각했었다가 오늘은 심한 배탈까지@@@@작년 9월쯤 사업관련해서 지인과 식사할 기회가 있었는데, 그분이 이북출신이고 평양냉면 좋아할거라 생각해서 냉면3그릇과 불고기시켰는데, 냉면은 그럭저럭 먹을만 했고 불고기에는 머리털도 아닌 꼽슬꼽슬한 겨드랑이털인지, 꼬X털인지 모를 고기에 콕 박혀서 나왔는데, 친구끼리 방문했으면 다 환불하고 갔을겁니다. 접대하는거라 손님모시고 화도 못내고 직원이 냉면값 할인...@@평양냉면의 컨슈머?버전. 찐한 육향을 풍기는 육수와 메밀향 가득한 면이 매력적인 곳. 대표적인 평양냉면 집이지만 개인적인 취향으로는 육수간이 너무 강하게 느껴졌다. 그러나 평양냉면을 처음 접하게 되는 지인에게 추천하고 데려가는 집. //  카카오맵 맛집 추천 지도 - https://www.photoguraphy.com/?p=3997@@제가 평냉을 안 좋아하는 편이었는데 맛집이라길래 흠~ 도전! 이러구 간건데 제가 지금까지 먹었던 평냉은 평냉이 아니었나뷰ㅡ요 국물에서 고기 맛이 느껴지고요 물론 어쩔 수 옶이 밍밍하지만(제가 겨자 이런 거 안 넣어서 그럴짇도) 그래도 진짜 담백하구 맛나요 가끔 생각나는 맛… 을지로 갔다면 추천합니다@@@@@@냉면 육수의 육향 진함. 곁들임 김치의 맛도 훌륭함. 다만 갈비탕은 특별함이 없음. @@북한으로 잠깐 다녀온 기분임@@소의 영혼이 느껴짐@@@@우리 가족들 입엔 안맞았어요 고깃국물이 너무 진진해서 평냉인데 담백한 맛이 안들었어요.. 그나마 저는 양념이 입에 맞았어요 보통 전 예민한 편이 아닌데 고기잡내도 났어요. 제 취향은 을지면옥!(여긴 오이채많이주고 깔끔하고 담백한편)@@맛있어요@@말이 필요 없잔슴~! @@@@젤맛나요@@"
을지다락,양식,070-8844-4484,중구,수표로10길 19 4층 (우)04555,#제로페이,3.9,137,"그냥 별스타용 맛집@@오일파스타 맛있네요 ㅎㅎ 은은하게 해물맛이 나서 좋았어요! 찹스테이크는 익숙한 맛있는 맛인데 고기가 많지는 않아요~    재방문의사 있습니다!@@유명맛집 메뉴 다 베껴놨네.. 철학없는 장사.. 광고맛집은 패쓰@@을지로에서 가장 맛잇는 파스타하는집@@중고딩들은 잘 갈듯 단짠 자극적인 맛 우리가 아는 그맛@@웬만하면 뭐든 먹고 특히 파스타 너무 좋아해서 남기는 적이 없지만 여긴 진짜 ㅋㅋㅋㅋ최악중 최악 안좋은 리뷰 진짜 남기고싶지않았는데 파스타 소금덩어리;; 개짜서 진짜 둘이서 반의반도 못먹고 다남기고 오므라이스도 하...... 진짜 파스타는 입도 못댈정도로 먹기 힘들어요 돌돌말아서 입에 넣자마자 짠맛이 풍겨서 진짜 죽을거같았고 진짜 소금 잘못쏟았는데 그냥 음...@@한물 간곳 다신안감@@오므라이스는 생각보다 별로 차돌박이파스타 굿  소주잔 바꿔주세요@@굿굿 힙지로 대표맛집@@@@맛집ㅇㅈ 기다릴만함@@나한테는 인생맛집이었는데 리뷰보니 호불호가 갈리네..신기@@@@즐거운 저녁시간을 보낼 수 있었던 여유있었던 장소. 다 맛있고 양도 적당했음. 다만 하이볼(을 포함한 칵테일들)에 예쁜 종이빨대 주실거면 플라스틱 빨대는 안주시는 게 더 좋을 것 같아요ㅠㅠ  @@웨이팅해서 먹을만한 곳이 아닙니다. 끔찍하게 좁은 자리와 시큼한 피클... 메뉴3개 시켰는데 3개 다 기대이하... 그냥 치킨 시켜먹는게 나아요 백종원 롤링파스타 정도의 맛... @@여기 별점 왜이렇게 높은지 모르겠음.. 평균2.8~3.2정도가 적당한거같음  ""가츠산도"" 정말 별로임.. 돈까스 누린내났음 (내가 좀 예민한편이긴 함) 고기 좀 질겨서 어금니로 씹어먹음 빵이 너무 축축? 물렁물렁? 해서  같이 못먹고 빵따로 돈까스 따로먹게됨 (맛도 그냥 어우러지지 않음)  ""이름기억안나는 파스타"" 아.... 그냥 크림파스타에 라면스프 뿌려...@@웨이팅 엄청 길다고 그래서 예약하고 갔습니다. 일단 간판이 보이지 않아서 찾는데 시간이 좀 걸렸습니다. 테이블이 전체적으로 너무 작아서 그릇 2개 겨우 올릴 수 있었고, 제 개인적인 느낌으론 뭔가 딱 예상되는 맛과 비주얼이였던 것 같습니다. '와... 여기 미쳤다...' 이런 생각 안 듭니다. 그냥 딱 한 번 가볼만한 그런 곳 같아요. 그리고 최근 리뷰 글...@@@@어떤분 리뷰 추천으로 을지다락 갓다가 이차로 행2pm8pm와인바 갔는데 탁월한 힙지로 코스였음 강력추천 ㄱ ㄱ@@웨이팅이 겁나 길었는데 맛은 평타@@음식은 맛있는데 계단이 진짜...너무 힘들어요@@맛있어요! 가게깔끔 친절@@가파르고 좁은 계단에서 웨이팅해야함ㅜ 사람들 계속 지나다니고 배달기사분도 수시로 왔다갔다해서 문쾅쾅쾅 닫히는데 웨이팅역사 최초로 머리가 아팠음 직원분들은 친절하고 음식은 나쁘지도 엄청좋지도 않은 정도! 그래도 가게가 예쁘고 책상도 커다래서 웨이팅빼곤 만족했어요@@플레이팅이 좋은 양식 레스토랑 @@을지다락 -> 행2pm8pm 와인바 힙지로 코스로 두곳 추천드려요! 도보로 바로 근처이고, 와인도 저렴하고 공연도 매일합니다 최고!@@비주얼 좋고 양 많은 편이라 여럿이 가서 쉐어링하기 좋음 엄청난 맛은 아니고 평범한 인스타 식당 정도 뇨끼는 비추@@위치불편. 오므라이스 계란 사진샷때문인기많을듯. 맛은 약간매운 그냥오므라이스@@그냥저냥 .. 기다릴만한 가치가 있는 집은 아니라는 생각이고 두 번은 안 갈 것 같아요@@아래 어떤분 추천으로 을지다락 갓다가 근처 행2pm8pm와인바 다녀왔는데 데이트코스로 너무 좋았어요!! 와인바에서는 공연도하고 와인 맥주도 저렴하고 루프탑도 넘넘 이뻤음!!@@맛있어요! 기본적인 응대가 잘되는편이고 모든 메뉴가 전체적으로 평균이상입니다~@@굳이 기다려먹을 정도는 아니에욥@@@@Highly recommend this place. Service was awesome, the food was phenomenal, and the ambience was perfect. Would definitely come back to try more things on their menu. @@사람 붐비는 맛집인데 직원분들도 다들 친절하게 응대해주시는 가게는 처음이라 너무 좋았어요@@분위기 좋다 음식은 맛있는데 전체적으로 살짝 매콤한?간이 되어있음@@"
디라이프스타일 키친 광화문점,양식,02-6273-0100,중구,세종대로 136 파이낸스센터 지하1층 101A호 (우)04520,#광화문맛집#광화문역맛집#데이트맛집#종각맛집#청계천맛집#건강식#소개팅#지중해요리#친목모임#회식장소#제로페이,3.7,67,"예약이란 단어의 뜻을 모르는듯. 룸 예약했는데 시간 다되도 그 전 손님들 나가야 된다고. 그럼 그 전 시간 이용객에게 예약시간이 있으니 그때까지만 이용 가능하다고 안내해야할거 아닌가? 겉멋만 잔뜩 들었음@@@@분위기 최고! 분위기 때문에 한 번쯤 가볼 만한..@@토마토파스타는 그냥 평범.. 빠에야는 맛있음!@@주말에 예약 안하고 갔더니 1시간 웨이팅;;;; 인테리어 완전 만족!! 명란파스타는 처음 먹어보는 맛있는 맛!! 파스튜는 파스타랑 스튜 합쳐서 바꿔먹는 거 신기하고 유용함. 별거 없는 레몬에이드인데 타 음식점과는 다르게 더 맛있긴 해요. 명란 파스타 맛이 자꾸 아른거려서 조만간 재방문 예정. 같이간 친구도 명란파스타 또 먹고 싶대요.@@분위기는 최고에요. 기념일에 갔는데 사진찍기 좋았어요~ 맛은 기대를 전혀 안했는데 생각보다 맛있게 잘 먹었습니다! 다만 맛집까지는 아니구요ㅎ 특별한 날에 한번쯤 올만 한 곳은 맞아요. 재방문의사는 딱히 없만 주변 사람들한테 추천은 하고 있어요!@@천일 기념으로 다녀왔는데 까다로운 남자친구가 5점!!을 외치네욬ㅋㅋㅋㅋㅋㅋ 음식도맛있고 분위기도 좋고 직원분들도 친절하셨습니다@@딸과 스테이크 아주 맛있게 먹고왔어요 크리스마스 이브에 식구들 예약했습니다@@예약할때 생일날이라고 하니 디저트 서비스 받았습니다! 음식 전체적으로 맛잇구 양 많았어요 직원분들도 친절하시고 좋았습니다@@예약해도 따로 좋은 좌석을 주진 않네요,,, 그냥 빈 좌석 줍니다ㅠ 대신 기다리지 않아도 되긴해요,,, 스테이크, 파스타, 빠에야 시켰는데 전부 다 맛있었어요! 다음에 또 방문할 의향 있습니다~~!@@@@여기 왜케 전화가 안돼요///////////////////????????????????/ 잠실점이나 광화문점이나 전화받는 알바생 고용하시던가 사장마인드가 개판오분전 그러면서 코로나 손실보상해달라고 하고  으휴 ㅠㅠ 난 절대반댈세!!!!!!!!!!!@@예약해봤자 자리 따로 빼두거나 하는거 없고 자리가 비는대로 들어가게하니 예약 할 필요도 없을꺼같아요. 예약하시려는분들 참고하세요!  그리고 남직원 몇몇 너무 불친절합니다. 뭐 달라고하면 아무말도 없이 그냥 식탁에 툭 두고갑니다. 그냥 두는거 아니고 툭툭툭. 굳이 그렇게 툭툭거려야 하는지....다른후기에도 불친절얘기 있는데 개선은 안되나봐요. 같이간 사람이랑...@@@@예쁜 장소와 맛있는 음식 또 올거에요!!@@예약 하기 너무너무 힘듦.  전화해도 통화하기 너무 힘드네요. 통화 중이거나, 통화 중이 아닐 때도 전화를 안 받거나. 나중에라도 연락을 주시든지 아니면 네이버 예약이 가능하게 시스템을 만드시든지 해야 하지 않을까요? 참고로 점심 시간 피해서 했습니다. 뭔가 예약시스템 개선이 필요해 보이네요.@@고무밴드 맛이 아직도…@@스테이크랑 파스튜 너무 맛있고 서버분들도 친절하세요~~! 인기많은 이유가 있네요 ㅎㅎ@@빠에야 기대하고 시켰는데  맛없음. 너무 맛없음   빠에야가 아니고 중국 볶음밥@@인테리어가 정말 아름다운 식당입니다. 주변에 회사가 많이 있어 점심시간에는 사람이 많습니다. 음식의 가격은 높은 편, 서비스와 음식은 정말 좋았어요. 식당 입구에 계단이 있어요. 휠체어는 들어가기 매우 힘들어요.@@예쁘긴한데 맛은 평범@@특별한 날에 오면 좋을 거 같은데요? 저는 생일에 방문해서 4명이서 6개의 음식을 시켜서 정말 뿌듯하게 먹고 왔네요. 예약은 필수라고 하니 다음에도 특별한 날 방문 예정입니다. 저희 테이블 담당 서버님도 정말 착하셨어요! 손이 다치셔서 깁스를 하신 거 같았는데, 그럼에도 불구하고 정말 친절하게 서빙 해주셔서 정말 만족하고 갑니당!@@남직원들 정말 불친절하네요.. 맛도 제값을 못합니다@@맛 좋음 근데 약간 짠편 !!가격은 좀 있는편@@음식 존맛 직원들도 엄청 친절하심 분위기도 좋고 또 갈 것 2시간 무료 주차도 됨@@3번 방문했는데, 모임 장소로 위치 가격 맛 분위기 다 만족합니다.  모임하실분들은 룸으로 예약 추천합니다  정말 조용하게 식사 하실 수 있습니다.@@음식도 다 맛있고 직원분들이 친절하셔요.@@@@건강에 많이 관심갖고 만든 음식인것 같아서 기대했는데, 생각보다 음식이 너무 짜요. 심지어 샐러드의 드레싱도 짜고, 리코타치즈 자체도 너무 짜고..파스타도 짜고ㅜㅜ  서비스도 좋고, 음식의 신선도나 양 모두 만족스러웠는데 정말 건강지향 레스토랑이면 음식 간부터 좀 낮춰야할것 같네요.@@회사 건물이고 맛도 괜찮고 인테리어도 이뻐서 자주 갔었는데 주방 앞자리 앉아보고 다시는 안갈듯. 주방 직원들 전부 턱스크에 말하면서 요리하네요. 답답하면 조리용 마스크도 있을텐데...코로나도 코로나지만 보이는 주방에서도 저러는데 위생이 걱정됩니다. 먹는 내내 주방만 봤음...(중간에 말했더니 5분정도 쓰고 있다가 또 벗더라고요 ㅎ)@@직원분들 친절하시고, 인테리어 분위기 좋아요. 인기메뉴 이것저것 먹어봤는데, 스테이크 리코타치즈 샐러드가 제일 맛있었어요. 지중해빠에야도 괜찮구요. 양이 조금 적은편이에요. @@저탄고지 하는 사람들은 매우 좋아할 듯..@@@@사진보니까 또먹고싶음@@@@"
