식당이름,카테고리,연락처,구,상세주소,해시태그,별점,별점수,리뷰내용
가락골마산아구찜,아구,02-409-6665,송파구,송이로19길 3 (우)05714,#제로페이,3.9,37,"셋이서 아구찜 소짜에 공기밥 1개 볶음밥 2개 시켜서 맛있게 먹었습니다~ 맵지 않아서 좋았어요! 양념이 진짜 맛있어요~! 볶음밥은 꼭!! 날치알이 들어가서 맛있었어요 @@양 매우 많음!!! 너무 맵거나 자극적이지도 않고 맛있어용 @@짜지 않아서 맛있게 먹었음. 술 드시는 어르신들이 많아서 좀 시끄러움. 손님도 많아서 정신없지만 맛있으니 괜찮음@@@@이런 집도 호불호가 있군요 저는 한번밖엔 안가봤지만, 해물찜이 너무 푸짐하게 나와서 깜짝 놀랐습니다. 어떤분은 밍밍하다는 분이 계시지만, 매운걸 잘 못먹는 저한테는 완벽한 수준의 맵기였어요. 성인4명이서 대짜 주문하면 그냥 끝입니다.@@@@낚지너무씽씽해요 맴기정도좋고 매운거좋아하시는분은 맴게해달라고주문. 그리고 돌솥밥좋음 2인22000@@평소에 먹던 아구찜 맛보단 밍밍한 맛 더 매콤했으면 좋을듯요@@해물찜 사람이 많은 게 무조건 대기해야 하는 게 아숩다@@조미료맛 비싼 아구찜@@저도 갔다 왔지만  북적대고 줄 서서 기다린거 비해서는   불친절하고 아구가 덜익고해서 다시 해달라고하니  바람부는 눈초리 무서웠어요@@예전 같지 않아.... 양념에 전분이 증가했어요.@@절대 가지 마세요. 옛날이랑 맛도 많이 다를 뿐더러 직원들 정신 상태가 이상합니다. 돌솥밥이 다 타서 나와서 밥값 빼달라고 한 걸 미친듯이 우기면서 안된다네요. 정신들 차리세요. @@이 주변에서 아구찜을 먹고싶다면 고민없이 여기를 갑니다@@말린 아구가 아니라는 점이 호불호를 갈리게 할 지언정. (벨이 없다는 점이 유일한 아쉬운 점.)@@인생 아구찜이에요.. 집가면 생각나요ㅠ.. 볶음밥도 엄청 맛있는데 보니까 볶음밥만 따로 해주시는 이모님 계시더라구요... 하 맛있습니다ㅠㅠ@@명성에 비해서는 잘 모르겠어요;;@@진짜 맛나고 양도 많아요. 아구찜 해물찜 다 맛나요@@경찰병원 갈일있어갔다가 우연히들른곳 아귀찜 참맛있고 밑반찬도 참맛있었어요. 자극적이지않고 좋았어요@@저는 정말 불친절했고 맛없었어요  여기가 왜 맛집일까요? 이해가 안되는 맛집이네요 이 근처에 해물찜 잘하는 데가 아예 없나?밍숭맹숭 이도저도 아닌맛인데.. 해물찜과 낙지찜 심지어 낚지볶음마저 양념맛이 똑같음 그냥 하나의 양념으로 통일해서 쓰나? 줄이 왜 길까 호기심에 드시지마세요..비추!@@맛있고 가성비좋고 상당히 괜찮은 해물찜맛집. 허나 사람이 너무 많아서 별점 4개드립니다@@맛있어요@@아구찜보다 해물찜이 더 나아요. 다른 사람들도 해물찜을 좀 더 많이 먹네요. 평일 점심때가도 사람이 많아요. 한적한 동네 골목길에 위치해 있는데도 사람들이 어찌 알고 이렇게 찾아오는지 궁금합니다. @@브레이크 타임만 써놓으면 어쩌라는건가요? 8:40에 갔더니 주문 시간 끝났다고 해서 헛걸음했습니다.@@맛있어요.. 해물찜 계의 지존..@@@@여기 해물찜 너무 푸짐하고 맛있어요. 아구찜보단 해물찜 더 맛있는 것 같구요. 다만 주차랑 방이라서 신발 벗고 앉는게 조금 불편해요.@@양많고 맛있고 반찬도 좋구 단지 너무 시끄럽고 복잡하다보니 먹다체할거 같은게 단점...@@아구찜 먹었어요. 전분이 너무 많고 매운맛이 없어서 별로였어요. 간도 너무 약하고~@@맛있고 푸짐해요 찜에 전분도 많이 넣지않고 맛있어요@@"
돈까스의집,"돈까스,우동",02-413-5182,송파구,삼전로 100 아카데미빌딩 1층 (우)05599,#경양식요리#제로페이,2.5,44,집 근처기도 하고 경양식 돈가스 땡길 때면 이 쪽으로 옵니다~ 경양식 특유 돈가스랑 그 묽은 스프 좋아하시면 딱입니다! 사장님도 굉장히 친절하시고요~ 유아 시트 있습니다 가족 단위로 오기 좋습니다 (가격대는 좀 있는 편인 것 같아요)@@추억의 맛집이었는데  조금 아쉽지만 옛날기억으로 갈만한집@@우리가 생각하는 그맛 조금 물려용..!@@여기 뭐 주인장 여러번 바뀌었단 소리있던데~ 잠실 오래 있었지만 그래도 가끔씩 경양식 돈까스 생각나면 아무생각 없이 가기좋음@@1.가격에 비해 양적음 2.맛은 무난 3.계란 양싸이드 삭제(의문임)@@맛이.. 없네요 ㅠ 양도 적은데 9천원.. 음.. 직원 친절한것도 아니고 걍 평범.. 스프.. 간을 하나도 안하셨나봐요 ㅠ 돈가스집인데 돈가스가 맛없어서 다른 메뉴 기대가 안됩니다. 손님 없어 한산해서 여유롭게 식사 가능한게 장점이네요~ 재방문의사 전혀 없는 한번 와봤다 다신 안가는 전형적인 식당이에요! @@손님들 표정이 어둑어둑하다 했는데 먹어보고 이유를 알았어요@@잠실맛집은 여긴듯 19년째애용중@@@@드럽게 맛 없음@@@@@@1 스프  싱거움 그 자체 2 돈까스 양 적고 특색없고 싱거움 3 빵은 맛있음 4 분위기 괜찮음@@빵은 버터인지 기름에 절어서 살짝만 만져도 손이 기름범벅이 되요. 돈까스 함박 생선까스 전부 무난을 넘어 특색없이 심심하네요..  @@리뷰 보고갈껄...블로그만 보고갔더니 낭패.. 스프에 감성젖어 가지말것.  돈까스는 튀긴 고기여서 맛없을 수없는데 남기고 옴. 튀김옷이랑 분리됨. 함박은...시판 패티느낌. 근데 가격 95백원 ㄷㄷ 맥날이나 햄버거왕 먹는게 나았을듯. ㅠㅠ 내 주말 점심이 이렇게 소비되다니..@@튀김옷이 돈까스랑 너무 분리가 잘되서 이상함...소스는 자극적이지 않고 밍밍한맛. 잠실사거리 한복판에서 이정도 가격인걸 감안하여 3점을 줍니다. 맛과는 별개로 분위기가 옛날 경양식 레스토랑같아서 좋습니다.@@알바생 여자분 손톱이 진짜 긴데 접시 맨손으로 가져다주는거 진짜 별로네요@@그냥 보통이에요 .. !  @@돈까스사 제일 맛있네요. 추억 돋는 맛이에요@@제 입맛에는 추억의 돈가스 맛 너무너무 좋아하는곳입니다. 특히 생선까스는 나중에도 바삭바삭해서 너무좋아요 @@맛없.. 그냥 편의점 돈까스 도시락이 더 맛있는듯..@@방송탔다는 사실 말고는 별 맛 없음@@주인 바뀐지 20년도 더 됐어요. 테이블 6개? 때부터 가던 사람입니다. 첫아저씨도 서비스는별로였지만 맛은 있었는데 이제는 안 갑니다   앉기도전에 뭐 시킬건지 물어봐요 ㅎㅎㅎㅎ맛도 갈 수록 별로고...예전 아주머니랑 할머니할때가 너무 그리워요@@돈가스는 세수대야냉면돈가스 돈가스맛 함박은 동그랑땡 맛 생선가스는..비릿한느낌..나만에 착각이길.. 9000~10000원.. 양이 좋은것도 맛이 좋은것도 직원이 친절한것도 아님 진짜 먹고 빈정상하는.. 배고프고 아까워서 먹긴 처음.. 배고픈데 맛데가리 없기도 처음 직원이 이렇게 불친절한데도 처음.. 오던가 말던가 이런느낌@@빵에 사과잼 주는 데를 찾기가 힘든데 여기엔 있어서 좋고 돈까스도 맛있어요@@와 어떻게. . . 이렇게 맛없을수가 있지 ㅋ ㅋ ㅋ스프도 맛없고 돈까스는 질기고 빵도 잼도 다 맛없음. 오히려 함박이나 생선가스가 낫더라. 남자 알바는 불친절. 파리날리는 가게에서 잘 놀고있는데 손님이 와서 굉장히 짜증난다는 식이었음 ㅋ ㅋ ㅋ @@맛은 나쁘지 않았는데 음식에서 머리카락이 나오기도하고... 저녁먹고 세 시간 뒤부터 배가 꼬륵꼬륵 거리더니 새벽쯤에 식중독이 와서 잠을 조금 설쳤습니다.. 하루가 지난 뒤에도 아프네요... 사람마다 장이 다 달라서 괜찮은 사람도 있지만 저는 고생중입니다 ㅠㅠ@@정식 메뉴 갈수록 양이 주는데 차라리 가격을 올리시는게 어떨지 싶어요  그리고 주차관리인이 매우 불친절  식당 손님 다 내쫒겠습니다  어디왔냐고 두번이나 꼬치꼬치 캐묻고 주차권에 도장 찍어오는 방식인데 와 굳이 어디 왔냐고 물어보는지도 모르겠음  @@어릴때 먹었던 추억의 경양식 돈까스집!!@@어릴적 추억의 맛집♥ 십수년만에 오니 많이 바뀌었지만 그래도 정감있어 좋다+_+ 맛도 옛날맛 나고 굿!@@
러반로제레스토랑 석촌호수점,양식,070-7778-9471,송파구,석촌호수로 274 씨엠빌딩 8층 (우)05623,#데이트코스#루프탑있는#소개팅#제로페이,4.2,40,"@@@@소문듣고 갔는데 역시... 뷰도 좋았지만 맛도 좋고 서비스도 좋았어요.@@뷰만 좋았어요@@창가뷰는 진짜 좋았어요 근데 말이죠.. 코스요리 시켰는데 메뉴가 다 별로에요.. 이런말하기 죄송하지만 파스타조차도 애슐리가 더 나을정도에요. 파스타 소스도 거의 없어서 10분도 안됐는데 파스타가 찐득찐득 말라비틀어졌고요 스테이크도;; 걍 굽기만해도 중간이상은 갈텐데 수비드로 해서 그런지 스킬이 부족한지 고기도 진짜 맛없었어요.. 샐러드랑 식전빵이 더 맛있을...@@러반세트 먹었는데요. 리코타치즈샐러드 파스타 다 맛있었는데 스테이크는 정말 개선이 필요해 보여요. 수비드를 했다 해도 겉굽기 정도가 너무 애매하네요.. 친절하시고 뷰도 좋고 루프탑도 좋지만.. 메인 요리가 약해서 별 세개요 ^^ @@@@@@뷰맛집 인정!! 날만 더 좋았다면 더 좋았을거같다. 하지만 스테이크는 가격대비 엄청 맛있다는 느낌을 받지못했고,  파스타는 쏘쏘했다!!  그럼에도 뷰가 너무 좋았기 때문에 4점!!@@뷰 좋아요.  파스타는 괜찮은 편, 리조또는 쏘쏘, 스테이크는 별로. 뷰 감안하면 방문할만한 가치는 있는 곳. (발렛 가능, 1시간 반 2천+초과시 초과요금)@@뷰 맛집, 와인 및 음료 스테이크 비추, 파스타 리조또 강추@@뷰는 확실히 좋습니다. 석촌호수가 잘 내려다보여요. 루프탑도 있어 날씨 좋을 때 가볼 만 합니다.  음식도 적당히 맛있지만 양 대비 가격이 비쌉니다. 뷰값이라 생각하면 될 듯 합니다.   창가 자리 예약하려면 필히 전에 예약하고 가야합니다. 회전율을 높이기 위해 테이블당 식사 시간을 2시간으로 제한하고 있습니다.  맛있는 음식이 포인트가 아니라 뷰를 위한 ...@@맛은 있는데 양은 적은 편. 뷰는 좋음. 위에 옥상도 괜찮음. 특별한 날 한 번쯤 가볼만 할듯.@@세트A 먹었는데요 왜 평이 좋은지모르겠어요...... 뷰만 좋고 맛은 그냥 집에서 해먹는맛 같아요 리조또가 이렇게 밍밍한맛이라니.......@@친절하고 맛있고 분위기도 좋아요^^@@@@5점받을가치가 있는곳. 스테이크 맛있고 친절하고 뷰좋아요 @@@@신선하지 않은연어. 맛이 이상하다고 해도 반응이 별로임. 다 못먹음.@@특별한 날이라 예약 후 방문했어요 뷰 맛집이라는 리뷰에 기대하고 갔는데 역시나 루프탑 뷰가 멋졌어요 ♡♡ 맑은 하늘에 잠실 타워 그리고 곳곳의 예쁜 장식들까지 ~~ 음식 가격은 사실 저렴하지는 않으며 가격 대비 양이 엄청 많은 것도 아니긴 해요 하지만 식전 빵부터 스테이크 & 파스타 모두 정말 맛있고 깔끔했어요 ㅎㅎㅎ 멋있을테지만 개인적으로 브런치 같은 밝...@@뷰는 끝내줍니다@@분위기, 야경 넘 좋음@@멋진 장소입니다.@@서비스와 음식 모두 기본정도@@서비스, 음식, 뷰 모두 최고였어요^^@@음식은 기본, 옥상이랑 창가 뷰가 너무 좋아요@@스테이크가 부드러움@@스테이크가 진짜입니다@@뷰도 너무 멋지고 맛있습니다 %^^@@생일을 기념해서 간 곳. 음식도 맛있었고 서비스도 정말 좋았다. @@"
소담정,"육류,고기",02-420-0099,송파구,올림픽로32길 22-22 (우)05548,#낮술하기좋은#점심식사#친목모임#회식장소#제로페이,4.0,15,"처음 먹고 반해서 주변에도 인생삼겹살집이라고 얘기하고 다니고 잠실에서 약속 생기면 꼭 소담정 갈 정도로 많이 갔었는데요. 가족들한테도 맛보게 하고 싶어서 이번에 겨우 다 시간 맞춰서 방문했는데 입구앞에 비상등 켜고 있으면 주차 안내 해준다고 하길래 기다리다 바쁘신거 같아 들어가 여쭤보니 남자분께서 되게 단호하게 ""주차자리 없어요!"" 하시더라구요. 그래서 기...@@맛은 있는데 리뷰에 비해서 아쉬웠어요.  깔끔하지 못하고 고기도 잘 못 구우심 ㅜ@@먹는양에 비해서 가격이 조금 있지만 삼겹살이랑 목살이 쫀득하고 맛있다!! + 항정볶음밥은 조금 밍밍한 맛이 있어서 아쉽@@고기 맛있고 질 좋긴 했는데요, 셋이서 6인분 팔아드렸는데 물 두 번 가져다달라고 부탁드리니 ""물만 드시네요"" 이러셔서 기분 팍 상했어요. 굳이 다시 오진 않을듯. @@이집은 항정살 꼭먹고 항정 볶음밥도 꼭먹어야함 느므 맛있어 행복해 분기마다 생각나는곳@@@@오랜만에, 방문했는데...맛이 예전보다 못합니다. 물론 고기 굽는 스킬이 직원마다 다르다지만, 고기에서 이상한 맛도 나고...@@가족들과 자주가는 집 오늘도 삼겹살과 목살 맛있게 잘 먹고 직원분들 친절하고 좋아요. @@3.5점 맛있는 고깃집@@목살 두툼하고 맛있네요. 평일 저녁에 가니 웨이팅이 있었지만 죄송하다 하시면서 친절하게 안내해주셨습니다. 또 가고 싶어요^^@@깔끔하고 맛있음  와사비 매우 안매움@@@@친절 맛 서비스 모두 충족하는 아주아주 맛있는 고깃집!@@경주에서  여기 방문했는데  고기 맛도 괜찮고  서비스도 좋습니다. 굿!   적극 추천!@@기본반찬 같은거 백김치 파무침 갈치속젓 와사비등 다 괜찮다. 근데 서버별로 굽는 스킬이 차이가 많이 나고 내가 갔을때는 두분다 너무 못구웠음. 육즙이 많이 빠짐. 항상 이런류의 식당을 가면 비교하게되는육전식당은 암때나 가도 다 잘굽던데... 결국 굽는게 한끗차이가 아닌가 싶다. @@"
남경막국수 신천점,국수,02-417-0060,송파구,백제고분로7길 52-29 101호 (우)05559,#제로페이,3.4,61,"면이 탱글탱글하고 맛있다@@이 집은 진짜배기입니다. 후후후 —————————————————- 본점 분리 이후 맛이 많이 떨어졌어요. 아쉬습니다. @@개맛있음@@@@마싰다리~~@@@@속초하고 맛 차이 너무 남. 가격도 비쌈.. @@초심잃음. 옛날만큼 메밀함유가 높지 않습니다. 툭툭 끊어지며 메밀향이 올라왔었는데 요즘은 냉면 면 처럼 차지고 쫄깃합니다. 그 뜻은 전분이 높다는거겠죠. 그리고 시국이 어느 시국인데 6명을 받습니까? @@음식은 맛있습니다 들깨막국수 맛있게 먹고 나왔어요 요새 다들 자영업하는 사람들 다 힘들고 어려운 거 아니까 이런 글 잘 안남기려하는데 일하시는 분인지 사장님인지 말투부터 손님응대가 기본이 안되어있다는 느낌이 듭니다 저희 뒤에 들어온 커플한테는 주문 받을 때 ""뭐?""라고 하시더군요 두 번 방문했었는데 두 번 모두 비슷한 응대를 받았었습니다 가끔 생각나는 맛이...@@마스크 안 쓰고 출입명부 관리도 전혀 없고 위생 개념이 없어요ㅠ @@비빔막국수 내 입맛엔 그냥 그런데 너무 비싸요. 다른건 맛있을랑가 @@들깨 넘 맛있어요@@주방 할머님이 마스크를 안쓰고 음식을 만드셔서 평점 1점 드립니다.@@속초여행 갔다가 너무 맛있게 먹은 기억이 있어서 서울지점으로 먹으러 갔는데,, 너무 실망했어요 속초에서 먹었을 땐 꾸덕하면서 고소함 가득했는데, 여기는 밍밍하고 단맛이 왜이렇게 나는건지ㅠㅠ 감자전도 밀가루 섞어서 감자맛 많이 안났어요,, 또 먹으러 갈 것 같진 않습니다ㅠㅠㅠ@@물막국수는 슴슴하고, 들막은 진짜 고소하고 너무 맛있다. 면발이 엄청 쫄깃쫄깃함 만두도 맛있음@@들깨막국수가 ㄹㅇ 찐임@@막국수전문. 주차하기가 좀 난감.   비빔막국수 ㅡ 기본면발이 좋음. 양념장 과하지 않은듯.@@들막 비막 시켜먹었는데 들막 최고!!! 비막은 슴슴하게 먹을만하지만 특별하진않은느낌, 대중적이진않다. 들막먹으러 또 올거같아영@@맛있고 친절하신데 왜 별점테러하는지 모르겠음. 대중적인 맛에서 살짝 포인트가 벗어나 있는건 맞지만 내 기준 최고 막국수 중 하나@@물막국수 정말 별로임.  들깨막국수가 맛난다하는데 글쎄요...내키지않네요@@@@들깨막국수 만 맛있음@@오랜만에 갔는데 들깨막국수 여전히 맛있네요. 물막국수를 먹어야지 하면서도 막상 가면 들막을 시키게 되네요. 곁들인 채소와 같이 먹는 수육도 좋았어요. @@화장실 청소상태가 안타까워요@@믹밍한 막국수가 너무 입맛에 안맞앗지만  자극적이지않고 깔끔한거 좋아하시는 분이면 좋아할수도 있겠다 생각함...  호불호가 많이 갈릴듯..   메밀 전병은 맛있어서 3점 드림 @@감자전 만들어놓은거 데워서 줌 들깨막국수에 들깨 거의 없음 기대하고 갔는데 대실망@@@@들깨 막국수 고소하고 맛있었음!!!@@들깨가 신선하고 맛있지만 양이 적음 ㅠ 비빔이랑 같이 시켰는데 처음에는 비빔의 야채때문에 달라보이는갑다 하고 먹다보니 정말 적었다.. 비빔은 싱거워서 아쉬웠고.. 굳이 두 번 가지는 않을 듯 하다@@최고맛집 인정 들막 jmt@@수요미식회에 나온 곳이래서 기대가 너무 컸나봐요. 맛은 삼삼하고 괜찮긴한데, 가격이 비싸고 그렇게 막 특별하진 않아요@@맛있어요@@서비스 꽝..  사람 붐빌 때 4명 왔는데 물컵 부족하다고 3명만 세팅해 주는 맘대로 서비스....@@ㅋㅋㅋㅋㅋㅋ 티비에 나와서 유명해지고 장사가 잘되면  가격도 올리고 서비스도 구려져도 되는건가요? 한번 가봐요 근데 알아주세요 예전엔 그렇지 않았습니다 @@완전 맛있어요 막국수 면이 이렇게 쫄깃하고 탱탱할수 있나 할정도로  면발이 맛있고 물막국수 국물은 슴슴하고 비빔막국수는 자극적이지 않고 고소해요 감자전에는 배추가 들어있는데 식감이 아삭하게 살아있고 간장소스도 맛있어요  @@"
위커파크,카페,,송파구,석촌호수로 298 잠실대우레이크월드 103-1호 (우)05618,#핸드드립전문점,3.8,39,"여기 날씨 풀리고 밖에 앉으면 사진이 잘나옴… 인생샷 건짐 굿@@평범한 호수옆 카페 좌석이 적어 조용한게 장점이지만, 호수뷰는 안나오는 애매한 위치선정!@@5점을 주고 싶다. 한잔의 커피를 통해서 카페를 평가하는 것이 얼마나 잘 할지 모르겠지만, 나만의 기준으로 볼때 참 좋은 곳이다. 한적하고, 눈에 잘 안 띄는 것도 특징적이고, 블로그를 통해서 찾아 오지 않으면 지나가다 들릴 수 있기에는 간판이 너무 작아 보이지 않을 것 같다.  느낌이 있는 곳, LP 음악이 흐르는 곳, 조용하고 창밖으로 석촌호수를 바라 ...@@음료 양은 적은데 가격은 비싸요 온몸에 문신한 남성분은 적어도 음료 서빙 할 때 음료의 이름은 말해주시는게 기본이라고 생각합니다. 음료 설명도 하지 않는게 업장의 특색이 될 수 있다고는 생각해보지 않았어요.@@솔직히 돈아깝지 않았어요  핸드드립이 이정도는 되야 한다도 생각함 !  장소협소가 조금 아쉬움 하지만 그게 매력이라고  생각해요 @@첫방문때 외국인분 카운터에 계셔서 나도 함께 힙해지는 기분이었음. 직원분인지는 모르겠음ㅎ 첫방문 두번째 방문 모두 자리가 만석이라 먹기 실패. 세번째 방문때 먹었는데 인기에 비해 커피 맛은 소소...내가 유명한 커피를 안시킨건가 싶음.. @@너무 이쁜 공간인데 맛은 없어요...@@플랫화이트+스모어 조합 너무 좋음 날씨 좋은 날 여유롭게 있고싶은 카페 야외자리 차지해보고 싶은 카페@@살짝 고급진 초코파이  스모어@@분위기 최고 ! @@장소가 너무 협소해요@@@@분위기 굿굿 @@라떼에 뭘 탄거죵?! 먹어본 라떼 중에 제일 존맛이에요 @@분위기 좋아요@@좋아요~~ 아이스라떼 너무 맛있었고 드립커피도 좋았습니다 직원분의 적당한 친절함도 좋았어요 근데 내부 자리가 협소한게 아쉬워요ㅠㅠ@@엄청 와! 나오는 맛은 아니어도 맛있음  분위기 외국 온 것 같음! 플랫 + 스모어 = ♡︎@@위커파크는 사랑입니다 메마른 삼거리의 유일한 감성존...@@Good 위치, 감성  Bad 양에 비해 다소 비싼 가격@@스모어!!@@커피가.. 이 가격할 만큼은 아닙니다. 플랫화이트가 라떼보다 더 우유맛을 내는.. 일부러 찾아갔고, 주차하면서 관리인의 불친절도 감당했는데 아쉽네요. @@초록초록 포토존이 있는 곳 원두의 산미가 강하긴 했지만 좋았어요. 워낙 작은 공간이고 의자는 좀 불편합니다.@@부드럽고 연한 커피@@실내는 아담하지만 야외에 앉아 이야기 나누기도 좋고 분위기도 좋아요 커피랑 디저트도 맛있어요@@@@여긴 라떼보다 플랫화이트. 근데 양 엄청 작다@@가야는이유 : 석촌호수에서 가기 좋은 카페 중 하나 안가는이유 : 커피는 연하고 조금 비싸고  플랫화이트 : 다른 곳의 라떼와 비슷한 정도, 플랫화이트 맛집이라고 말하는 이유가 아닐지 라떼 : 너무 연하여 커피맛을 알기 어려움 스모어 : 저렴한 핑거푸드로서는 좋지만 평범  스피커가 좋아 분위기는 좋으나 자리는 불편하고 문이 굉장히 세게 닫힘  @@스모어.. 다 아는 재료의 조합인데 여기서 먹으면 너무 맛있다.. 매장 안 분위기도 무언가 비 오는 날이 더 잘 어울리는@@모든게 다 좋았다@@커피는 조금 연한편이지만 맛있어요 매장이 조금 작은편이에요@@"
진대감 방이점,"육류,고기",02-416-2472,송파구,오금로13길 6 1층 (우)05548,#회식장소,3.7,19,"ㅜㅠㅠㅠ너무맛있지만 비싸서 안감...(죄송하지만 창렬 수준임;;) 똑같은 메뉴 파는 다른 식당으로 가게 되네요ㅠㅠ근데진짜맛남ㅎㅎ@@아니이...너무 맛잇는거 아니냐거!    말모 말모 말해모해... 넘나 마싯짜낭 ㅜ@@맛나고 직원분들도 아쥬 친절하셔요!  하지만 넘 비싸요 ,, ㅠㅠ 그래도 넘마시쪄@@@@맛있습니다@@차돌이 고소한게 맛나네요 차돌삼합조합이 좋아요@@맛있습니다 직접 고기를 구워주셔서 편안하게 먹을 수 있네여 재방문의사 있습니다@@@@맛있어요@@맛있지만 비싸@@맛나요맛나요! 직접 고기 구워줘서 편하구요, 볶음밥도 꼭 먹어야합니다~ 근데 고기 양이 적어서 아쉬워요ㅜ @@맛은 괜찮음.  아주머니가 살짝 반말함. 누가보면 공짜로 음식 주는줄. @@가격이 좀 비쌈. 차돌박이인지 우삼겹인지 헷갈리는데 직영점이니 차돌박이가 맞겠지? @@자금만 풍촉하다면 언제나 가고 싶은곳!@@@@음식맛은 좋습니다. 그렇지만..  1. 손님 응대가 마음에 들지 않아요. 바쁘신건 알지만 그 티를 너무 많이 보이시네요. 대기 손님 관리가 엉망이에요, 특히 아주머니 종업원은 영업 하실 생각이 없어보이세요, 본인 실수를 손님에게 전가하네요. 2. 사장님...홀이 바쁘면 테이블 순환이 잘 되도록 관리해주세요 고기만 굽지 마시구요, 그리고 방송타서 손님 앞으로...@@@@냉동인듯한 조개관자 얇게 썬데다 얇은차돌을 구워 나오는 반찬 몇가지를 순서대로 함께 먹는걸 삼합이라 하는데 맛은 그냥 그렇고 양도 몇점없이 창렬이고 가격은 애미없다. 딱히 누구에게 권하고 싶은 생각이 없다.@@@@"
