식당이름,카테고리,연락처,구,상세주소,해시태그,별점,별점수,리뷰내용
김시우초밥,"초밥,롤",02-6013-0206,중랑구,봉화산로 52 1층 (우)02088,#점심식사#혼밥#제로페이,3.4,29,"@@@@일쥬일에 한번씩 가는 회사 근처 맛집!!  나름 단골(유부초밥빼고 계란으로 알아서 바꿔주시는 정도)인데 불친절한 느낌 전혀없어요..!!!!!!   홀 직원분들 사람 몰리는 시간엔 말도 안되게 정말 바쁘신데 자기 할 일 묵묵히 최선을 다해 일하시고 ㅜㅜ  불친절한 모습 본적 없거든요!!!  어느순간 왜이리 별점테러를 당하는지 모르겠네여 ㅠ ㅠ  매일 줄서먹는...@@@@@@< 백신패스 없으면 홀에서 식사 못 합니다.> ( 미접종자는 아예 홀 식사가 안 됨)  자주 이용하던 소비자입니다. 수도권 방역패스는 미접종자 1인 + 접종완료자로 구성된 최대 6인 이하의 사적모임까지 허용하고 있습니다.  하지만 여긴 그것과 상관없이 백신패스가 확인이 안 될시, 즉 미접종자 1인(+접종완료자)는 홀에서 식사가 안 된다네요.  동선이 자주 ...@@맛있엇어요@@2021년11월14일 일요일 오후 7시반에 1인 방문하였는데 테이블 4인 2곳과 2인 2곳이 있는 상황에서 굳이 사람있는 테이블 옆에 앉으라해서 사람없는 2인 테이블에 앉는다고 하니 굳이 사람있는 2인 테이블에 앉으라고 하네요 얻어먹으러 간것도 아니고 위드코로나로 완하 됐다고 하지만 사람이 밀려올 시간도 아니고 영업에 방해되게 안는것도 아닌데 기분 굉장히 ...@@@@포장해와서 먹었는데 기본초밥이 만원! 이가격에 이 맛이라니...진짜 너무좋습니다 동네라서 이제 자주 가야겠어요~ 담엔 매장가서 우동이랑 먹어봐야겠음 ㅎㅎ@@아래 초심을 잃어버렸다는 후기에 공감해요 초밥은 맛있는데 장사가 잘되서인지 응대시 불친절한 느낌 받았어요..@@@@아주맛나고 가성비최고인데를만나  참 좋네요@@초심을 잃어버림... 매장에서 먹는데도 초밥 온도 너무 뜨끈함@@@@가성비좋음 1만원에 김시우초밥세트 10pcs 양 많고 우동도 아낌없이 건더기 넣고 생선들도 괜찮음 초밥세트로 배부르긴 오랜만 재방문의사 O 마끼 서비스 주심@@무난했습니다 제게는@@가성비 최고!! 동네 맛집이라고 아는 유튜버가 올렸길래 가봐야지 하다가 방문 해봤는데 맛있어요 미니우동 같이 주는데 생각보다 양이 많음! 한사람당 만원~12000원 정도면 맛있게 배부르게 먹을 수 있답니다 참고로 저희 엄빠 진짜 까다로운데....만족 잘 안하시는 분덜인데 여기 괜찮다고 재방문 의사 있다고 인정한 맛집이랍니당 + 주말은 웨이팅이 있었습니다!!@@불랙티임이 너무 긴것 같군요 @@갈때마다 만족스럽게 먹고 있습니다. 조금 아쉬운 점이 있다면 점심특선 초밥 구성에 가끔씩 변화가 있다면(혹은 선택지가 있다면) 더 자주 먹을텐데...라는 것. 사진은 점심특선 아닙니다.@@위생도 깔끔하고 맛도 좋고 양도 장난아니네요 ~ 스시한판에 미니우동 서비스  저렴한가격에 5가족이 맛있게 잘 먹고왔습니다~ 부모님오시거나 매장방문 또는 포장으로 찾아 갈것같아용♡@@저기요 밑에 토끼님 저 김시우입니다. 직원들 불친절 부분은 저번 님이 올린글 보고 최대한 교육중입니다. 카카오 리뷰같은 경우는 저희가 삭제하거나 따로 수정할수 없는 카카오의 고유 권한입니다. 허위 사실로 신고하였으니 착오없길바랍니다@@와 직원 불친절하다고 쓴거 싹 지웠네요?  얼탱이 없다 ㅋㅋㅋㅋㅋㅋ @@회도 신선하고 초밥이 부들부들 진짜 맛있었어요 회덮밥에 야채 많고 양념장도 상큼해서 맛있어요 서비스도 주셔서 맛있게 먹었어요 자주 갈것같아요 @@@@가성비 좋네요. 잘 먹고가요@@가성비킹에다가 맛도 최고@@소고기 초밥 빼곤 다 맛있어요 돈까스도 수준급 이에요 다만 최근엔 점점 초밥 간이 세지는거 같아요...@@서비스 많이 주고 맛도 괜찮음.@@"
한도니 신내동직영점,"육류,고기",02-436-2292,중랑구,봉화산로54길 32 A동 1층 (우)02067,#친목모임#회식장소#카카오페이,3.6,11,"삼겹살, 특수부위, 갈매기살등 고기가 다양하게 있어서 좋아요.... 직원분들이 고기도 직접 다 구워주시고 친절하십니다! 라면, 햄도시락도 같이 먹고 싶으면 여기로 오세용@@장점 : 맛,무료 아이스크림 단점 : 양?@@괜찮네요@@@@직원들 바꾸거나 교육시켜야 겠어요..  다른분 리뷰에서 언급된 마스크 미착용..  나도 봤어요. 주방아줌마 스피커폰으로 목청껏 통화. 주방에서 고기 나가는거 무게 확인하면서.. 마스크 미착용에 고성방가? 헐ㅋㅋ 고기담는 손은 한손만 비닐장갑.. 결국 맨손으로 같이 고기담고..  아무리 불에 굽는다 해도 거슬리더군요.  홀서빙 남자직원도 주방 앞에서 벗고 있...@@오늘 처음 방문했는데, 생고기에 고기는 맛있게 먹었습니다. 숯불에 먹으니 더 맛났구요. 근데... 음식하시는 주방에선 마스크를 전혀 쓰지 않으시더라구요, 주방안에서 음식 담으시며 스피커폰으로 마스크는 아예 없이 통화도하시고.. 앞에 정수기에 물가지러 나오실때도 마스크는 아예 없었습니다. 코로나 시기에 마스크 자체가 없는건 좀 그런거 같습니다. 알바 한분도 ...@@개존맛 고기 쫄깃쫄깃 육질 오지고 밑반찬 다 조온맛임@@진짜맛있고 직원분들이 친절하세요!@@맛있어요.@@맛있고 괜찮음!@@아주 맛나요@@"
크리스탈,분식,,중랑구,봉우재로70길 93 (우)02175,#카카오페이,4.2,15,"@@@@야끼만두안먹는데, 여기는 진짜 맛있어요. 엄청 바삭해서 국물에 찍어먹어도 맛있고, 떡볶이 국물에 담궈놨다 먹어도 바삭한 맛이 남아 있어서 맛있더라구요.  여기 정말 추천해요!! 가격도 저렴하고 좋네요.  포장해서 집에서 사리 추가해서 먹으면 되니까 좋네요@@튀김만두가 공장에서 떼오시는게 아니라 사장님 남편분이 빵집 하셔서 직접 만들어오신다고 들었습니다ㅋ 포장해올 때마다 만두만 30개 시키는...ㅎㅎ 저멀리 이사가도 또 먹으러 가고 싶은ㅠ 그런 곳입니다ㅠ@@국물이 ㄹㅇ 진국 사리 엄청 추가해서 둘이 배부르게 먹고 9천원 나옴@@전국에 유명하다는 떡볶이좀 먹어봤는데 여기는 어나더레벨임. 가성비좋고 말랑말랑 밀떡 덕후라면 마력이.빠질수밖에 없는맛. 너무유명해지면 싫은 나만알고싶은 맛집! 저녁6시반에.닫는다. 주차도 안된다.그치만.또 가고싶다!!볶음밥없고 마무리 빙수가 예술~!@@즉석떡볶이는 여기가진리! 포장도가능!@@즉석떡볶이는 이곳^^ @@싸고 친절하고 맛있음 포장해서 집에서 뚝딱 해먹기 좋음@@떡볶이 고르는데 주문서 얼른주세요;; 하면서 짜증섞인 말투로 말씀하시네요 불친절해서 다신 가고싶지않습니다.. 기분좋게 와서 망치고갑니다@@학교 근처여서 저렴하고 맛있어요. 기본 2인분부터 주문 가능하고 카드 결제가 안돼요. 가게는 좁은 편이지만 테이블이 밖에 두 개 정도 있고 방도 따로 있어서 먹고 가기에 불편하지는 않아요. 가성비 좋고 중독성이 강한 맛이지만 위생적이지 않고 탈세의 찝찝함이 있어서 아쉬워요. 짜짱떡볶이에 쫄면사리 야끼만두 추가 필수!@@떡복이 맛있어요@@@@식기 전에 먹어야 함. 안그러면 너무 짜요 가격은 학생들을 위해 맞춰져서 싼 편 튀김만두는 넣지 말길. 만두소 없는 그냥 튀김@@짜장떡볶이 굿. 떡은 쫀득하고 계란은 맨반석 계란같은데 부숴서 국물에 비벼먹으면 맛있다. 만족@@"
스타벅스 사가정역점,커피전문점,1522-3232,중랑구,면목로 310 (우)02249,#카카오페이,3.0,21,"스벅은 비싸서 거의 안 오는 편인데 카페 분위기는 대체로 좋다. 오늘 어쩌다가 시간 때우러 왔다. 시원한 것을 좋아해 돌체 라떼 아이스를 시켜 마시는데 처음엔 뭔가 이상했다. 가만 보니 맥도날드에서 콜라에 넣는 것 같은 납작 얼음을 사용했다. 빨대 보다는 입으로 마시는 것을 좋아해 그렇게 마시니 얼음이 납작해 더 방해가 된다. 근데  한 시간 남짓 지나니 ...@@주문받는 남자 파트너 기분 나쁠정도로 불친절 뭘 물어봐도 대답도 귀찮은듯 건성으로 하시고 이분 때문에 오기싫어지네요 그외 제조해주시는 파트너 분들은 친절해요@@모든 스벅을 가본건 아니지만, 다녀본 곳 중 사가정이 최악인듯.. 스벅 체인점은 친절이 상향평준화돼있어서 더 비교되는데 바로 앞에있는 개인 작은커피집들보다도 못함 일단 주문을 제대로 안받고 주문확인하는거 상당히 짜증내면서 함 여러모로 다시는 오기싫은곳.. 주문파트너는 제일 먼저 고객이랑 마주하니 현재 주문자를 제조파트너랑 바꾸는 게 나을듯 그나마 제조하고 ...@@@@친절@@세성에서 제일 쓸데없는걱정 스벅걱정@@응대해주시는 여성 직원분께서 매우 친절하셨어요! 매장도 넓고 좋아요~~~@@예전에 잘 못 계산된적 있음. 사가정점은 되도록 안가려고함.  @@친절하고 굿. 다만 사람이 많아 화장실이 좀..@@친절했어요~@@직원들 인심이 좋은곳@@매번 불쾌하게 응대하는 파트너 한두명 때문에 좋게 평가를 할 수가 없어요..@@진심 제일별로@@한 층이지만 넓어서 좋음.@@메뉴가 다양하지 않아 아쉬웠는데... 점원들이 일하기 싫은 듯....@@매장은 동네 스벅치고 넓어서 좋은데, 남자 파트너들이 좀 불친절함.. 제조음료도 커피빼곤 별로.. 성의껏 일했으면@@이제껏 가본 스벅 중 가장 불친절하고 도떼기 시장 같음. @@사람이 너무 많아서 정신없어서 그냥 나옴... 시장통같음... 어둑어둑하구... 싫었음 여기 가느니 근처 카페베네나. 엔젤리너스 가겠음@@이 매장에서만 음료가 잘못나온적이 3번이나 있음... 특히 커스텀했을시 잘 확인하시길 좌석도 넘 따닥붙어있어서 사람많을땐 시장통같음ㅠㅠ@@넓고 써비스만족 청결함@@굿이요 인테리어가 맘에들어요ㅎ@@"
망우찜쌈밥,쌈밥,02-437-0175,중랑구,용마공원로2길 11 (우)02182,#안심식당#제로페이,4.4,16,"미랑이랑 추억만들기@@@@정말 최애예요 망우에서는 무조건 최애@@@@@@가성비완벽@@걍 그래요,,왜 인기많은지 모르겠어요,,@@맛있오@@@@맛있어요! 근데 삼겹살을 국내산으로 바꾸면 이 가격이 안나올까요? 다행히 아직까지 고기에서 냄새 느껴본 적은 없어요 홀이랑 배달 이용 했었는데 두 번 다 만족스러웠습니다@@고기에서 잡내가 좀 남@@맛있어요@@@@찜쌈밥최고죠!@@야채도 신선하고 삼겹살이랑 훈제오리 모두 맛남@@가성비 좋아요. 근데 가면 맛있어서 과식하면 도루묵@@"
여자만아구해물찜,아구,02-434-5954,중랑구,동일로 685 (우)02129,,3.6,13,네 안짜고 처음갔는데 맛있었어요@@주변 지인들 다 데려갔는데 비린내 없고 맛있다고 재방문하는 곳 .. 솔직히 아구찜 이 가격에 이만큼 주는 곳 없음 ㅜ ㅜ @@계속계속 생각나는 맛이에요!!! 자극적이지않고 매콤해서 계속 들어가요ㅜㅜ @@양 많고 맛있어요! 점심세트 7000원에 이정도 양이면 아주 상당합니다...크으@@양이 적은데 가깝고 가격이 저렴하네요 @@아구를 많이 주기는 하는데 너무 싱겁네요 찜도  복음밥도 다 싱거워요@@너무나 평범한 맛@@볶음밥 꼭 드세요!!!!!!!!!!!!!@@아구찜 매콤한게 맛있네요@@이정도 별점이면 레전드집인가 하여 찾아갔지만 기대가 컸던 탓일까 실망하였다 양은 정말 많고 다른 집들과 다르게 아구가 많고  콩나물이 적은점에서는 칭찬 하지만 아구살이 질겼다 (냉장이 맞는지 의문) 그리고 맛있게 매운맛은 아니었다 1단계도 매운걸 못먹는 나에겐 너무 매워서 속이쓰렸다  @@+아낙찜 그냥 무난무난함. @@@@@@
브라더야끼,"육류,고기",02-972-9500,중랑구,"숙선옹주로 6-9 묵동자이1단지 1층 119, 120호 (우)02033",#데이트코스#제로페이,4.6,25,"@@양고기, 해물스튜 다 맛있었어요 >.<  직원분들이 다 구워주시니까  맛있게 먹기만 하면 됩니다 ㅎㅎㅎ  동네 맛집을 넘어서는 퀄리티!!!@@친절하고 맛있어요 @@토마토스튜@@동네에 이런 맛집이 있다니 분위기 맛 모두 좋아요! 양고기랑 소고기 모두 맛볼수있어서 양고기 싫어하는 친구랑 와도 괜찮을것 같아요 마지막 토마토 스튜 느끼함을 싹 없애주니 최고다요@@아 이건좀.. 너무맛있어서..황당@@아........나만 알고 있었어야 했는데.........@@양갈비,한우,짬뽕,야끼니꾸 진짜 가서 메뉴 거의 다 뿌셨는데 진심 개개개개개개존맛..  다 구워주셔서 너무 편하게 식사하고왔어요♡ 사장님 유명해져서 웨이팅하능건... 너무너무 싫지만.. 이런집은 돈쭐내줘야 합니다 여러분￦￦￦￦￦￦  사는동안 적게 일하시고 많이 버세요!!! 사진보니까 너무 먹고싶어서 조만간 또 갈게요>_<!!!@@와이프랑 오붓하게 맛있는고기가 먹고싶어 찾다가 발견한 맛집~! 사장님 친절하고, 고기가 정말 맛있다! 분위기랑 맛있는고기 먹고싶은분께 강추!!  @@내 인생 최고의 양갈비 소고기 오래오래 장사해주시길 바랍니다. 재방문 할께요!@@처음부터 끝까지 꾸어주시니까 뭐 그냥 먹기만 하면 되는 시스템... 양고기 오마카세..... 여기서 고기먹고 다른데서 못먹고 있어요... 책임져요 사장님.. 먹을 때 마다 감동... 하이볼 맛집... 화요 맛집... 술이 술술술... 차라리 다행이예요... 휴 집 앞이였음 월급 탕진.... 철학있는 사장님... 부자되세요........ 진짜 찐 맛집... ...@@중랑구 묵동의 숨은맛집!!  양고기 진짜 잘하는집 바로 여기입니다!!  양고기는 완전부드럼@ 가격은 완전착함@ 위생또한 철저@ 사이드메뉴 맛 또한 한번 더 놀람!!!  ㅎㅎ 진심 인생맛집 ㅎㅎ 특히 고기굽기 똥손들도 사장님이 직접 맛있게 구워주는 고기를 츄루릅 ㅎㅎ 아주 맛있게요ㅎㅎ 항상 맛있게 잘 먹고 있습니다ㅋㅋ  코로나여서 힘들지만 화이팅 하세요!@@양고기는 손도못대던 제가 유일하게 먹는 양고기집이에요! 직접 구워주셔서 더 맛있게 먹을수밖에 없구용~ 여기메뉴에서 스튜나 짬뽕이랑도 같이먹으면  진짜 술이 더 술술 넘어가요ㅋㅋㅋㅋㅋㅋ 여긴진짜 왕추천!!!!♥♥@@사장님이 너무 잘생기고 친절해요~  급하게 먹느라  사진찍을 틈도 없었네요ㅠ 또 갈께요~ 양갈비 맛집~!!@@양고기를 좋아해서 여기저기 많이다녀봤는데 솔직히 여기만한데 없어요 사장님 오래오래 장사해주세요@@양고기와 아스파라거스는 언제나 완벽!@@@@개존맛 무조건가세요!!!!!! @@제가 양을 여기서 처음 먹었는데 다른곳가서 못먹겠어요  양 소 마지막 사이드 메뉴까지 ㅠㅠ 너무 맛있어요  냄새도 안나고 일단 직원분과 사장님이 너무 친절하구  잘구워주셔서 고기맛이 두배 !!넘사벽입니다*^^* @@자주 가는데, 가끔 질긴 고기가 나오고, 싼 사이드 메뉴는 안된다고 해요. 그때 그때 달라서 일정하지 않아서 아쉬워요.@@근방 고깃 집중에서는, 넘사입니다@@분위기 좋게 한잔? ㅎㅎ@@맛있음@@ㄱ@@@@"
모이카페,카페,070-4230-0404,중랑구,용마산로125길 108-17 (우)02058,#로스팅전문#핸드드립전문점#제로페이,4.4,5,매장도 크고 주차도 편하고 커피도 맛있어요~~~~@@©2021. ethwang All rights reserved. @@시내에 이정도 주차장이면 만족@@수플레 먹겠다고 일부러 찾아갔는데 3시?이후로는 안한다고해서 당황했어요. 알고보니 브런치메뉴이던데 몇시까지 주문 가능하다고 안내했으면 좋았을거같아요.  음료는 평범하고 빵도 파는데 평범해요. 굳이 찾아갈정도는 아니지만 카페가 넓고 주차하기 좋다는 장점은 있어요.@@사장님도 친절하시고 매장도 넓고 깔끔해요.  외진 곳에 있긴 하지만 주차공간도 넓어서 자주 올 것 같습니다.@@
산채가,한식,02-948-1138,중랑구,동일로157길 30 (우)02007,#카카오페이#제로페이,4.1,10,"와우 칠천원이라뇨 ^0^ 먹골역 혼밥성지@@확실히 음식은 맛있다, 가격대비 푸짐하고 맛있는곳. 그런데 서비스와 청결이 음식맛을 해치는구나, 가족끼리 운영하는듯하나,, 아주머님의 뛰어난 음식솜씨가 아깝다, 손님이 들어와도 자리안내는 커녕 본척도안한다. 본래 친절하지않고 청결이 문제가있으면 별점2개이하로 주려했으나 주인장 아주머니 음식솜씨가 너무 아까워 3개주고간다,@@모두 입에 맞아요 맛있어요 다음에 또 오겠습니다.  @@쌈채소에 달팽이가 나왔어요 산채가쌈밥정식먹었는데 일반정식과 2천원차이인데 다 마른 쌈채소 몇장추가되는게 다네요  깜짝놀라서 말씀드렸는데 사과도없고..... 제육볶음도 작은접시에 조금주는데 옆에 2인이랑 3인 차이가없네요 제로페이 가맹도 아니고요 @@맛있어요! @@항상 맛있어요 오늘도 먹으러갈거임@@동네 맛집. 친절하진 않지만 해줄건 해주는 전형적인 한국식 밥집이다. 혼밥 메뉴는 곤드레나물밥이랑 묵은지찌개 2가지 뿐인데 주말 저녁에 혼자 가면 부루퉁하게 음식을 차려준다. 가족단위로 많이 오고 4인석 밖에 없어서 이해는 한다. 혼자 가도 반찬 많이 주고 즉석에서 끓여먹는 된장찌개도 나온다. 반찬이 내 입맛에는 좀 짠 편이지만 맛은 좋다. 동네에서 건강한...@@어줍잖게 유명하다고 소문내는 한정식집 보다 맛있다.@@집밥느낌 곤드레밥 더덕버섯밥 고구마흑미밥 다 먹어봤어요 ㅎㅎ 곤드레묵은지 찌개도 맛있오요 제육은 반찬 정도로 나오는지라 메뉴명에 써있기는 좀 무색한데 ( 괜히 많이 나올걸 기대함 ㅎㅎ), 손님이랑 갈때 만원주고 제육추가하니 딱 좋더라구요 @@맛있어요.@@"
스타벅스 중랑구청점,커피전문점,1522-3232,중랑구,신내로 72 (우)02069,#카카오페이,4.3,7,요즘 오전에 카운터 보는 서버 진짜 브랜드망신.. 엄청 불틴절함. 그냥 멀어도 상봉점 갈래여@@스타벅스 중랑구청점 방문한컷입니다^^ 직원들도 친절하구 상냥하구 매장분위기 좋구 가성비갑 가성비굿~^^ㅎㅎ 자바칩프라푸치노 잘먹었어요ㅎㅎ 여기 강추입니다ㅎㅎ@@공부하기 편한자리가 많이없어 아쉽지만 접근성은 좋은곳@@커피와 디저트 쿠폰을 선물로 받았던 게 몇 장 있었는데... 오늘 가서 다른 디저트 종류로 부족한 금액만 추가로 결제해서 교환해왔어요..  사실 스타벅스 갈 일이 별로 없어서 쿠폰은 어떻게 사용하는 건지도 몰라 약간 긴장했었는데 여자 직원분이 친절하게 계속 미소로 응대해주셔서 얼마나 고마웠는지 몰라요..^^  그리고 주문한 디저트 포장해주신 남자 직원분도 ...@@신내동 어머님들의 모임장소ㅋㅋ@@아침일찍부터 11시까지 오픈하는 깔끔하고 훌륭한 스타벅스@@커피맛 단연최고입니다@@
먹거리집,순대,02-493-3100,중랑구,면목로91길 8 (우)02137,#노포,2.2,13,"맛은 있었으나 위생이 의심됨,,(먹고 탈남,,)@@@@@@@@위생 안좋아요@@지금 리모델링해서 건물 이전한거 잘 선택하신듯.. 이 리뷰보시면 국밥 드실 때 간마들 추가로 꼭 넣어달라고 하세요  환상의 세계를 맛 봅니다@@전 간간하니 좋던데요@@@@진짜 저 세상 위생...시멘트 바닥에 널브러진 식재료...(심지어 손님지나다니는곳에) 한입도 대기싫었고 지금 바로옆으로 이전했지만 여전히 안가게 됨..@@모듬 중 오소리감투 많이 달라면주심 술국도 조금 뚝배기에주심 @@저는 여기 말고 다른데 갑니다  차라리 여기서 좀 걷지만 #부대닭 으로 오세요.  국물도 고소하고 머릿고기 실하게 들어 있어요.@@순대국 여려곳먹어봤지만 이곳 최악입니다. 칠천원 순대국에 엄청작은 당면순대 두개 들어있었구요 고기에서는 냄새가 났습니다.  뚝배기 자체도 작아서 국물도 적었는데 벽에 국물 추가는 안된다고 써있구요.  추가 김치깍두기마늘고추 셀프이고 밥도 가져다먹을수있는것 좋지만 그렇게 맛없는 순대국은 처음이였네요. 순대국 드시러가는거면 절대가지마시길...@@순대국이 이러기도 정말 쉽지 않아요. 위생. 순대냄새. 등등 순대국 반도 안먹고 나오기는 처음이네요@@"
감자바우묵동영양족발,"족발,보쌈",02-972-9566,중랑구,동일로 946 (우)02033,#제로페이,3.4,14,"맛있습니다@@여전엔 일주일에 한번은 가던곳 이사간후 근처 지나갈땐 꼭 포장해갑니다 @@옛날맛이 아니예요.@@최근에 주인이 바뀌었는지 족발 냄새 심하고 예전같지 않아서 아쉬움@@냄새남...신라왕족발 시켜 먹을래요...@@@@@@대자로 시켜야지 앞발로 먹을 수 있음. 직원분들은 적당히 친절함. 달라는거 다 주심. 족발 너무 부드럽고 맛있음. 포장, 배달보단 홀에서 먹어야 제맛. 주차는 건물 지하 주차장 이용 가능요. @@먹을만하다. 양은 다른곳 중자. 이모들 서비스마인드 하. 이상끝@@맛있음 양은 좀 더 많았으면 좋겟음@@그래 여긴 맛있다.@@맛있어요. 족발은 요기에서만 먹어요@@@@@@"
대박왕곱창,"곱창,막창",02-491-6405,중랑구,답십리로 367 (우)02246,#제로페이,4.8,17,"별점 보고 왔는데 별점 줄만함. 맛도 좋고 가성비 매우 최고. 볶음밥에 오돌뼈 고기 들어가다니.. 친절하고 좋았음.@@이 동네 이사와서 주에 최소 한 번은 가는 곳이에요!! 너무 좋아요@@야채곱창이랑 막창 포장이었었는데....이제 다른 가게 못갈듯... 진짜 맛있었어요... @@맛 , 양 , 가격 모두 가성비 있음. @@맛있게먹고와따요@@냄새 안나고 맛있어요@@깨끗하고 맛있어요^^@@존맛@@야채곱창은 짜고 누린내남 왕곱창이 맛있음 @@사실 곱창 잘못먹으면 입에서 누린내나는데  이집은 그런거 하나도 없고 쫄깃하고 너무 맛있읍니다 거기에 사장님및직원분들 친절하셔서 또 방문하고 싶습니다.@@누린내 1도 없고 양념이 아주 맛깔납니다^^ 소금구이도 맛있어요~@@@@@@@@10여년쯤 먹고 있어요. 여기 대존맛 집입니다~! 양이 굉장히 많아서 친구들끼리 소주 마시러 갈때 딱이에요. 여기 소개해주고 욕먹은 적이 한번도 없어요! 매번 올 때 마다 상추도 싱싱하고 맛있어요. 그리고 볶음밥은 무족권 드세요! 완전 대존맛임!!@@매번 아이들과 사먹는 곳인데 넘 맛있고 ~~ 계속 가고 싶은 곳이예요~^^@@대박....@@"
유정역,"육류,고기",02-3423-3600,중랑구,신내로 193 1층 (우)02024,#가족모임#점심식사#점심특선#친목모임#회식장소#제로페이,3.6,5,맛은 평범했지만 ‘한우국밥’이라기엔  그저 고사리와 달걀이 안 들어간 육개장이라 2점 (+간이 꽤나 짠 편)@@사장님 불친절합니다@@등심도 맛있고 돼지갈비도 맛있고 두목살까지 정말 맛있는 집입니다 1인당 1그릇씩나오는 미역국 또한 일품이며 무생채도 끝내줍니다~@@갓 한 우@@소고기는 옳다@@
